,Unnamed: 0,Unnamed: 0.1,Unnamed: 0.1.1,author_id,date_review_posted,review_title,reviews,verified_purchase,people_find_helpful,ratings,product_url,start,end,reviewer_name,product_category,product_id,subproduct_id
0,0,0,0,AF6RIEEAXZX3NIJZ5LPYEW6YUWQQ,"April 29, 2020",Great!,Works well.,yes,0,5.0,https://www.amazon.ca/Hori-Playstand-Case-Nintendo-Switch/dp/B01N9RTMWS/ref=cm_cr_srp_d_product_top?ie=UTF8,2020-09-18 15:00:39.259355,2020-09-18 15:00:47.550222,Becky,Clothing & Accessories,B002G9UDYG,B01N9RTMWS
1,1,1,1,AF6RIEEAXZX3NIJZ5LPYEW6YUWQQ,"April 29, 2020",OK,"It will stick to my eyelid more than the lash, and it's hard to get off even with makeup remover. Black colour should blend in better with lashes and eyeliner, but this is more of a grey, not black. Still works.",yes,0,4.0,https://www.amazon.ca/Striplash-Eyelash-Adhesive-Water-Solution/dp/B0012IN8Q2/ref=cm_cr_srp_d_product_top?ie=UTF8,2020-09-18 15:00:54.642680,2020-09-18 15:01:02.888195,Becky,Clothing & Accessories,B002G9UDYG,B0012IN8Q2
2,2,2,2,AF6RIEEAXZX3NIJZ5LPYEW6YUWQQ,"April 29, 2020",A little wobbly,"A little wobbly, but great brightness for what you pay. HOWEVER, the phone holder constantly slips down, and needs a more secure attachment.",yes,0,4.0,https://www.amazon.ca/UBeesize-Ringlight-Photography-Compatible-Upgraded/dp/B07GDC39Y2/ref=cm_cr_srp_d_product_top?ie=UTF8,2020-09-18 15:01:12.980917,2020-09-18 15:01:22.250735,Becky,Clothing & Accessories,B002G9UDYG,B07GDC39Y2
3,3,3,3,AF6RIEEAXZX3NIJZ5LPYEW6YUWQQ,"April 29, 2020",Cute!,"Lovely colour, sturdy case with a great holder for your apple pen. Doesn't stand up as well as I'd like though.",yes,0,5.0,https://www.amazon.ca/Ztotop-10-5-Pencil-Trifold-Protective/dp/B07HHN76WD/ref=cm_cr_srp_d_product_top?ie=UTF8,2020-09-18 15:01:32.339593,2020-09-18 15:01:40.649565,Becky,Clothing & Accessories,B002G9UDYG,B07HHN76WD
4,4,4,4,AF6RIEEAXZX3NIJZ5LPYEW6YUWQQ,"April 29, 2020",Great for drawing,"Cleaning up drawings, using references, animating etc. are all things you can do with this, and for the price it's an affordable investment.",yes,0,5.0,https://www.amazon.ca/Picture-Portable-Advanced-Hi-Mid-Low-Brightness/dp/B07624XKR8/ref=cm_cr_srp_d_product_top?ie=UTF8,2020-09-18 15:01:47.741422,2020-09-18 15:01:54.000091,Becky,Clothing & Accessories,B002G9UDYG,B07624XKR8
5,5,5,5,AF6RIEEAXZX3NIJZ5LPYEW6YUWQQ,"April 29, 2020",Comfy,"They don't last me longer than a year typically, but are comfortable and prevent you from dropping your phone on your face. A little expensive for what it is.",yes,0,5.0,https://www.amazon.ca/PopSockets-Expanding-Smartphones-Tablets-Marble/dp/B01M1GOYZL/ref=cm_cr_srp_d_product_top?ie=UTF8,2020-09-18 15:02:02.085775,2020-09-18 15:02:09.353111,Becky,Clothing & Accessories,B002G9UDYG,B01M1GOYZL
6,6,6,6,AF6RIEEAXZX3NIJZ5LPYEW6YUWQQ,"April 29, 2020",Great quality!,"Nice video and audio quality, and super easy setup with the adjustable mount. Looks sleek on top of monitor.",yes,0,5.0,https://www.amazon.ca/Logitech-C920-Webcam-Pro-960-000764/dp/B006JH8T3S/ref=cm_cr_srp_d_product_top?ie=UTF8,2020-09-18 15:02:16.447071,2020-09-18 15:02:23.713552,Becky,Clothing & Accessories,B002G9UDYG,B006JH8T3S
7,7,7,7,AF6RIEEAXZX3NIJZ5LPYEW6YUWQQ,"April 29, 2020",Nice keyboard,"Satisfying clack-y noise, great customization options with Synapse, and comfortable.
I do find I miss a key here or there because I'm used to a more condensed laptop keyboard.
Nice for gaming, chatting on Discord, homework, etc.",yes,One,5.0,https://www.amazon.ca/Razer-Cynosa-Chroma-Spill-Resistant-Individually/dp/B075KMZ4MX/ref=cm_cr_srp_d_product_top?ie=UTF8,2020-09-18 15:02:30.806065,2020-09-18 15:02:38.118260,Becky,Clothing & Accessories,B002G9UDYG,B075KMZ4MX
8,8,8,8,AF6RIEEAXZX3NIJZ5LPYEW6YUWQQ,"April 29, 2020",Size up if you got a big booty,"I am usually a small, but I got a medium and am glad I did. :)
Bought for a halloween party that I didn't end up going to. Oh well.",yes,0,5.0,https://www.amazon.ca/Diamondkit-Womens-Mermaid-Shorts-Medium/dp/B07DB2BCV5/ref=cm_cr_srp_d_product_top?ie=UTF8,2020-09-18 15:02:46.203911,2020-09-18 15:02:54.477815,Becky,Clothing & Accessories,B002G9UDYG,B07DB2BCV5
9,9,9,9,AF6RIEEAXZX3NIJZ5LPYEW6YUWQQ,"April 29, 2020",Nice mouse,"The only better mouse would be a fluffy real one.
But this mouse has great customization options with Synapse, and super comfortable with a great range of DPI.",yes,0,5.0,https://www.amazon.ca/Razer-DeathAdder-Elite-Mechanical-Ergonomic/dp/B01LXC1QL0/ref=cm_cr_srp_d_product_top?ie=UTF8,2020-09-18 15:03:03.566492,2020-09-18 15:03:09.827800,Becky,Clothing & Accessories,B002G9UDYG,B01LXC1QL0
10,10,10,10,AF6RIEEAXZX3NIJZ5LPYEW6YUWQQ,"April 29, 2020",Gift,Ordered for my brother's vinyl collection. He likes it!,yes,0,5.0,https://www.amazon.ca/Amerijuanican-Vinyl-Bongzilla/dp/B000AXS6MQ/ref=cm_cr_srp_d_product_top?ie=UTF8,2020-09-18 15:03:19.922284,2020-09-18 15:03:26.176045,Becky,Clothing & Accessories,B002G9UDYG,B000AXS6MQ
11,11,11,11,AF6RIEEAXZX3NIJZ5LPYEW6YUWQQ,"April 29, 2020",Awesome case,"I ordered this one for my ex. I would give my ex negative stars, but this case is great.
I have the same case and it lasted me years before eventually cracking around the edge, for good reasons (I throw my phone around quite a bit on the farm). Durable, chunky yet not too big to fit in a pocket, and looks cool.",yes,0,5.0,https://www.amazon.ca/OtterBox-DEFENDER-iPhone-Case-Packaging/dp/B00Z7SHCC4/ref=cm_cr_srp_d_product_top?ie=UTF8,2020-09-18 15:03:35.270442,2020-09-18 15:03:44.534177,Becky,Clothing & Accessories,B002G9UDYG,B00Z7SHCC4
12,12,12,12,AF6RIEEAXZX3NIJZ5LPYEW6YUWQQ,"April 29, 2020",Cute!,Bring back the 80s :D,yes,0,5.0,https://www.amazon.ca/KECUCO-Scrunchies-Elastic-Scrunchy-Accessories/dp/B07QJVF4DW/ref=cm_cr_srp_d_product_top?ie=UTF8,2020-09-18 15:03:52.625767,2020-09-18 15:03:58.917301,Becky,Clothing & Accessories,B002G9UDYG,B07QJVF4DW
13,13,13,13,AF6RIEEAXZX3NIJZ5LPYEW6YUWQQ,"April 29, 2020",Headphone connection iffy,"For my headset, I needed to plug the USB directly into my laptop or else it would cut in and out.
Other things such as webcam, keyboard, and mouse worked fine! The on/off buttons are a nice touch.",yes,0,4.0,https://www.amazon.ca/Sabrent-4-Port-Individual-Switches-HB-UM43/dp/B00JX1ZS5O/ref=cm_cr_srp_d_product_top?ie=UTF8,2020-09-18 15:04:08.005885,2020-09-18 15:04:15.322978,Becky,Clothing & Accessories,B002G9UDYG,B00JX1ZS5O
14,14,14,14,AF6RIEEAXZX3NIJZ5LPYEW6YUWQQ,"April 29, 2020",Does the job!,Good cord length if you need something to plug in behind a dresser. Lots of space for the many lights in my room and chargers.,yes,0,5.0,https://www.amazon.ca/AmazonBasics-6-Outlet-Surge-Protector-Power/dp/B07NSJMSK3/ref=cm_cr_srp_d_product_top?ie=UTF8,2020-09-18 15:04:22.419193,2020-09-18 15:04:28.697269,Becky,Clothing & Accessories,B002G9UDYG,B07NSJMSK3
15,15,15,15,AF6RIEEAXZX3NIJZ5LPYEW6YUWQQ,"April 29, 2020","Embrace your VSCO girl, or whatever","The spray isn't as fine or misty as I'd like. Watch out if you try set makeup with this, as you will probably get a few fat droplets from it.
For a refreshing spray, it's nice. I like the green and pink one's smell, but the purple is a little weird.",yes,One,5.0,https://www.amazon.ca/Mario-Badescu-Spritz-Mist-Facial/dp/B07P3MFX8P/ref=cm_cr_srp_d_product_top?ie=UTF8,2020-09-18 15:04:38.791869,2020-09-18 15:04:45.096013,Becky,Clothing & Accessories,B002G9UDYG,B07P3MFX8P
16,16,16,16,AF6RIEEAXZX3NIJZ5LPYEW6YUWQQ,"April 29, 2020",Cute,"If you're gonna be basic, might as well get this hat because it looks great on literally everybody.",yes,0,5.0,https://www.amazon.ca/Carhartt-Acrylic-Watch-Black-Size/dp/B002G9UDYG/ref=cm_cr_srp_d_product_top?ie=UTF8,2020-09-18 15:04:55.187077,2020-09-18 15:05:04.472627,Becky,Clothing & Accessories,B002G9UDYG,B002G9UDYG
17,17,17,17,AF6RIEEAXZX3NIJZ5LPYEW6YUWQQ,"April 29, 2020","Soft, pretty, cozy!",Beautiful purple blanket. I use it as a throw instead of getting a new comforter to match my purple themed bedroom. Very soft.,yes,0,5.0,https://www.amazon.ca/VEEYOO-Flannel-Fleece-Blanket-King/dp/B07CVBLZD4/ref=cm_cr_srp_d_product_top?ie=UTF8,2020-09-18 15:05:12.563821,2020-09-18 15:05:21.849667,Becky,Clothing & Accessories,B002G9UDYG,B07CVBLZD4
18,18,18,18,AF6RIEEAXZX3NIJZ5LPYEW6YUWQQ,"April 29, 2020",LOVE!,So happy with it <3 Must-have game!,yes,0,5.0,https://www.amazon.ca/Nintendo-HCCPACBAA-Animal-Crossing-Horizons/dp/B0812KNJDD/ref=cm_cr_srp_d_product_top?ie=UTF8,2020-09-18 15:05:28.941278,2020-09-18 15:05:36.238626,Becky,Clothing & Accessories,B002G9UDYG,B0812KNJDD
19,19,19,19,AF6RIEEAXZX3NIJZ5LPYEW6YUWQQ,"April 29, 2020",I like it,"Comfortable, super adjustable, and a good accessory to take a grunge outfit to the next level.",yes,0,5.0,https://www.amazon.ca/Casual-Outdoor-colors-Canvas-Flip-Top/dp/B073XHPGL4/ref=cm_cr_srp_d_product_top?ie=UTF8,2020-09-18 15:05:44.328359,2020-09-18 15:05:50.607915,Becky,Clothing & Accessories,B002G9UDYG,B073XHPGL4
20,20,20,20,AF6RIEEAXZX3NIJZ5LPYEW6YUWQQ,"April 29, 2020",It's a net.,What more is there to say? Good!,yes,0,5.0,https://www.amazon.ca/Penn-Plax-Quick-Net-5-Aquarium-Net/dp/B0002APXKK/ref=cm_cr_srp_d_product_top?ie=UTF8,2020-09-18 15:05:59.702067,2020-09-18 15:06:07.994094,Becky,Clothing & Accessories,B002G9UDYG,B0002APXKK
21,21,21,21,AF6RIEEAXZX3NIJZ5LPYEW6YUWQQ,"April 29, 2020",Pretty!,"Bright purple lights with multiple settings for flashing, twinkling, etc. Note that if you select purple, that's the only colour it will turn!
Makes my room have a beautiful purple glow.",yes,0,5.0,https://www.amazon.ca/Fairy-Curtain-Lights-Background-Festival/dp/B07PHT69R3/ref=cm_cr_srp_d_product_top?ie=UTF8,2020-09-18 15:06:18.079339,2020-09-18 15:06:24.328751,Becky,Clothing & Accessories,B002G9UDYG,B07PHT69R3
22,22,22,22,AF6RIEEAXZX3NIJZ5LPYEW6YUWQQ,"April 29, 2020",Fish and snail approve!,"Note: the piece you get may not stand up well on its own, or be as intricate as the product picture shows.

However, that's to be expected buying a chunk of wood online that you can't see, and I propped mine up with some stones. It turns your water dark, but after a few water changes the tannins fade. Fish like tannins so don't worry about that, but be sure to check for any ""stowaways"" before adding this to your aquarium.

Wood secretes proteins that my snail love to munch, and my betta likes swimming about and resting on it. It also looks beautiful! I stuck some aquatic plants too it and tied their roots around it to stay in place, and it looks gorgeous.

WARNING: check for splinters first. Mine didn't have any, but you don't want to risk a fishy ripping their fin. :)",yes,One,5.0,https://www.amazon.ca/Fluval-Mopani-Driftwood-Small-9-8/dp/B001URR3CA/ref=cm_cr_srp_d_product_top?ie=UTF8,2020-09-18 15:06:31.423640,2020-09-18 15:06:40.721604,Becky,Clothing & Accessories,B002G9UDYG,B001URR3CA
23,23,23,23,AF6RIEEAXZX3NIJZ5LPYEW6YUWQQ,"April 29, 2020",Looks rad!,"This mousepad fits my Razer mouse and keyboard comfortably. You can pick through different colours to match your setup. I like it, it sits flat on my desk and there is plenty of room to move my mouse around.",yes,0,5.0,https://www.amazon.ca/Large-RGB-Gaming-Mouse-Pad/dp/B07T67VG5K/ref=cm_cr_srp_d_product_top?ie=UTF8,2020-09-18 15:06:49.814700,2020-09-18 15:06:58.133985,Becky,Clothing & Accessories,B002G9UDYG,B07T67VG5K
24,24,24,24,AF6RIEEAXZX3NIJZ5LPYEW6YUWQQ,"April 29, 2020",Plants approve!,"Note: this WILL make your water cloudy. DON'T rinse it first! The sediment is natural and will settle, this stuff is coated with minerals good for plants.

I have had great success with both germinating seeds underwater, and growing existing plants with this substrate. The reddish colouring looks beautiful in contrast with green.

Don't want to stir up red clouds every time you clean your tank? Surround your plants, driftwood, decor etc with bigger stones so they don't fall over, and keep in place.",yes,2,5.0,https://www.amazon.ca/Seachem-495-Flourite-7Kg-15-4-Pound/dp/B00025YSB0/ref=cm_cr_srp_d_product_top?ie=UTF8,2020-09-18 15:07:06.220469,2020-09-18 15:07:14.545431,Becky,Clothing & Accessories,B002G9UDYG,B00025YSB0
25,25,25,25,AF6RIEEAXZX3NIJZ5LPYEW6YUWQQ,"April 29, 2020",Glimmer approves,"My female betta loves to chase these as they sink, and her scales have gotten very colourful. She says they're delicious! 10/10 fishy approved.",yes,0,5.0,https://www.amazon.ca/OmegaSea-Food-51282-Color-Pellets/dp/B00DQR8M86/ref=cm_cr_srp_d_product_top?ie=UTF8,2020-09-18 15:07:22.634852,2020-09-18 15:07:29.927871,Becky,Clothing & Accessories,B002G9UDYG,B00DQR8M86
26,26,26,26,AF6RIEEAXZX3NIJZ5LPYEW6YUWQQ,"April 29, 2020","Functional, cute","Love the cover and colours inside. Lots of space to write notes, and a pleasing aesthetic.",yes,0,5.0,https://www.amazon.ca/Posh-Organized-2019-2020-Planning-Dragonfruity/dp/1524850535/ref=cm_cr_srp_d_product_top?ie=UTF8,2020-09-18 15:07:39.019920,2020-09-18 15:07:48.285476,Becky,Clothing & Accessories,B002G9UDYG,1524850535
27,27,27,27,AF6RIEEAXZX3NIJZ5LPYEW6YUWQQ,"April 29, 2020",Great for planted aquarium,"Put on top of my 2.5 tank. Plants love it. It has a nice blue night mode, and the day mode is bright enough to grow greenery fairly quickly. Easy to extend and fit on rim of tank, and feels secure.",yes,0,5.0,https://www.amazon.ca/JC-Aquarium-Light-Extendable-Bracket/dp/B07FMJT66X/ref=cm_cr_srp_d_product_top?ie=UTF8,2020-09-18 15:07:56.376659,2020-09-18 15:08:03.696242,Becky,Clothing & Accessories,B002G9UDYG,B07FMJT66X
28,28,28,28,AF6RIEEAXZX3NIJZ5LPYEW6YUWQQ,"April 29, 2020",Adorable!,"Fit my switch, super cute and easy to install.",yes,0,5.0,https://www.amazon.ca/Silicone-Non-Slip-Analog-Joystick-Nintendo/dp/B07MH8Z57X/ref=cm_cr_srp_d_product_top?ie=UTF8,2020-09-18 15:08:13.789404,2020-09-18 15:08:23.052182,Becky,Clothing & Accessories,B002G9UDYG,B07MH8Z57X
29,29,29,29,AF6RIEEAXZX3NIJZ5LPYEW6YUWQQ,"April 29, 2020",Would Have Passed If I'd Known the Issues,"Note: remote does not come with batteries.

The ""calming"" sound quality is poor and audio segments reply jarringly, not a peaceful experience. The lights also move a little mechanically, and not smoothly if you watch it closely.

If you can get past that by muting the audio and enjoying the pretty lights, you will appreciate it. HOWEVER, the motion of it tilting to get that ocean-y motion makes a slight whirring noise. If it weren't for my music and aquarium filters running, I would single out the noise and find it annoying.

Still, I'm too lazy to return it, and it is quite pretty.",yes,0,2.0,https://www.amazon.ca/Projector-Colorful-Projection-Nursery-Bedroom/dp/B072MMTY5B/ref=cm_cr_srp_d_product_top?ie=UTF8,2020-09-18 15:08:32.137536,2020-09-18 15:08:38.417031,Becky,Clothing & Accessories,B002G9UDYG,B072MMTY5B
30,30,30,30,AF6RIEEAXZX3NIJZ5LPYEW6YUWQQ,"April 2, 2020",My snails love it!,"A beautiful floor for my planted 20 gallon, with only snails currently.
I use fluorite as substrate. The tank is heated, and lit with bright LEDs

PROS
Bright green, lush, germinated within 3 days. Super simple.

CONS
I would like some more seed for the price. Or price it cheaper?",yes,0,5.0,https://www.amazon.ca/SunGrow-Ecosystem-Propagation-Beginners-Salatigasis/dp/B07SBDFKFD/ref=cm_cr_srp_d_product_top?ie=UTF8,2020-09-18 15:08:46.506610,2020-09-18 15:08:54.759407,Becky,Clothing & Accessories,B002G9UDYG,B07SBDFKFD
31,31,31,31,AF6RIEEAXZX3NIJZ5LPYEW6YUWQQ,"July 18, 2019",pretty design doesn't hold up to time,"Arrived on time. The red flowers turned out to be more of a faded burgundy. After several weeks, the case started to yellow and the colors age. It was very pretty at first, but didn't stand the test of time. :( Durability was average.",yes,0,3.0,https://www.amazon.ca/iPhone-flowers-LUOLNH-Pattern-Flexible/dp/B079NGS1BB/ref=cm_cr_srp_d_product_top?ie=UTF8,2020-09-18 15:09:02.848677,2020-09-18 15:09:12.144733,Becky,Clothing & Accessories,B002G9UDYG,B079NGS1BB
32,32,32,32,AF6RIEEAXZX3NIJZ5LPYEW6YUWQQ,"July 18, 2019",aesthetically pleasing room decor :),"Arrived on time. I love this tapestry. It's true to dimensions and really adds a great vibe to my bedroom. Fabric is thin and lightweight, easily held up by thumbtacks. Goes well with cozy, earthy decor and plants.",yes,0,5.0,https://www.amazon.ca/Craftozone-Bohemian-Mandala-tapestry-Bedspread/dp/B017DGPWMY/ref=cm_cr_srp_d_product_top?ie=UTF8,2020-09-18 15:09:21.235158,2020-09-18 15:09:30.499585,Becky,Clothing & Accessories,B002G9UDYG,B017DGPWMY
33,33,33,33,AF6RIEEAXZX3NIJZ5LPYEW6YUWQQ,"July 18, 2019","Cute, yummy and delicious","Arrived on time. I love gummy sharks and these were soft and tasty. They got eaten fast, alas, now my gummy sharks are extinct.",yes,2,5.0,https://www.amazon.ca/Lady-Sarah-Gummy-Sharks-120g/dp/B07D7MFWHR/ref=cm_cr_srp_d_product_top?ie=UTF8,2020-09-18 15:09:40.590110,2020-09-18 15:09:48.874889,Becky,Clothing & Accessories,B002G9UDYG,B07D7MFWHR
