,Unnamed: 0,author_id,date_review_posted,review_title,reviews,verified_purchase,people_find_helpful,ratings,product_url,start,end,reviewer_name,product_category,product_id,subproduct_id
0,0,AGULK5LJHFCOKPB3UVVL53GWYPRQ,"July 3, 2019",Comfortable,"I have flat feet, so at first these were a bit uncomfortable, but after a couple days wear the arch area seems to have molded to my feet. I'd say these insoles give the same support as my pair of very expensive custom orthotics, with more cushioning to boot.",no,0,5.0,https://www.amazon.ca/Ailaka-Orthotic-Cushion-Absorption-Fasciitis/dp/B07H9741GT/ref=cm_cr_srp_d_product_top?ie=UTF8,2020-09-30 11:15:46.870134,2020-09-30 11:15:53.188353,bb,Clothing & Accessories,B002G9UDYG,B07H9741GT
1,1,AGULK5LJHFCOKPB3UVVL53GWYPRQ,"April 3, 2019",Itchy,So itchy it must be made of lice.,yes,0,3.0,https://www.amazon.ca/Carhartt-Acrylic-Watch-Black-Size/dp/B002G9UDYG/ref=cm_cr_srp_d_product_top?ie=UTF8,2020-09-30 11:16:01.292472,2020-09-30 11:16:07.644557,bb,Clothing & Accessories,B002G9UDYG,B002G9UDYG
2,2,AGULK5LJHFCOKPB3UVVL53GWYPRQ,"April 3, 2019",Dog loves it,To be honest so do I.,yes,One,5.0,https://www.amazon.ca/Hills-Science-Savory-Chicken-Vegetables/dp/B006HKAXUO/ref=cm_cr_srp_d_product_top?ie=UTF8,2020-09-30 11:16:14.751884,2020-09-30 11:16:23.184220,bb,Clothing & Accessories,B002G9UDYG,B006HKAXUO
3,3,AGULK5LJHFCOKPB3UVVL53GWYPRQ,"April 3, 2019",Thick,The fabric on this shirt is so thick and soft you could wear it without pants and underwear to a war memorial.,yes,0,5.0,https://www.amazon.ca/Woolrich-Oxbow-Flannel-Shirt-Medium/dp/B01NCIZEJJ/ref=cm_cr_srp_d_product_top?ie=UTF8,2020-09-30 11:16:32.292191,2020-09-30 11:16:41.707721,bb,Clothing & Accessories,B002G9UDYG,B01NCIZEJJ
4,4,AGULK5LJHFCOKPB3UVVL53GWYPRQ,"April 3, 2019",Good fit,"Slightly boxy fit, fabric drapes nicely. Length perfect.",yes,0,5.0,https://www.amazon.ca/Champion-Authentic-Originals-Sweatshirt-Carmine/dp/B06Y13ZJ46/ref=cm_cr_srp_d_product_top?ie=UTF8,2020-09-30 11:16:50.815158,2020-09-30 11:17:00.192910,bb,Clothing & Accessories,B002G9UDYG,B06Y13ZJ46
5,5,AGULK5LJHFCOKPB3UVVL53GWYPRQ,"April 3, 2019",Useful,"Good for storing liquids you need only in small amounts. I personally use it for bull semen, but other types of semen should also work just fine.",yes,One,5.0,https://www.amazon.ca/Transparent-Essential-Container-Scientific-Dispensing/dp/B07CBWH8F9/ref=cm_cr_srp_d_product_top?ie=UTF8,2020-09-30 11:17:10.305338,2020-09-30 11:17:19.671790,bb,Clothing & Accessories,B002G9UDYG,B07CBWH8F9
