,author_id,verified_purchase,review_title,reviews,date,reviewer_name,ratings,people_find_helpful,reviewer_profile_url,start_time,end_time,product_name,brand_name,rank,product_id
0,AF4TD6TMNIG6IOQJYYR45WEAHR6A,True,Runner,"These were not a disappointment. I am a runner and bought these for running. I have worn them a few times. Last time, I did a long run (over 20 km). They were comfortable. No chafing at all!! The pockets are very practical. The legs stayed put throughout. However, there are a few things that are not ideal. The elastic on the waist is a bit “funny”. It is thick and seems to pucker when you are not wearing them. Having said this, they are comfortable on. I am a bit worried that the waistband will wear out sooner than my other running shorts, but thus far, it is holding up. The material is thick. On very hot days, these are not the running shorts I would reach for. Despite the little “complaints”, I would recommend these to long distance runners.

Edit: I have since ordered 2 more of these. They are great and I highly recommend them for runners.","July 17, 2019",csv,5.0,24,https://www.amazon.ca/gp/profile/amzn1.account.AF4TD6TMNIG6IOQJYYR45WEAHR6A/ref=cm_cr_arp_d_gw_btm?ie=UTF8,2020-09-20 23:52:43.727835,2020-09-20 23:52:44.020006,QUEENIEKE Women 6 inches Inseam Mid-Waist 3-Pocket Running Shorts Workout Fitness 70822,,264,B002G9UDYG
1,AH6QPSOUGIC6VY2WM3FKTOMXMZMQ,True,My fave brand!,Love love this brand comparable to lululemon minus the 100s of dollars. I have 3 other pairs I've had for now 2+ years of yoga pants and their still going strong! Awesome quality!,"September 8, 2019",Hope Wells,5.0,23,https://www.amazon.ca/gp/profile/amzn1.account.AH6QPSOUGIC6VY2WM3FKTOMXMZMQ/ref=cm_cr_arp_d_gw_btm?ie=UTF8,2020-09-20 23:52:44.029765,2020-09-20 23:52:44.304712,QUEENIEKE Women 6 inches Inseam Mid-Waist 3-Pocket Running Shorts Workout Fitness 70822,,264,B002G9UDYG
2,AFPY52UVNONZBHEOD5H3B5GBZGDQ,True,Five Stars,Perfect!!!!,"August 29, 2018",Gretta,5.0,34,https://www.amazon.ca/gp/profile/amzn1.account.AFPY52UVNONZBHEOD5H3B5GBZGDQ/ref=cm_cr_arp_d_gw_btm?ie=UTF8,2020-09-20 23:52:44.315021,2020-09-20 23:52:44.589437,QUEENIEKE Women 6 inches Inseam Mid-Waist 3-Pocket Running Shorts Workout Fitness 70822,,264,B002G9UDYG
3,AFMAUNTYWFKP7BFVRWJ4ME5A5FPA,True,Nice,"I usually wear a M but I've gained some weight so I went for a L, a bit big on me, should've gone for a M. Love still, wear them around the house lots","November 2, 2019",Evann ,5.0,21,https://www.amazon.ca/gp/profile/amzn1.account.AFMAUNTYWFKP7BFVRWJ4ME5A5FPA/ref=cm_cr_arp_d_gw_btm?ie=UTF8,2020-09-20 23:52:44.596266,2020-09-20 23:52:44.791062,QUEENIEKE Women 6 inches Inseam Mid-Waist 3-Pocket Running Shorts Workout Fitness 70822,,264,B002G9UDYG
4,AFCJA5LNOV6FXJJFIKT4I2NMTN3A,True,Perfect,"Perfect
A 4-6 fits a 135 pounds 5,3 tall woman perfectly To run. 2 pockets for iPhone 6 and keys. I wouldn’t fit a 8 tho, too small maybe ...","August 12, 2019",Marie-F,5.0,23,https://www.amazon.ca/gp/profile/amzn1.account.AFCJA5LNOV6FXJJFIKT4I2NMTN3A/ref=cm_cr_arp_d_gw_btm?ie=UTF8,2020-09-20 23:52:44.801241,2020-09-20 23:52:45.064801,QUEENIEKE Women 6 inches Inseam Mid-Waist 3-Pocket Running Shorts Workout Fitness 70822,,264,B002G9UDYG
5,AFGMMBA4HT2QEV5DOM47VWUFIOIA,True,LOVE THESE!,"I am in love with these shorts. They’re super comfortable, not too short, there’s a wide waist band, and the pockets are deep enough to fit a larger phone (I have an iPhone XR). Definitely recommend them!","June 25, 2019",Amazon Customer,5.0,22,https://www.amazon.ca/gp/profile/amzn1.account.AFGMMBA4HT2QEV5DOM47VWUFIOIA/ref=cm_cr_arp_d_gw_btm?ie=UTF8,2020-09-20 23:52:45.074562,2020-09-20 23:52:45.306980,QUEENIEKE Women 6 inches Inseam Mid-Waist 3-Pocket Running Shorts Workout Fitness 70822,,264,B002G9UDYG
6,AE5QTO6FXG3FE4KRQEV7FQ6BNNOQ,True,Worth it,"So soft!!!!! They fit as expected, have an elastic on the top band, pretty squat proof. Seriously buying them in a bunch of other colors now.","September 2, 2019",Brittany,5.0,20,https://www.amazon.ca/gp/profile/amzn1.account.AE5QTO6FXG3FE4KRQEV7FQ6BNNOQ/ref=cm_cr_arp_d_gw_btm?ie=UTF8,2020-09-20 23:52:45.314174,2020-09-20 23:52:45.512240,QUEENIEKE Women 6 inches Inseam Mid-Waist 3-Pocket Running Shorts Workout Fitness 70822,,264,B002G9UDYG
7,AFA5VGCGAF72QOHLMORFNH5TRJVQ,True,Love them!,"I LOVE these shorts! Fit great. Work well for running, no shifting or having to pull up my shorts. Phone fits nicely in the pocket and doesn’t shift when I’m running. I’ll definitely be purchasing more","May 30, 2019",Shawna,5.0,20,https://www.amazon.ca/gp/profile/amzn1.account.AFA5VGCGAF72QOHLMORFNH5TRJVQ/ref=cm_cr_arp_d_gw_btm?ie=UTF8,2020-09-20 23:52:45.522577,2020-09-20 23:52:45.793281,QUEENIEKE Women 6 inches Inseam Mid-Waist 3-Pocket Running Shorts Workout Fitness 70822,,264,B002G9UDYG
8,AGLGPTVQG6X3KKCB4G7TUDR4BI3A,True,Love them!,I love these shorts and I wore them for swimming on my holiday too. Super comfy and high waisted keeps everything where it should be. Pockets are great to have too!,"May 2, 2019",Kelly Bryans,5.0,21,https://www.amazon.ca/gp/profile/amzn1.account.AGLGPTVQG6X3KKCB4G7TUDR4BI3A/ref=cm_cr_arp_d_gw_btm?ie=UTF8,2020-09-20 23:52:45.804018,2020-09-20 23:52:46.084702,QUEENIEKE Women 6 inches Inseam Mid-Waist 3-Pocket Running Shorts Workout Fitness 70822,,264,B002G9UDYG
9,AGY24Y2WVWWM6AXQ367NMXT5S7JA,True,Great but a few things need improvement!,I absolutely love these shorts. They are super comfortable and the material is so nice. I haven’t worn them to work out so I don’t know how well they hold up in hot environments. Also there’s a really annoying tag on the inside of the left leg that I tried cutting but didn’t help.,"November 13, 2018",Nicole,5.0,19,https://www.amazon.ca/gp/profile/amzn1.account.AGY24Y2WVWWM6AXQ367NMXT5S7JA/ref=cm_cr_arp_d_gw_btm?ie=UTF8,2020-09-20 23:52:46.094464,2020-09-20 23:52:46.359615,QUEENIEKE Women 6 inches Inseam Mid-Waist 3-Pocket Running Shorts Workout Fitness 70822,,264,B002G9UDYG
10,AGRB23J5JPLPLIS2OOJSSRX4BB5Q,True,Very comfy and perfect for runs!,"These shorts are a a great sturdy and soft material that fit as I expected! The waist does sit very high (quite a way above the belly button) and do sit about halfway down my thigh. For reference I bought a large and am 5'5"". They don't ride up while running and the pockets are great to fit in phone, keys, cards and anything else you need! Overall very happy with my purchase.","June 28, 2018",Alison Grant,5.0,20,https://www.amazon.ca/gp/profile/amzn1.account.AGRB23J5JPLPLIS2OOJSSRX4BB5Q/ref=cm_cr_getr_d_gw_btm?ie=UTF8,2020-09-20 23:52:49.612171,2020-09-20 23:52:49.877777,QUEENIEKE Women 6 inches Inseam Mid-Waist 3-Pocket Running Shorts Workout Fitness 70822,,264,B002G9UDYG
11,AF5WC4JWTTG3Q6H56CHBPUDWSXNA,True,Guys like it too !,"From a Guy: great material, gusset crotch is ideal for athletic gear, or for causal wear in our humid summers. The Women's L fits fine for a Men's L with a 34"" waist, the tummy control is challenged by my particular stomach but does OK under an athletic top or regular shirt. Pockets are a great addition for street ware. I will order more.","August 26, 2018",mcewin,5.0,22,https://www.amazon.ca/gp/profile/amzn1.account.AF5WC4JWTTG3Q6H56CHBPUDWSXNA/ref=cm_cr_getr_d_gw_btm?ie=UTF8,2020-09-20 23:52:49.886558,2020-09-20 23:52:50.149781,QUEENIEKE Women 6 inches Inseam Mid-Waist 3-Pocket Running Shorts Workout Fitness 70822,,264,B002G9UDYG
12,AHSHYTDB4EUJB56ATGQK34B44ZBA,True,Very slimming and comfortable,Love these. Very comfortable. Some compression but nothing too tight or pinchy. As I am short (5’) they do sit very high basically to rib cage but I prefer that for keeping the waistband in place when I workout.,"April 9, 2018",T T T,5.0,19,https://www.amazon.ca/gp/profile/amzn1.account.AHSHYTDB4EUJB56ATGQK34B44ZBA/ref=cm_cr_getr_d_gw_btm?ie=UTF8,2020-09-20 23:52:50.159541,2020-09-20 23:52:50.429197,QUEENIEKE Women 6 inches Inseam Mid-Waist 3-Pocket Running Shorts Workout Fitness 70822,,264,B002G9UDYG
13,AEW7PGD7FQDQHGRLZV47JBL3V7TA,True,Great quality!,"This is my second pair from Queenie Ke and I'm so happy with it. It fits true to size. I got the black shorts, they had excellent lining, strong cloth and look just like the picture. They indeed have all the promised pockets. I love the compression. Truly a reasonably priced product that feels like it will last me.","October 30, 2018",shivi,5.0,20,https://www.amazon.ca/gp/profile/amzn1.account.AEW7PGD7FQDQHGRLZV47JBL3V7TA/ref=cm_cr_getr_d_gw_btm?ie=UTF8,2020-09-20 23:52:50.437580,2020-09-20 23:52:50.702373,QUEENIEKE Women 6 inches Inseam Mid-Waist 3-Pocket Running Shorts Workout Fitness 70822,,264,B002G9UDYG
14,AHMNZDVLLRT2KHJNDOJQIV75Z5UQ,True,Wow et ré WOW a acheté,Wow excellente conception pour le prix pas cher ! J'ai prise medium selon grandeur proposer c'est correct mais pour ceux qui aime sa plus serré un peux prendre un point plus petit. Super sérieux pochette de cellulaire dans le dos a l'intérieur et sur les coter Excellente longueur sa cache le gras de cuisse et tissu doux et confortable je vais m'en commander d'autre de différentes couleurs,"October 1, 2018",CINTHIA ,5.0,3,https://www.amazon.ca/gp/profile/amzn1.account.AHMNZDVLLRT2KHJNDOJQIV75Z5UQ/ref=cm_cr_getr_d_gw_btm?ie=UTF8,2020-09-20 23:52:50.712073,2020-09-20 23:52:50.945514,QUEENIEKE Women 6 inches Inseam Mid-Waist 3-Pocket Running Shorts Workout Fitness 70822,,264,B002G9UDYG
15,AFDA5JHWYVVKWCT2657VERGM7TUA,True,Great fit,"I love these Queenie Ke Running Shorts which I use for working out (not a runner!!). I especially LOVE the pocket which holds my cellphone. The fit is great with the higher waist in back so I don't feel it's sliding down and it has a nice compression so everything is held together so I can focus on my workout. My only comment is that I'm not crazy about the elastic at the waist. The waistband itself is wide but the elastic in it is narrow. Anyways, I do forget about it once I'm into my workout, so not a great deal. Would buy another.","November 29, 2018",Hussmo,4.0,2,https://www.amazon.ca/gp/profile/amzn1.account.AFDA5JHWYVVKWCT2657VERGM7TUA/ref=cm_cr_getr_d_gw_btm?ie=UTF8,2020-09-20 23:52:50.952344,2020-09-20 23:52:51.157626,QUEENIEKE Women 6 inches Inseam Mid-Waist 3-Pocket Running Shorts Workout Fitness 70822,,264,B002G9UDYG
16,AGX5D4HDPPPJ7ZCETT357EQ3TLAQ,True,Good quality,I’m 5’6 and 165 lb. I usually fit a size 8 or 10 depending on brand but in this case I fit the Large (12). They fit well. Pockets are nice. There is about a one inch band at the top which seems to help keep them up but not great for tummy control. They are comfortable and I will consider buying another.,"July 10, 2019",Alyssa,4.0,4,https://www.amazon.ca/gp/profile/amzn1.account.AGX5D4HDPPPJ7ZCETT357EQ3TLAQ/ref=cm_cr_getr_d_gw_btm?ie=UTF8,2020-09-20 23:52:51.167384,2020-09-20 23:52:51.438762,QUEENIEKE Women 6 inches Inseam Mid-Waist 3-Pocket Running Shorts Workout Fitness 70822,,264,B002G9UDYG
17,AHK2URNZH6DVNWEE2WILJGYLOYGA,True,"5’8, 160lb, size L is perfect","I am 5’8 and 160 lbs. sizes for myself vary depending on the brand but I decided to go with a L for this product and it fits perfect.
They are comfortable high waisted bike shorts and have large pockets that make it easy to split your phone into. Really love the fit and style.","July 7, 2020",Hailey,5.0,2,https://www.amazon.ca/gp/profile/amzn1.account.AHK2URNZH6DVNWEE2WILJGYLOYGA/ref=cm_cr_getr_d_gw_btm?ie=UTF8,2020-09-20 23:52:51.447544,2020-09-20 23:52:51.677492,QUEENIEKE Women 6 inches Inseam Mid-Waist 3-Pocket Running Shorts Workout Fitness 70822,,264,B002G9UDYG
18,AFJZSD3OGLN6NLIQI3N6JLRCOP5Q,True,Very nice shorts,These are super comfortable love that has the three pockets the one hidden inside the back I can put my S10 plus note inside it fits snug so it won't fall out basically goes horizontal at the small of your back you can't even see it I ordered extra large and they fit as expected to give you an idea I have a size 8 in jeans that I got from Banana Republic I could have gotten a large but I wasn't sure as the sizing differs depending on who makes them I wear anything from a medium to large in regular non-stretch material still all in all these are super comfortable I really love them and would definitely recommend them and they came quite quickly,"July 14, 2020",Susan,5.0,0,https://www.amazon.ca/gp/profile/amzn1.account.AFJZSD3OGLN6NLIQI3N6JLRCOP5Q/ref=cm_cr_getr_d_gw_btm?ie=UTF8,2020-09-20 23:52:51.684324,2020-09-20 23:52:51.856415,QUEENIEKE Women 6 inches Inseam Mid-Waist 3-Pocket Running Shorts Workout Fitness 70822,,264,B002G9UDYG
19,AG4PXJ7SI423CMCIXBOJP6Y6AK6A,True,Comfy and nice length,"Just got these shorts delivered, ended up ordering a large in ""grey space"" and medium in ""midnight black"". Based on reviews some said to size up. I technically fall in the medium category based on my dimensions. Usually size 6/8 in lululemon and size 4/6 in old navy for reference. Fit is comfortable. I have more athletic legs and don’t find they squeeze at the seam. Holding both pairs up they look identical size wise. I’ve attached both photos. Grey ones (85% polyester and 15% spandex) feel softer, and black ones (86% nylon and 14% spandex) feel more like athletic material.","July 10, 2020",Steph,5.0,One,https://www.amazon.ca/gp/profile/amzn1.account.AG4PXJ7SI423CMCIXBOJP6Y6AK6A/ref=cm_cr_getr_d_gw_btm?ie=UTF8,2020-09-20 23:52:51.862369,2020-09-20 23:52:52.116307,QUEENIEKE Women 6 inches Inseam Mid-Waist 3-Pocket Running Shorts Workout Fitness 70822,,264,B002G9UDYG
20,AGIZRUDQAUNEM2CS2M77RBEYSXGA,True,Obsessed!!,"I am beyond pleased with my purchase. I was hesitant at first because I prefer to try on my clothes in the store, but these shorts are literally perfect. They fit comfortably, and are flattering. The side pockets are really long as well so the phone will stay in there firmly. And the material is breathable which is a must for me.
I purchased a medium, I am 5’8 and I am just below 170.","July 12, 2020",Maggie Rekowski,5.0,One,https://www.amazon.ca/gp/profile/amzn1.account.AGIZRUDQAUNEM2CS2M77RBEYSXGA/ref=cm_cr_getr_d_gw_btm?ie=UTF8,2020-09-20 23:52:54.297562,2020-09-20 23:52:54.573887,QUEENIEKE Women 6 inches Inseam Mid-Waist 3-Pocket Running Shorts Workout Fitness 70822,,264,B002G9UDYG
21,AHB62FDDDS2KXC66Q6QDXTJK4EFA,True,Great,"I am a size 8, 42 inch hip/31 waist and I ordered a large and they fit great. Awesome shorts for hiking or working out. The right length for me -- not too long or short. Most importantly they don't ride up! Super cute design too. I may buy another pair in a different colour. I took off a star because I though they would suck me in more and be more compression like, when they don't really do that.","February 25, 2020",Toronto87,4.0,One,https://www.amazon.ca/gp/profile/amzn1.account.AHB62FDDDS2KXC66Q6QDXTJK4EFA/ref=cm_cr_getr_d_gw_btm?ie=UTF8,2020-09-20 23:52:54.582670,2020-09-20 23:52:54.851301,QUEENIEKE Women 6 inches Inseam Mid-Waist 3-Pocket Running Shorts Workout Fitness 70822,,264,B002G9UDYG
22,AFFYAMGHMJ6EJPOPTXJHVMROUL2Q,True,Great for Bike Rides!,"Bought these shorts to wear on my nightly bike rides and they're perfect! Love that they suck you in a little bit and have extra big pockets. For reference, I'm 5'7 and 160lbs. Bought a L. Could have gotten away with an XL for a slightly looser fit but I like them as is. The space dye purple was the ONLY colour left on Prime and I was a bit hesitant at first, but it's really nice in person. Waiting for more colours to be available so I can order a second pair!","June 3, 2020",czechyourself,5.0,0,https://www.amazon.ca/gp/profile/amzn1.account.AFFYAMGHMJ6EJPOPTXJHVMROUL2Q/ref=cm_cr_getr_d_gw_btm?ie=UTF8,2020-09-20 23:52:54.863947,2020-09-20 23:52:55.208198,QUEENIEKE Women 6 inches Inseam Mid-Waist 3-Pocket Running Shorts Workout Fitness 70822,,264,B002G9UDYG
23,AHNRCTSYKALGDQZ4IUZQZ4TZNEXQ,True,If you like compression but have bigger thighs the fit is annoying,I wanted to love these but I’m just not sure. I’m normally a small in the leggings for the compression and I have a smaller waist but got a medium to account for my thighs because shorts and they don’t seem tight enough around the rest of me but still have that weird seam dig in but on my thigh. I want to try a small but think the dig in on the thigh would be even worse so anyone who likes compression but bigger things be cautious,"August 17, 2020",Jamie-lee,3.0,0,https://www.amazon.ca/gp/profile/amzn1.account.AHNRCTSYKALGDQZ4IUZQZ4TZNEXQ/ref=cm_cr_getr_d_gw_btm?ie=UTF8,2020-09-20 23:52:55.218934,2020-09-20 23:52:55.453267,QUEENIEKE Women 6 inches Inseam Mid-Waist 3-Pocket Running Shorts Workout Fitness 70822,,264,B002G9UDYG
24,AFHWFGBEHAKPQH5WHXDHHBY26HKQ,True,Awesome shorts,The shorts are great for running. One of the only bottoms I have that don’t slip down. Nice high rise and not too long or short - just the right length. Pockets are perfect for phone. Great quality - have held up perfectly through many washes. Loved them so much I bought another pair.,"February 24, 2020",Amazon Customer,5.0,One,https://www.amazon.ca/gp/profile/amzn1.account.AFHWFGBEHAKPQH5WHXDHHBY26HKQ/ref=cm_cr_getr_d_gw_btm?ie=UTF8,2020-09-20 23:52:55.459123,2020-09-20 23:52:55.638369,QUEENIEKE Women 6 inches Inseam Mid-Waist 3-Pocket Running Shorts Workout Fitness 70822,,264,B002G9UDYG
25,AFAVMZJVST4D6XF6QBIOU3D6H2AA,True,but excellent quality and sizing,"Very high waisted, but excellent quality and sizing! I am a true medium and they fit great!

5’3” 132lbs","April 4, 2018",Shannon Hooper,3.0,6,https://www.amazon.ca/gp/profile/amzn1.account.AFAVMZJVST4D6XF6QBIOU3D6H2AA/ref=cm_cr_getr_d_gw_btm?ie=UTF8,2020-09-20 23:52:55.645287,2020-09-20 23:52:55.818072,QUEENIEKE Women 6 inches Inseam Mid-Waist 3-Pocket Running Shorts Workout Fitness 70822,,264,B002G9UDYG
26,AHIOTZAGSR2NOKG6B4P2WJVZV7VA,True,Inconsistent sizing,"I purchased these shorts a few months ago in the a size medium, navy blue and loved them but I found them to be too big so when I went to buy another pair I purchased a small which turns out to be way larger then my medium pair. Disappointed in the fit and how the size S is larger than the M...","June 8, 2020",Courty b,3.0,2,https://www.amazon.ca/gp/profile/amzn1.account.AHIOTZAGSR2NOKG6B4P2WJVZV7VA/ref=cm_cr_getr_d_gw_btm?ie=UTF8,2020-09-20 23:52:55.823928,2020-09-20 23:52:56.062072,QUEENIEKE Women 6 inches Inseam Mid-Waist 3-Pocket Running Shorts Workout Fitness 70822,,264,B002G9UDYG
27,AFQ5RINHBOQBLDVU23JKLU4AISNA,True,So uncomfortable...waist band digs into stomach,I wanted to love these shorts because their cute and the perfect length but they were so uncomfortable. The waist band is goes right up under the ribs and digs into your stomach. Kept buying a size up hoping they would fit better but no luck. Still tempted to purchase the largest size since they are so cute but I'm sure they'll still be uncomfortable.,"October 13, 2018",Corin De Sousa,1.0,2,https://www.amazon.ca/gp/profile/amzn1.account.AFQ5RINHBOQBLDVU23JKLU4AISNA/ref=cm_cr_getr_d_gw_btm?ie=UTF8,2020-09-20 23:52:56.071832,2020-09-20 23:52:56.336645,QUEENIEKE Women 6 inches Inseam Mid-Waist 3-Pocket Running Shorts Workout Fitness 70822,,264,B002G9UDYG
28,AGFEHAGQUGVIH3KCSVBUKCYGBQLA,True,LOVED,"I loved this product.
- it doesn't ride up
- squat proof
- no rolling down at the waist
- nice waist compressio (pretty loose though)
- great booty contour

Sizing: the size chart isn't helpful, you really have to take a guess, I have a 34 inch waist and got the extra large. it was a tad bit too long but, other than that i loved it.

i would post a picture buh i messed it up during laundry :( and nw it's stained. will for sure repurchase when i have th ecash","January 8, 2020",Suese,5.0,One,https://www.amazon.ca/gp/profile/amzn1.account.AGFEHAGQUGVIH3KCSVBUKCYGBQLA/ref=cm_cr_getr_d_gw_btm?ie=UTF8,2020-09-20 23:52:56.346443,2020-09-20 23:52:56.592065,QUEENIEKE Women 6 inches Inseam Mid-Waist 3-Pocket Running Shorts Workout Fitness 70822,,264,B002G9UDYG
29,AH5IECSCSKZ4OKDIRTUCGQIVAOCA,True,"Material is rough, weird seam lines","The material is very rough. I was not expecting this at all. I specifically bought these shorts because they claimed to be 86% nylon and 14% spandex like lulu lemon leggings. But they do not feel similar at all. Also, the seam lines are rough, there’s loose threads, and the seams fit weird on my rear. They create a weird panty line effect.

These are horrible for the price","June 29, 2020",Customer,2.0,0,https://www.amazon.ca/gp/profile/amzn1.account.AH5IECSCSKZ4OKDIRTUCGQIVAOCA/ref=cm_cr_getr_d_gw_btm?ie=UTF8,2020-09-20 23:52:56.597921,2020-09-20 23:52:56.769242,QUEENIEKE Women 6 inches Inseam Mid-Waist 3-Pocket Running Shorts Workout Fitness 70822,,264,B002G9UDYG
30,AHMGFDRTZUKLFQWCMEO623ANJISQ,True,Didn't love these. Compression and high waisted for sure though!,"I wanted to like these. I love the purple space dye leggings I have, but these fir differently, more of a compression feel. The pockets on the side of the leg are quite nice. I am 5' 3"" with a shorter torso, so these were quite unflattering on me and a bit uncomfortable with the compression feeling. I would have kept these if they were a mid rise and fit more like the leggings.","July 1, 2019",Brittney,3.0,0,https://www.amazon.ca/gp/profile/amzn1.account.AHMGFDRTZUKLFQWCMEO623ANJISQ/ref=cm_cr_getr_d_gw_btm?ie=UTF8,2020-09-20 23:53:02.951114,2020-09-20 23:53:03.199519,QUEENIEKE Women 6 inches Inseam Mid-Waist 3-Pocket Running Shorts Workout Fitness 70822,,264,B002G9UDYG
31,AEFNAUJWBUDXWB3HQTDA6GZYLHEQ,True,Cute and functional,"I'm honestly so happy with this purchase. The pockets are the best! I got these for bike rides when I like to have my phone handy to take a quick pic without having to stop and reach into my cambelbak. I also love the length: I ordered L and it sits mid thigh on me (I'm 5""7 and 150lbs). The high waist is comfortable and flattering.","August 29, 2020",Nicole,5.0,0,https://www.amazon.ca/gp/profile/amzn1.account.AEFNAUJWBUDXWB3HQTDA6GZYLHEQ/ref=cm_cr_getr_d_gw_btm?ie=UTF8,2020-09-20 23:53:03.208409,2020-09-20 23:53:03.465653,QUEENIEKE Women 6 inches Inseam Mid-Waist 3-Pocket Running Shorts Workout Fitness 70822,,264,B002G9UDYG
32,AF3SDQ5ZGGCJ6CRUQSTKWVZOZ6BA,True,Sizing is off,"I thought there would be to small but they were way to big and no where near compression.

They are also not squat proof.

Bought a xs in pink to see if there’s a change.

Material feels nice but the band at the top I’m sure will cause muffin tops.","October 17, 2019",Neesh,2.0,One,https://www.amazon.ca/gp/profile/amzn1.account.AF3SDQ5ZGGCJ6CRUQSTKWVZOZ6BA/ref=cm_cr_getr_d_gw_btm?ie=UTF8,2020-09-20 23:53:03.474437,2020-09-20 23:53:03.711308,QUEENIEKE Women 6 inches Inseam Mid-Waist 3-Pocket Running Shorts Workout Fitness 70822,,264,B002G9UDYG
33,AED35JRGHBBEPC2OQNXGCCJIPVTQ,True,"Good no-ride, squat proof shorts, quality varies","Great, no-ride shorts. Squat-proof. Good fit. The only reason why it doesn't get 5-stars is that there was a seam on the inside that came undone so there's an opening to the elastic around the waist. Other threads have started to come loose. So I guess I just got a bad apple. Otherwise, great product.","March 27, 2020",LK,3.0,0,https://www.amazon.ca/gp/profile/amzn1.account.AED35JRGHBBEPC2OQNXGCCJIPVTQ/ref=cm_cr_getr_d_gw_btm?ie=UTF8,2020-09-20 23:53:03.720127,2020-09-20 23:53:03.928563,QUEENIEKE Women 6 inches Inseam Mid-Waist 3-Pocket Running Shorts Workout Fitness 70822,,264,B002G9UDYG
34,AEQMCQGQHSMB37G2ZGHSBVYWYLUA,True,Awesome thick material,"Love these shorts! Perfect length for me at 5'4. Hits about 4 inches above my knees. Marterial is quite thick so not great for really hot days. Otherwise, perfect for lounging and running around. Actually bought a second. Doesnt ride up and stays in place at the waist. Ps: I bought a Medium, ran a bit large for me at 136 lbs but prefer them looser rather than super tight","July 24, 2020",Erica,5.0,0,https://www.amazon.ca/gp/profile/amzn1.account.AEQMCQGQHSMB37G2ZGHSBVYWYLUA/ref=cm_cr_getr_d_gw_btm?ie=UTF8,2020-09-20 23:53:03.936388,2020-09-20 23:53:04.172704,QUEENIEKE Women 6 inches Inseam Mid-Waist 3-Pocket Running Shorts Workout Fitness 70822,,264,B002G9UDYG
35,AGARJPSRCERZITZUMHW2RJAAVTRA,True,Comfy and practical! Waistband sticker leaves glue residue,Really soft and comfy! They do run a tiny bit large ( I wear small). They’re good for biking and running. The one downside is that they put a sticker on the inside of the waist band and when you take off the sticker it leaves a gross glue residue that doesn’t seem to want to come off... even after several washes.,"August 15, 2019",Christina Petcu,4.0,0,https://www.amazon.ca/gp/profile/amzn1.account.AGARJPSRCERZITZUMHW2RJAAVTRA/ref=cm_cr_getr_d_gw_btm?ie=UTF8,2020-09-20 23:53:04.180626,2020-09-20 23:53:04.430369,QUEENIEKE Women 6 inches Inseam Mid-Waist 3-Pocket Running Shorts Workout Fitness 70822,,264,B002G9UDYG
36,AFX4NPS6USHROH3JA2X2IGJFBBCQ,True,Amazing,"I usually order a small or medium and these fitted amazingly (small). Great length,great quality... will be buying more!!!

Update: I really liked the navy blue ones i ordered as they were more spandex but the black ones were more cotton and i dont like them quite as much... still great though!","June 25, 2020",Jennifer Bittle,4.0,0,https://www.amazon.ca/gp/profile/amzn1.account.AFX4NPS6USHROH3JA2X2IGJFBBCQ/ref=cm_cr_getr_d_gw_btm?ie=UTF8,2020-09-20 23:53:04.439201,2020-09-20 23:53:04.687084,QUEENIEKE Women 6 inches Inseam Mid-Waist 3-Pocket Running Shorts Workout Fitness 70822,,264,B002G9UDYG
