,subproduct_author_id,verified_purchase,review_title,reviews,date,reviewer_name,ratings,people_find_helpful,reviewer_profile_url,start_time,end_time,product_name,brand_name,rank,product_id,author_id
0,AFNBBDPTPZYYPDVEXBJISPL2QJQA,True,Brown is small,"I ordered a black one and a brown , the size of these are totally different , the black one is loose and longer and the Brown one is really tight and smaller . You would think that "" made in the USA "" would have better consistency and quality assurance . Maybe these are fakes I don't know , but when it says "" one size fits all "" they must mean buy three different colors and maybe one of them will fit , because they will all be different . Or they sent me a little boys one and a men's , but they are both labeled the same .","November 12, 2019",Rick Bosman,1.0,21,https://www.amazon.ca/gp/profile/amzn1.account.AFNBBDPTPZYYPDVEXBJISPL2QJQA/ref=cm_cr_arp_d_gw_btm?ie=UTF8,2020-09-28 19:37:20.839990,2020-09-28 19:37:20.986397,Carhartt Men's Acrylic Watch Hat,Carhartt Sportswear - Mens,1,B002G9UDYG,AE3LRCOFYOIXMTUVY7MELWKBDM6A
1,AECJHGAHVQCKW4VWKWLBVFDXJDMQ,True,Excellent,"The products arrived on time and did in fact have Made in Canada on them. I gave these as gifts and the feedback was overall very good. It is a one size fits all, but more importantly, the hats keep you warm and are easy to maintain. People have raised concern that the tags are false and this is made in China, however the quality feels strong on the Black Toques and have so far performed very good.","January 6, 2019",Amazon Customer,5.0,7,https://www.amazon.ca/gp/profile/amzn1.account.AECJHGAHVQCKW4VWKWLBVFDXJDMQ/ref=cm_cr_arp_d_gw_btm?ie=UTF8,2020-09-28 19:37:20.990300,2020-09-28 19:37:21.159147,Carhartt Men's Acrylic Watch Hat,Carhartt Sportswear - Mens,1,B002G9UDYG,AE3LRCOFYOIXMTUVY7MELWKBDM6A
2,AG4U3S7QJW2WXH2GPRZUHSFKKBPQ,True,Great Product,"This product is exactly as described. It is a heavy, good quality material. There is very little give in this hat, and it keeps it's shape well. It is very easy to clean, and seems to not hold odors like other materials do. I have owned several of these hats in the past and will continue to purchase these in the future.

Overall: It is an awesome, warm hat and a great value too! I would definitely recommend these to anyone, and can't wait to give these out as gifts this holiday season.","November 21, 2018",Amazon Customer,5.0,5,https://www.amazon.ca/gp/profile/amzn1.account.AG4U3S7QJW2WXH2GPRZUHSFKKBPQ/ref=cm_cr_arp_d_gw_btm?ie=UTF8,2020-09-28 19:37:21.163052,2020-09-28 19:37:21.292859,Carhartt Men's Acrylic Watch Hat,Carhartt Sportswear - Mens,1,B002G9UDYG,AE3LRCOFYOIXMTUVY7MELWKBDM6A
3,AHRIRAK4QF7UYM5ISZEOD6SJYRSA,True,Love this!,"Amazing quality and looks great. Not to mention super warm. Working in the trades I have purchased thousands of dollars of Carhartt product and this, like the rest doesn’t disappoint. This toque definitely isn’t fitted to the head at the top- so heads up if that’s not your thing!","November 5, 2017",Can123456,5.0,4,https://www.amazon.ca/gp/profile/amzn1.account.AHRIRAK4QF7UYM5ISZEOD6SJYRSA/ref=cm_cr_arp_d_gw_btm?ie=UTF8,2020-09-28 19:37:21.297740,2020-09-28 19:37:21.457804,Carhartt Men's Acrylic Watch Hat,Carhartt Sportswear - Mens,1,B002G9UDYG,AE3LRCOFYOIXMTUVY7MELWKBDM6A
4,AGQUA2BLSSR6C3CK6Z6WENKF4BJQ,True,Woman approved,"I’m a girl and I bought this hat thinking it may be a little large, however if anything it fits a bit snug. Haven’t washed it yet but I’m hoping it’ll stretch easier after a wash. Also it’s a little long so the top sticks up a bit but I like the style so no complaints","November 24, 2019",Madison,5.0,One,https://www.amazon.ca/gp/profile/amzn1.account.AGQUA2BLSSR6C3CK6Z6WENKF4BJQ/ref=cm_cr_arp_d_gw_btm?ie=UTF8,2020-09-28 19:37:21.463660,2020-09-28 19:37:21.601275,Carhartt Men's Acrylic Watch Hat,Carhartt Sportswear - Mens,1,B002G9UDYG,AE3LRCOFYOIXMTUVY7MELWKBDM6A
5,AFGWN63QND3ERX343IGU24QJOPYQ,True,Fits tight and sits weird,"Picture made it look like this one for on your head perfect, but this one leaves that awkward little extra bit of hat stick off the top of your head, I like the top of my head to hit the hat, it's like how some kids wear their hat above their ears so they have a bit sticking high up, it's just weird, fashionable I suppose.

It's also really tight, probably better if you're bald, if you have some hair, you'll get serious hat head.","December 12, 2019",X.Farrell,3.0,0,https://www.amazon.ca/gp/profile/amzn1.account.AFGWN63QND3ERX343IGU24QJOPYQ/ref=cm_cr_arp_d_gw_btm?ie=UTF8,2020-09-28 19:37:21.605179,2020-09-28 19:37:21.778906,Carhartt Men's Acrylic Watch Hat,Carhartt Sportswear - Mens,1,B002G9UDYG,AE3LRCOFYOIXMTUVY7MELWKBDM6A
6,AGIJXTLLMI4SUGB2RJP4HKZYTMSA,True,Fits my XL head! Finally a one size fits all that does!,"Finally a hat that fits my XL head! When companies say one size fits all, they’re normally lying. This hat fits. Keeps my head fairly warm in the fall weather probably too light for the negative weather in Ontario.","November 5, 2019",SS,5.0,One,https://www.amazon.ca/gp/profile/amzn1.account.AGIJXTLLMI4SUGB2RJP4HKZYTMSA/ref=cm_cr_arp_d_gw_btm?ie=UTF8,2020-09-28 19:37:21.782810,2020-09-28 19:37:21.919450,Carhartt Men's Acrylic Watch Hat,Carhartt Sportswear - Mens,1,B002G9UDYG,AE3LRCOFYOIXMTUVY7MELWKBDM6A
7,AG6RS2WDSPHDOSYWIJIOYR6EPTAQ,True,Good hat,"I work outside during the winter and this hat is perfect. I have a big head and the hat is fairly big even for me. That being said it was exactly what I needed. Since I sweat a lot while working, I need to wash my hats more often. Most hats tend to shrink dramatically after numerous runs through the dryer which become unwearable for me. It's been one full winter and this hat seems like it will be useable for several more to come","June 2, 2020",Sean,5.0,0,https://www.amazon.ca/gp/profile/amzn1.account.AG6RS2WDSPHDOSYWIJIOYR6EPTAQ/ref=cm_cr_arp_d_gw_btm?ie=UTF8,2020-09-28 19:37:21.924330,2020-09-28 19:37:22.065849,Carhartt Men's Acrylic Watch Hat,Carhartt Sportswear - Mens,1,B002G9UDYG,AE3LRCOFYOIXMTUVY7MELWKBDM6A
8,AHKRLK3RS6HVZCAM6WX5UDJVHX4A,True,Carhartt Black toque 2020 trending,"This toque!!! so well made tightly woven perfectly stitched Carhartt Logo. A staple for my winter/fall wardrobe Carhartt since 1889 I mean c'mon, definitely a reliable Brand.

You wont regret this buy.
Shopper Kricket","January 15, 2020",Amazon Customer,5.0,0,https://www.amazon.ca/gp/profile/amzn1.account.AHKRLK3RS6HVZCAM6WX5UDJVHX4A/ref=cm_cr_arp_d_gw_btm?ie=UTF8,2020-09-28 19:37:22.070730,2020-09-28 19:37:22.211273,Carhartt Men's Acrylic Watch Hat,Carhartt Sportswear - Mens,1,B002G9UDYG,AE3LRCOFYOIXMTUVY7MELWKBDM6A
9,AFGXFQDX4MW72B2QOUET4CJZUMZA,True,Too “tall” for our liking.,"I bought this for my boyfriend for Christmas as he uses the Carhart brand quite a bit for workwear. It is too “tall”. We do not like the oversized look, I was expecting this hat to be a smaller, proper fit. I’m disappointed because he hasn’t worn this hat since I bought it for him, and most likely won’t wear it due to it being too big. It’s a shame because it looks like a really nice hat until it’s put on.","January 1, 2020",Melissa,2.0,0,https://www.amazon.ca/gp/profile/amzn1.account.AFGXFQDX4MW72B2QOUET4CJZUMZA/ref=cm_cr_arp_d_gw_btm?ie=UTF8,2020-09-28 19:37:22.215177,2020-09-28 19:37:22.429897,Carhartt Men's Acrylic Watch Hat,Carhartt Sportswear - Mens,1,B002G9UDYG,AE3LRCOFYOIXMTUVY7MELWKBDM6A
10,AE3LRCOFYOIXMTUVY7MELWKBDM6A,True,Holds up to washes. Great quality.,My biggest issue with toques is they often don't hold up well after being washed. This one is just as good after being washed. You really can't beat Carhartt for their quality at this price point. Excellent product.,"June 10, 2020",genericname,5.0,0,https://www.amazon.ca/gp/profile/amzn1.account.AE3LRCOFYOIXMTUVY7MELWKBDM6A/ref=cm_cr_getr_d_gw_btm?ie=UTF8,2020-09-28 19:37:28.550371,2020-09-28 19:37:28.703601,Carhartt Men's Acrylic Watch Hat,Carhartt Sportswear - Mens,1,B002G9UDYG,AE3LRCOFYOIXMTUVY7MELWKBDM6A
11,AEKDAGTS42KWFP7QZJ5N7AKULXCA,True,Fits a big head,"I love this toque, I've worn it everywhere. I had to stretch it out over the headrest of my computer chair the first night I got it, but after that it's fit my big head great. This is not the ""fashion"" version of the toque but honestly I've found no difference in how it looks on your head. It's still nice and long so there's that empty space at the top of the head and it just looks really nice (plus it's warm!).","April 8, 2019",savthep,5.0,0,https://www.amazon.ca/gp/profile/amzn1.account.AEKDAGTS42KWFP7QZJ5N7AKULXCA/ref=cm_cr_getr_d_gw_btm?ie=UTF8,2020-09-28 19:37:28.708481,2020-09-28 19:37:28.895873,Carhartt Men's Acrylic Watch Hat,Carhartt Sportswear - Mens,1,B002G9UDYG,AE3LRCOFYOIXMTUVY7MELWKBDM6A
12,AFWJPLV5HIGWJYLSKPSAZEOJ7IFA,True,Just another Carhartt's great product,"Fits greatly. Thick enough to keep your head warm. The only discomfort is that it is from acrylic, so some people might be sensitive to it. After all, I am very satisfied with my purchase.","August 2, 2020",Arman,4.0,0,https://www.amazon.ca/gp/profile/amzn1.account.AFWJPLV5HIGWJYLSKPSAZEOJ7IFA/ref=cm_cr_getr_d_gw_btm?ie=UTF8,2020-09-28 19:37:28.900754,2020-09-28 19:37:29.050081,Carhartt Men's Acrylic Watch Hat,Carhartt Sportswear - Mens,1,B002G9UDYG,AE3LRCOFYOIXMTUVY7MELWKBDM6A
13,AGWIVDRFXUF43RLYYKKD4RFRFWGQ,True,A++,16$ for a toque that is super well made and durable. I have a bunch of different colours. Another thing I love is they are MADE in Canada. Where can you find something of this quality for that price that is made at home? Great job Carhartt!,"January 2, 2020",matthewnightz,5.0,0,https://www.amazon.ca/gp/profile/amzn1.account.AGWIVDRFXUF43RLYYKKD4RFRFWGQ/ref=cm_cr_getr_d_gw_btm?ie=UTF8,2020-09-28 19:37:29.053009,2020-09-28 19:37:29.183792,Carhartt Men's Acrylic Watch Hat,Carhartt Sportswear - Mens,1,B002G9UDYG,AE3LRCOFYOIXMTUVY7MELWKBDM6A
14,AEL4PEFWBBEB7RDVIFLE6DVJDYKQ,True,Good quality but ridiculously tall,It's nice quality but its so long it sticks up way too much unless you fold it so much that it looks equally as ridiculous. it looks like something from a H3H3 video tbh,"November 20, 2018",Naomi,2.0,2,https://www.amazon.ca/gp/profile/amzn1.account.AEL4PEFWBBEB7RDVIFLE6DVJDYKQ/ref=cm_cr_getr_d_gw_btm?ie=UTF8,2020-09-28 19:37:29.188672,2020-09-28 19:37:29.313660,Carhartt Men's Acrylic Watch Hat,Carhartt Sportswear - Mens,1,B002G9UDYG,AE3LRCOFYOIXMTUVY7MELWKBDM6A
15,AHTWCGEQUXHUC2ZYGFDGTHVHYEVA,True,Love these toques!,This is a repeat purchase for our house! These carhart hats are so warm and comfy! Nice stretch to them so fit a variety of head sizes. Love that they come in a variety of colors! These wear and wash so well!! Love them!,"November 2, 2019",Bugs,5.0,0,https://www.amazon.ca/gp/profile/amzn1.account.AHTWCGEQUXHUC2ZYGFDGTHVHYEVA/ref=cm_cr_getr_d_gw_btm?ie=UTF8,2020-09-28 19:37:29.317539,2020-09-28 19:37:29.450276,Carhartt Men's Acrylic Watch Hat,Carhartt Sportswear - Mens,1,B002G9UDYG,AE3LRCOFYOIXMTUVY7MELWKBDM6A
16,AGFKBLLYNKT7P34QK4ZCGMWW46PQ,True,Stretched out,"I ordered this for my boyfriend, however when I opened it I noticed immediately it is extremely stretched out. The photos display it to be a short toque style, however when I opened it the hat is very long and would not fit anybody’s head properly. I’m very disappointed as I was looking forward to this surprise for him.","December 2, 2019",emma,1.0,One,https://www.amazon.ca/gp/profile/amzn1.account.AGFKBLLYNKT7P34QK4ZCGMWW46PQ/ref=cm_cr_getr_d_gw_btm?ie=UTF8,2020-09-28 19:37:29.456133,2020-09-28 19:37:29.601555,Carhartt Men's Acrylic Watch Hat,Carhartt Sportswear - Mens,1,B002G9UDYG,AE3LRCOFYOIXMTUVY7MELWKBDM6A
17,AGLA5ZWZDMXSMFLZMDSDDLVJ2BCQ,True,Not as pictured or expected,"Logo looked a little torn in the seems, thick ass Toque and fit was weird and bulky and over all masive Toque. Filed this under donations. ""Yes I'm Canadian and said to Toque""","April 19, 2020",Justin,2.0,0,https://www.amazon.ca/gp/profile/amzn1.account.AGLA5ZWZDMXSMFLZMDSDDLVJ2BCQ/ref=cm_cr_getr_d_gw_btm?ie=UTF8,2020-09-28 19:37:29.604482,2020-09-28 19:37:29.752836,Carhartt Men's Acrylic Watch Hat,Carhartt Sportswear - Mens,1,B002G9UDYG,AE3LRCOFYOIXMTUVY7MELWKBDM6A
18,AFJ7LSRK6AHXNAE6IPUQLCX624SA,True,The Great Quality You Would Expect,"I purchased the black hat and it came very quickly (same day), and the quality is fantastic. Very warm, not scratchy, no issues with the seam. I know some of the other reviews mentioned issues, possibly with where is was manufactured. The black hat was made in Canada and had all of the proper Carhart tags/labels.","February 29, 2020",Andi,5.0,0,https://www.amazon.ca/gp/profile/amzn1.account.AFJ7LSRK6AHXNAE6IPUQLCX624SA/ref=cm_cr_getr_d_gw_btm?ie=UTF8,2020-09-28 19:37:29.757715,2020-09-28 19:37:29.880712,Carhartt Men's Acrylic Watch Hat,Carhartt Sportswear - Mens,1,B002G9UDYG,AE3LRCOFYOIXMTUVY7MELWKBDM6A
19,AEA5FEQDBSIAM5QBLPN32JBRFDQA,True,Warm hat and looks good,"Overall, this hat is warm. If it is -5 degrees Celcius or higher I don't wear my hood. If it is much colder than -5 degrees Celsius then the hat is not enough and I put my jacket's hood on. I think this hat will be fine all winter. I have not had any quality issues with it so far.","January 11, 2019",Theodore Gemmer,5.0,0,https://www.amazon.ca/gp/profile/amzn1.account.AEA5FEQDBSIAM5QBLPN32JBRFDQA/ref=cm_cr_getr_d_gw_btm?ie=UTF8,2020-09-28 19:37:29.884595,2020-09-28 19:37:30.018305,Carhartt Men's Acrylic Watch Hat,Carhartt Sportswear - Mens,1,B002G9UDYG,AE3LRCOFYOIXMTUVY7MELWKBDM6A
20,AGHGPVHAOJBG6JEWG7III3WEWQOQ,True,The best of the four I bought,"I bought four toques at the same time, adding to several I already had. I like this one the best. It is the softest and has a gentle stretch so it never feels tight. It fits well. It is warm without becoming too hot. The black one I got is made in Canada and is the best quality of them all.","December 8, 2018",GL,5.0,0,https://www.amazon.ca/gp/profile/amzn1.account.AGHGPVHAOJBG6JEWG7III3WEWQOQ/ref=cm_cr_getr_d_gw_btm?ie=UTF8,2020-09-28 19:37:32.237073,2020-09-28 19:37:32.541585,Carhartt Men's Acrylic Watch Hat,Carhartt Sportswear - Mens,1,B002G9UDYG,AE3LRCOFYOIXMTUVY7MELWKBDM6A
21,AFAQMHIQTUUCJDCWCX6QMQKIGLKA,True,Nice warm hat,I lost this hat a few months ago but let me tell ya it was a damn good hat when I had it! Nice and warm and the had is even long enough to cover your ears so they dont freeze off!,"March 14, 2020",Luke,5.0,0,https://www.amazon.ca/gp/profile/amzn1.account.AFAQMHIQTUUCJDCWCX6QMQKIGLKA/ref=cm_cr_getr_d_gw_btm?ie=UTF8,2020-09-28 19:37:32.546464,2020-09-28 19:37:32.706532,Carhartt Men's Acrylic Watch Hat,Carhartt Sportswear - Mens,1,B002G9UDYG,AE3LRCOFYOIXMTUVY7MELWKBDM6A
22,AFBTPDCJADUK6TK5GI4FUPGBYVUA,True,Great Toque,"This is a toque is great. I have purchased two , I have one at the house and one at work. You can purchase this knowing you are getting great quality from Carhartt","January 3, 2020",Topgun,5.0,0,https://www.amazon.ca/gp/profile/amzn1.account.AFBTPDCJADUK6TK5GI4FUPGBYVUA/ref=cm_cr_getr_d_gw_btm?ie=UTF8,2020-09-28 19:37:32.711409,2020-09-28 19:37:32.920271,Carhartt Men's Acrylic Watch Hat,Carhartt Sportswear - Mens,1,B002G9UDYG,AE3LRCOFYOIXMTUVY7MELWKBDM6A
23,AH5YPDSCTK5FU3IGGHZM5GJ477IQ,True,Exactly as expected,I hesitated because if hats are not tall enough they slip off my head. I was worried this wouldn't fit as well as the ones I've tried on but balked at the inflated prices. This is super cozy and comfy and cute. I doubt I'll take it off my head this winter as we Canadians start the hibernation process.,"November 14, 2018",Christine Donovan,5.0,0,https://www.amazon.ca/gp/profile/amzn1.account.AH5YPDSCTK5FU3IGGHZM5GJ477IQ/ref=cm_cr_getr_d_gw_btm?ie=UTF8,2020-09-28 19:37:32.926128,2020-09-28 19:37:33.064719,Carhartt Men's Acrylic Watch Hat,Carhartt Sportswear - Mens,1,B002G9UDYG,AE3LRCOFYOIXMTUVY7MELWKBDM6A
24,AFZ62M5N57FTG75TND7MBHRCRFQQ,True,Warm and classic beanie,"First of all, this is a warm hat. I would save this one for especially cold days. It also makes me feel like a rough n' tumble construction worker because of the Carhartt label on the front. :-) Recommended!","March 11, 2019",loob,4.0,0,https://www.amazon.ca/gp/profile/amzn1.account.AFZ62M5N57FTG75TND7MBHRCRFQQ/ref=cm_cr_getr_d_gw_btm?ie=UTF8,2020-09-28 19:37:33.069599,2020-09-28 19:37:33.261871,Carhartt Men's Acrylic Watch Hat,Carhartt Sportswear - Mens,1,B002G9UDYG,AE3LRCOFYOIXMTUVY7MELWKBDM6A
25,AHRAUT7GNJ4LHYDFXHLKGXMWHIUQ,True,Warm but made for Sasquatch heads,"Nice warm touque, good for Winnipeg weather! They have changed the fit on these a bit though since my last one, you get a bit of a “tip” on top of your head and I have a big Mellon....","February 15, 2020",Steve Carpenter,5.0,0,https://www.amazon.ca/gp/profile/amzn1.account.AHRAUT7GNJ4LHYDFXHLKGXMWHIUQ/ref=cm_cr_getr_d_gw_btm?ie=UTF8,2020-09-28 19:37:33.265774,2020-09-28 19:37:33.399486,Carhartt Men's Acrylic Watch Hat,Carhartt Sportswear - Mens,1,B002G9UDYG,AE3LRCOFYOIXMTUVY7MELWKBDM6A
26,AESW5KPTQYAWZJGZHDYTI2VTMLZA,True,Way too big,I ordered a Carhartt hat off amazon and i liked it so much I decided to order 2 more colours. I got a black one and the marled navy one as a gift and they are both about an inch taller and half an inch wider than my other one so now these just fit stupid and I have a big head so I can’t imagine how it will look on the person I’m giving the navy one too. Very unhappy,"December 19, 2019",Nicole Gratton,3.0,0,https://www.amazon.ca/gp/profile/amzn1.account.AESW5KPTQYAWZJGZHDYTI2VTMLZA/ref=cm_cr_getr_d_gw_btm?ie=UTF8,2020-09-28 19:37:33.403391,2020-09-28 19:37:33.535149,Carhartt Men's Acrylic Watch Hat,Carhartt Sportswear - Mens,1,B002G9UDYG,AE3LRCOFYOIXMTUVY7MELWKBDM6A
27,AGZLVRPMWYG3QNUGOS7WKW6XXEAQ,True,Amazing WARM hat for anyone!!,"My son loves these, along with the Carhartt coat and hat for the cold winter, especially working outdoors.
Solid brand. Highly recommend!!","March 3, 2020",Kate,5.0,0,https://www.amazon.ca/gp/profile/amzn1.account.AGZLVRPMWYG3QNUGOS7WKW6XXEAQ/ref=cm_cr_getr_d_gw_btm?ie=UTF8,2020-09-28 19:37:33.540030,2020-09-28 19:37:33.688381,Carhartt Men's Acrylic Watch Hat,Carhartt Sportswear - Mens,1,B002G9UDYG,AE3LRCOFYOIXMTUVY7MELWKBDM6A
28,AHTTDQQCPWK66C3HZG4PGNFKL2XQ,True,Very long hat,"Hard to see in photo but this hat is very long. I don't like extra hat hanging off my head, it looks ridiculous. I had to fold it over twice to make it fit nicer. Would rather have bought a different hat, but it gets the job done.","April 6, 2020",Austin B.,3.0,0,https://www.amazon.ca/gp/profile/amzn1.account.AHTTDQQCPWK66C3HZG4PGNFKL2XQ/ref=cm_cr_getr_d_gw_btm?ie=UTF8,2020-09-28 19:37:33.691309,2020-09-28 19:37:33.812333,Carhartt Men's Acrylic Watch Hat,Carhartt Sportswear - Mens,1,B002G9UDYG,AE3LRCOFYOIXMTUVY7MELWKBDM6A
29,AHZAEUTAYEDX6AVABCLQ6SC2T6TQ,True,Great! Perfect for Canadian Winters!,"Cute! Fits great! Warm! Has the authentic tag. Only complaint is that it was that it came wrinkled in the centre, not sure if I can remedy with a steam or iron. Isn’t too noticeable since it’s black, but it’s a wrinkle/fold that shouldn’t be there and is “permanent”/“pressed in” so to speak.","December 16, 2019",tbk,5.0,0,https://www.amazon.ca/gp/profile/amzn1.account.AHZAEUTAYEDX6AVABCLQ6SC2T6TQ/ref=cm_cr_getr_d_gw_btm?ie=UTF8,2020-09-28 19:37:33.816237,2020-09-28 19:37:33.978253,Carhartt Men's Acrylic Watch Hat,Carhartt Sportswear - Mens,1,B002G9UDYG,AE3LRCOFYOIXMTUVY7MELWKBDM6A
30,AFTCYIKVYCPR262SZSMAUOON3Z7Q,True,A little small but overall good,"I have another carhartt hat that i bought in store and boathouse recently and the one that i just bought from there fits a lot more comfy and just perfect. The one i ordered from here was really small on me and did not fit right, but overall other than that is great","April 20, 2020",Serena,3.0,0,https://www.amazon.ca/gp/profile/amzn1.account.AFTCYIKVYCPR262SZSMAUOON3Z7Q/ref=cm_cr_getr_d_gw_btm?ie=UTF8,2020-09-28 19:37:37.076232,2020-09-28 19:37:37.228489,Carhartt Men's Acrylic Watch Hat,Carhartt Sportswear - Mens,1,B002G9UDYG,AE3LRCOFYOIXMTUVY7MELWKBDM6A
31,AESKPLK5T77JEQVRQ7F5Y2GV4KTQ,True,4 Star,"fits well and keeps my head warm
Got electricians heated wearing carhart like nah i don't know how to fix your breaker but i look like i do","March 18, 2020",Jeffrey A.,4.0,0,https://www.amazon.ca/gp/profile/amzn1.account.AESKPLK5T77JEQVRQ7F5Y2GV4KTQ/ref=cm_cr_getr_d_gw_btm?ie=UTF8,2020-09-28 19:37:37.233369,2020-09-28 19:37:37.411976,Carhartt Men's Acrylic Watch Hat,Carhartt Sportswear - Mens,1,B002G9UDYG,AE3LRCOFYOIXMTUVY7MELWKBDM6A
32,AG63OTWQKB453I6SP62ZV42ERPYA,True,A popular choice!,"My teenage daughter loves these toques! Collecting all of the colour options, it would seem.
Well made and comfortable.","December 30, 2019",Steve Brand,5.0,0,https://www.amazon.ca/gp/profile/amzn1.account.AG63OTWQKB453I6SP62ZV42ERPYA/ref=cm_cr_getr_d_gw_btm?ie=UTF8,2020-09-28 19:37:37.415880,2020-09-28 19:37:37.595463,Carhartt Men's Acrylic Watch Hat,Carhartt Sportswear - Mens,1,B002G9UDYG,AE3LRCOFYOIXMTUVY7MELWKBDM6A
33,AEZKHFP22FDXWAJ3CAPWX3MTHXQQ,True,Will be returning,"Not my first Carhartt beanie, however the fit of this one is horrendous. It's so so deep and puffy on top. Disappointed in the fit, was expecting the old fit, that was less elongated.","December 11, 2018",Chloe,2.0,0,https://www.amazon.ca/gp/profile/amzn1.account.AEZKHFP22FDXWAJ3CAPWX3MTHXQQ/ref=cm_cr_getr_d_gw_btm?ie=UTF8,2020-09-28 19:37:37.600344,2020-09-28 19:37:37.809207,Carhartt Men's Acrylic Watch Hat,Carhartt Sportswear - Mens,1,B002G9UDYG,AE3LRCOFYOIXMTUVY7MELWKBDM6A
34,AGTCQNJYQAUTDVVZCHO6GU3DYGBA,True,Quality,Love love love. Comfortable and keeps my head warm when I'm out doing yard work in any weather! Hubby loves to steal it for work too lol,"November 22, 2019",Sarah,5.0,0,https://www.amazon.ca/gp/profile/amzn1.account.AGTCQNJYQAUTDVVZCHO6GU3DYGBA/ref=cm_cr_getr_d_gw_btm?ie=UTF8,2020-09-28 19:37:37.814087,2020-09-28 19:37:37.947799,Carhartt Men's Acrylic Watch Hat,Carhartt Sportswear - Mens,1,B002G9UDYG,AE3LRCOFYOIXMTUVY7MELWKBDM6A
35,AFNR3UYUW6SETRUTKOQL627ZNDOQ,True,Cheap quality hat thats great for anyone,Hat stretches to fit your head. Great product. Im an apprentice carpenter and it holds up very well on the job. Holds up for easily half a year for like $12? Lots of colors to choose for different days of the week too which I like. Can't be beat imo.,"January 25, 2019",Cameron,5.0,0,https://www.amazon.ca/gp/profile/amzn1.account.AFNR3UYUW6SETRUTKOQL627ZNDOQ/ref=cm_cr_getr_d_gw_btm?ie=UTF8,2020-09-28 19:37:37.952679,2020-09-28 19:37:38.069799,Carhartt Men's Acrylic Watch Hat,Carhartt Sportswear - Mens,1,B002G9UDYG,AE3LRCOFYOIXMTUVY7MELWKBDM6A
36,AGZ3O457IP7K7JRGHCEVQTFJZZJQ,True,love it,love it ! super comfy and affordable. arrived quickly and in great condition. would buy again !,"May 13, 2020",Sarah ,5.0,0,https://www.amazon.ca/gp/profile/amzn1.account.AGZ3O457IP7K7JRGHCEVQTFJZZJQ/ref=cm_cr_getr_d_gw_btm?ie=UTF8,2020-09-28 19:37:38.073702,2020-09-28 19:37:38.223037,Carhartt Men's Acrylic Watch Hat,Carhartt Sportswear - Mens,1,B002G9UDYG,AE3LRCOFYOIXMTUVY7MELWKBDM6A
37,AELLLH3UIGL7GONNKP2A2SVML6OQ,True,Great product,"Well made and thick. The fold is not stitched, it can be unfolded to cover ears. Highly recommend the product.","February 1, 2020",Dave,5.0,0,https://www.amazon.ca/gp/profile/amzn1.account.AELLLH3UIGL7GONNKP2A2SVML6OQ/ref=cm_cr_getr_d_gw_btm?ie=UTF8,2020-09-28 19:37:38.227910,2020-09-28 19:37:38.356742,Carhartt Men's Acrylic Watch Hat,Carhartt Sportswear - Mens,1,B002G9UDYG,AE3LRCOFYOIXMTUVY7MELWKBDM6A
38,AF6RIEEAXZX3NIJZ5LPYEW6YUWQQ,True,Cute,"If you're gonna be basic, might as well get this hat because it looks great on literally everybody.","April 29, 2020",Becky,5.0,0,https://www.amazon.ca/gp/profile/amzn1.account.AF6RIEEAXZX3NIJZ5LPYEW6YUWQQ/ref=cm_cr_getr_d_gw_btm?ie=UTF8,2020-09-28 19:37:38.361622,2020-09-28 19:37:38.480693,Carhartt Men's Acrylic Watch Hat,Carhartt Sportswear - Mens,1,B002G9UDYG,AE3LRCOFYOIXMTUVY7MELWKBDM6A
39,AHCN2SY6LI75UB2E3M27TEFTJ3VQ,True,huge,Its literally massive. I cant wear it comfortably without having an extra 4 or 5 inches of hat above my head it looks kinda stupid. the only hat ive ever worn that is too big and too small at the same time how is that even possible lol,"September 12, 2020",CCXTE1,3.0,0,https://www.amazon.ca/gp/profile/amzn1.account.AHCN2SY6LI75UB2E3M27TEFTJ3VQ/ref=cm_cr_getr_d_gw_btm?ie=UTF8,2020-09-28 19:37:38.484597,2020-09-28 19:37:38.650563,Carhartt Men's Acrylic Watch Hat,Carhartt Sportswear - Mens,1,B002G9UDYG,AE3LRCOFYOIXMTUVY7MELWKBDM6A
40,AEOEWYAJA5Q35PUKHGZIRKRSHBBA,True,The tallest hat I've ever owned.,"The hat is warm, well built. The stitching on the logo badge is good. But the hat is SO TALL. If it wasn't for the logo, I would double up on the brim roll. Rather, I'm left looking like I just raided Ethan Klein's hat collection. It's almost comical how tall this hat is.","November 21, 2019",ilikequilts,3.0,0,https://www.amazon.ca/gp/profile/amzn1.account.AEOEWYAJA5Q35PUKHGZIRKRSHBBA/ref=cm_cr_getr_d_gw_btm?ie=UTF8,2020-09-28 19:37:44.773560,2020-09-28 19:37:44.907244,Carhartt Men's Acrylic Watch Hat,Carhartt Sportswear - Mens,1,B002G9UDYG,AE3LRCOFYOIXMTUVY7MELWKBDM6A
