,subproduct_author_id,verified_purchase,review_title,reviews,date,reviewer_name,ratings,people_find_helpful,reviewer_profile_url,start_time,end_time,product_name,brand_name,rank,product_id,author_id
95,AEMXNB5XYTWOF32IE46WYHY4ZUQA,True,Worth the purchase!,"Great toque, fits great. Material feels nice and warm. Gotta get myself another pair in a different color!","April 21, 2020",Papa Bravo,5.0,0,https://www.amazon.ca/gp/profile/amzn1.account.AEMXNB5XYTWOF32IE46WYHY4ZUQA/ref=cm_cr_getr_d_gw_btm?ie=UTF8,2020-09-28 19:38:12.902163,2020-09-28 19:38:13.083700,Carhartt Men's Acrylic Watch Hat,Carhartt Sportswear - Mens,1,B002G9UDYG,AE3LRCOFYOIXMTUVY7MELWKBDM6A
96,AE7SSZYOT6UWUSBEJFS3K2RTRRTQ,True,It's cool!,Great hat warm!!!! 5 star!,"July 11, 2020",Sean B.,5.0,0,https://www.amazon.ca/gp/profile/amzn1.account.AE7SSZYOT6UWUSBEJFS3K2RTRRTQ/ref=cm_cr_getr_d_gw_btm?ie=UTF8,2020-09-28 19:38:13.088579,2020-09-28 19:38:13.232053,Carhartt Men's Acrylic Watch Hat,Carhartt Sportswear - Mens,1,B002G9UDYG,AE3LRCOFYOIXMTUVY7MELWKBDM6A
97,AFA2FNJU2BO6ACMFUDSPSA6BA4QA,True,Great quality,Great quality. Fits a little snug though compared to my black Carhartt hat,"November 3, 2019",Handsome Hell,4.0,0,https://www.amazon.ca/gp/profile/amzn1.account.AFA2FNJU2BO6ACMFUDSPSA6BA4QA/ref=cm_cr_getr_d_gw_btm?ie=UTF8,2020-09-28 19:38:13.235956,2020-09-28 19:38:13.420420,Carhartt Men's Acrylic Watch Hat,Carhartt Sportswear - Mens,1,B002G9UDYG,AE3LRCOFYOIXMTUVY7MELWKBDM6A
98,AFYWTKY6GYB42MIBG5I2BLDBRKOQ,True,Real,REAL hat!! Made in Canada. It’s a little tall but that’s how people wear them nowadays and you can easily roll it up a little to make it shorter. Satisfied !,"August 16, 2020",Olivia ,4.0,0,https://www.amazon.ca/gp/profile/amzn1.account.AFYWTKY6GYB42MIBG5I2BLDBRKOQ/ref=cm_cr_getr_d_gw_btm?ie=UTF8,2020-09-28 19:38:13.426275,2020-09-28 19:38:13.567795,Carhartt Men's Acrylic Watch Hat,Carhartt Sportswear - Mens,1,B002G9UDYG,AE3LRCOFYOIXMTUVY7MELWKBDM6A
99,AHYWMIOFZ43665TJNHEODZT5476A,True,Would buy again,Great quality,"April 29, 2020",Heather ,5.0,0,https://www.amazon.ca/gp/profile/amzn1.account.AHYWMIOFZ43665TJNHEODZT5476A/ref=cm_cr_getr_d_gw_btm?ie=UTF8,2020-09-28 19:38:13.572674,2020-09-28 19:38:13.714196,Carhartt Men's Acrylic Watch Hat,Carhartt Sportswear - Mens,1,B002G9UDYG,AE3LRCOFYOIXMTUVY7MELWKBDM6A
100,AEJ5LNEVGV3VO7X2LIUEUI2GLJXA,True,Great Slouch Style,"Nice quality and warm! However, it was more of a slouch style.","December 15, 2019",Abigail,5.0,0,https://www.amazon.ca/gp/profile/amzn1.account.AEJ5LNEVGV3VO7X2LIUEUI2GLJXA/ref=cm_cr_getr_d_gw_btm?ie=UTF8,2020-09-28 19:38:16.929131,2020-09-28 19:38:17.057963,Carhartt Men's Acrylic Watch Hat,Carhartt Sportswear - Mens,1,B002G9UDYG,AE3LRCOFYOIXMTUVY7MELWKBDM6A
101,AGNCVIG6JUE2PCIKMEF3IWGYHA5Q,True,Comfy,Love this hat!,"March 18, 2020",Julia Butler,5.0,0,https://www.amazon.ca/gp/profile/amzn1.account.AGNCVIG6JUE2PCIKMEF3IWGYHA5Q/ref=cm_cr_getr_d_gw_btm?ie=UTF8,2020-09-28 19:38:17.061868,2020-09-28 19:38:17.212170,Carhartt Men's Acrylic Watch Hat,Carhartt Sportswear - Mens,1,B002G9UDYG,AE3LRCOFYOIXMTUVY7MELWKBDM6A
102,AGR557ZB5HIFTHTNUMTAFZVQ6PWA,True,Warm,"Price is right, and its Carhartt. What more is there to say.","November 17, 2019",Amazon Customer,5.0,0,https://www.amazon.ca/gp/profile/amzn1.account.AGR557ZB5HIFTHTNUMTAFZVQ6PWA/ref=cm_cr_getr_d_gw_btm?ie=UTF8,2020-09-28 19:38:17.218026,2020-09-28 19:38:17.346901,Carhartt Men's Acrylic Watch Hat,Carhartt Sportswear - Mens,1,B002G9UDYG,AE3LRCOFYOIXMTUVY7MELWKBDM6A
103,AFDURBMQQCODXGDCRBL24ORX5J6Q,True,Did i order 2 different kinds of hats,I ordered 2 hats different colours and they are different hats totally. The black hat could fit on a giraffes neck its tight and very long. Not like the other its perfect and fits right.,"December 11, 2019",Janice Smith,1.0,0,https://www.amazon.ca/gp/profile/amzn1.account.AFDURBMQQCODXGDCRBL24ORX5J6Q/ref=cm_cr_getr_d_gw_btm?ie=UTF8,2020-09-28 19:38:17.351807,2020-09-28 19:38:17.478663,Carhartt Men's Acrylic Watch Hat,Carhartt Sportswear - Mens,1,B002G9UDYG,AE3LRCOFYOIXMTUVY7MELWKBDM6A
104,AFGMGM3FYEONPY6XQHHWZCF7263A,True,Good toque,Four stars since it shrunk just a bit but nothing to lose sleep over.,"February 18, 2019",I Like Good Products,4.0,0,https://www.amazon.ca/gp/profile/amzn1.account.AFGMGM3FYEONPY6XQHHWZCF7263A/ref=cm_cr_getr_d_gw_btm?ie=UTF8,2020-09-28 19:38:17.483542,2020-09-28 19:38:17.670933,Carhartt Men's Acrylic Watch Hat,Carhartt Sportswear - Mens,1,B002G9UDYG,AE3LRCOFYOIXMTUVY7MELWKBDM6A
105,AGW6WPBUGNYVKRBYVSTDFXELDASQ,True,Awesome quality,This is my favourite hat. Super comfy and nice to wear. 10/10,"April 23, 2020",Kyla,5.0,0,https://www.amazon.ca/gp/profile/amzn1.account.AGW6WPBUGNYVKRBYVSTDFXELDASQ/ref=cm_cr_getr_d_gw_btm?ie=UTF8,2020-09-28 19:38:17.675813,2020-09-28 19:38:17.871013,Carhartt Men's Acrylic Watch Hat,Carhartt Sportswear - Mens,1,B002G9UDYG,AE3LRCOFYOIXMTUVY7MELWKBDM6A
106,AFVAFH2HRMMSUGFT5PPT2UHUWK7A,True,good,good,"July 16, 2020",Pavlica,5.0,0,https://www.amazon.ca/gp/profile/amzn1.account.AFVAFH2HRMMSUGFT5PPT2UHUWK7A/ref=cm_cr_getr_d_gw_btm?ie=UTF8,2020-09-28 19:38:17.875893,2020-09-28 19:38:18.048647,Carhartt Men's Acrylic Watch Hat,Carhartt Sportswear - Mens,1,B002G9UDYG,AE3LRCOFYOIXMTUVY7MELWKBDM6A
107,AH6CPD5T6Q4OO2Q5HVG6BOTIHTKA,True,Great toque,Carhartt toque at its best,"February 5, 2020",fred flinstone,5.0,0,https://www.amazon.ca/gp/profile/amzn1.account.AH6CPD5T6Q4OO2Q5HVG6BOTIHTKA/ref=cm_cr_getr_d_gw_btm?ie=UTF8,2020-09-28 19:38:18.054502,2020-09-28 19:38:18.196996,Carhartt Men's Acrylic Watch Hat,Carhartt Sportswear - Mens,1,B002G9UDYG,AE3LRCOFYOIXMTUVY7MELWKBDM6A
108,AGMNYOHZHF3NEDYYTTCDEJEH5FOA,True,So great !,"So comfy, its perfect!","January 15, 2020",Philippe ,5.0,0,https://www.amazon.ca/gp/profile/amzn1.account.AGMNYOHZHF3NEDYYTTCDEJEH5FOA/ref=cm_cr_getr_d_gw_btm?ie=UTF8,2020-09-28 19:38:18.200900,2020-09-28 19:38:18.353156,Carhartt Men's Acrylic Watch Hat,Carhartt Sportswear - Mens,1,B002G9UDYG,AE3LRCOFYOIXMTUVY7MELWKBDM6A
109,AHBFVVTWYTG4CVLCBPGPIU45TZFA,True,Super comfy and big enough to cover his ears,My boyfriend loves it! Super comfy and big enough to cover his ears.,"January 12, 2018",Camille Prévost,5.0,One,https://www.amazon.ca/gp/profile/amzn1.account.AHBFVVTWYTG4CVLCBPGPIU45TZFA/ref=cm_cr_getr_d_gw_btm?ie=UTF8,2020-09-28 19:38:18.358036,2020-09-28 19:38:18.534693,Carhartt Men's Acrylic Watch Hat,Carhartt Sportswear - Mens,1,B002G9UDYG,AE3LRCOFYOIXMTUVY7MELWKBDM6A
110,AEKJXOHCOI77BZXXBHN5BNH42LSQ,True,Pretty much a Toque,"This is most definitely a toque, I've studied toques for years and this is one.","December 21, 2019",Midnight Shopper,5.0,0,https://www.amazon.ca/gp/profile/amzn1.account.AEKJXOHCOI77BZXXBHN5BNH42LSQ/ref=cm_cr_getr_d_gw_btm?ie=UTF8,2020-09-28 19:38:24.669460,2020-09-28 19:38:24.823702,Carhartt Men's Acrylic Watch Hat,Carhartt Sportswear - Mens,1,B002G9UDYG,AE3LRCOFYOIXMTUVY7MELWKBDM6A
111,AGRQAQRAZEYDMNV3TU4UH472BAJQ,True,Great looking beanie but uncomfortable to wear for long,"Great looking hat, fit my head as expected. It's pretty warm and has held up to the Toronto weather so far but the hat gets pretty itchy for me around my forehead.","December 8, 2018",Alan,3.0,0,https://www.amazon.ca/gp/profile/amzn1.account.AGRQAQRAZEYDMNV3TU4UH472BAJQ/ref=cm_cr_getr_d_gw_btm?ie=UTF8,2020-09-28 19:38:24.828582,2020-09-28 19:38:24.957444,Carhartt Men's Acrylic Watch Hat,Carhartt Sportswear - Mens,1,B002G9UDYG,AE3LRCOFYOIXMTUVY7MELWKBDM6A
112,AFXCOA3QATHO76LR7UQTMEUYF4YQ,True,Bigger than expected,Bigger than I expected. But who wants a small hat?,"February 17, 2020",Alex,5.0,0,https://www.amazon.ca/gp/profile/amzn1.account.AFXCOA3QATHO76LR7UQTMEUYF4YQ/ref=cm_cr_getr_d_gw_btm?ie=UTF8,2020-09-28 19:38:24.961318,2020-09-28 19:38:25.107716,Carhartt Men's Acrylic Watch Hat,Carhartt Sportswear - Mens,1,B002G9UDYG,AE3LRCOFYOIXMTUVY7MELWKBDM6A
113,AGQZFDUOEOEFT6HGOIH2Z6H4EBGA,True,Perfect!,Fit perfect and is really warm.,"October 21, 2019",Darcy Potter,5.0,0,https://www.amazon.ca/gp/profile/amzn1.account.AGQZFDUOEOEFT6HGOIH2Z6H4EBGA/ref=cm_cr_getr_d_gw_btm?ie=UTF8,2020-09-28 19:38:25.111620,2020-09-28 19:38:25.236548,Carhartt Men's Acrylic Watch Hat,Carhartt Sportswear - Mens,1,B002G9UDYG,AE3LRCOFYOIXMTUVY7MELWKBDM6A
114,AGSY45O2FW3G5ZJYYXPRZKLTOO6A,True,Awesome winter hat.,"Works great, fits well. Keeps my head warm.","January 14, 2020",Anthony Isadore,5.0,0,https://www.amazon.ca/gp/profile/amzn1.account.AGSY45O2FW3G5ZJYYXPRZKLTOO6A/ref=cm_cr_getr_d_gw_btm?ie=UTF8,2020-09-28 19:38:25.240452,2020-09-28 19:38:25.383924,Carhartt Men's Acrylic Watch Hat,Carhartt Sportswear - Mens,1,B002G9UDYG,AE3LRCOFYOIXMTUVY7MELWKBDM6A
115,AHHRO37TDSU2T3LXXOIXS7VJNX6Q,True,Proper Quality,Shipped/Delivered as expected. I got a big head so took some time to stretch the walls out. Worth every dollhair.,"March 4, 2020",KluKlanLeader,5.0,0,https://www.amazon.ca/gp/profile/amzn1.account.AHHRO37TDSU2T3LXXOIXS7VJNX6Q/ref=cm_cr_getr_d_gw_btm?ie=UTF8,2020-09-28 19:38:25.388804,2020-09-28 19:38:25.518612,Carhartt Men's Acrylic Watch Hat,Carhartt Sportswear - Mens,1,B002G9UDYG,AE3LRCOFYOIXMTUVY7MELWKBDM6A
116,AG576J7VFHLMWMATHNPDK2QJZUSQ,True,Not impressed,"Bought this for Christmas for a family member, material is super itchy; caused rash, not as stretchy as I’d assumed so was quite snug, probably not the best hat you could buy","December 24, 2019",Leslie Miller,1.0,0,https://www.amazon.ca/gp/profile/amzn1.account.AG576J7VFHLMWMATHNPDK2QJZUSQ/ref=cm_cr_getr_d_gw_btm?ie=UTF8,2020-09-28 19:38:25.522515,2020-09-28 19:38:25.654332,Carhartt Men's Acrylic Watch Hat,Carhartt Sportswear - Mens,1,B002G9UDYG,AE3LRCOFYOIXMTUVY7MELWKBDM6A
117,AGFJWEFOU4MYJWRWZZ77RIMNLNEA,True,doesn't swamp your head and hair like some other types,"Fits well, doesn't swamp your head and hair like some other types.
Good hat for this price.","April 24, 2018",Jake and Jess,5.0,0,https://www.amazon.ca/gp/profile/amzn1.account.AGFJWEFOU4MYJWRWZZ77RIMNLNEA/ref=cm_cr_getr_d_gw_btm?ie=UTF8,2020-09-28 19:38:25.658209,2020-09-28 19:38:25.823160,Carhartt Men's Acrylic Watch Hat,Carhartt Sportswear - Mens,1,B002G9UDYG,AE3LRCOFYOIXMTUVY7MELWKBDM6A
118,AFU6DMQNWPQ22LQFGAJVV4DQ3D4Q,True,Very warm,Looks good.,"March 4, 2020",Chris OCallaghan,5.0,0,https://www.amazon.ca/gp/profile/amzn1.account.AFU6DMQNWPQ22LQFGAJVV4DQ3D4Q/ref=cm_cr_getr_d_gw_btm?ie=UTF8,2020-09-28 19:38:25.828041,2020-09-28 19:38:25.955921,Carhartt Men's Acrylic Watch Hat,Carhartt Sportswear - Mens,1,B002G9UDYG,AE3LRCOFYOIXMTUVY7MELWKBDM6A
119,AEL2VWAASBDPV3WI77CQUCZUDH5Q,True,Good quality...,Good quality toque.,"December 28, 2019",JLD,5.0,0,https://www.amazon.ca/gp/profile/amzn1.account.AEL2VWAASBDPV3WI77CQUCZUDH5Q/ref=cm_cr_getr_d_gw_btm?ie=UTF8,2020-09-28 19:38:25.959800,2020-09-28 19:38:26.096477,Carhartt Men's Acrylic Watch Hat,Carhartt Sportswear - Mens,1,B002G9UDYG,AE3LRCOFYOIXMTUVY7MELWKBDM6A
120,AEJEBBRJZQ3CRKJVIICNBFZJC7BQ,True,Large,Good product but fits pretty large,"August 25, 2019",Zario,3.0,0,https://www.amazon.ca/gp/profile/amzn1.account.AEJEBBRJZQ3CRKJVIICNBFZJC7BQ/ref=cm_cr_getr_d_gw_btm?ie=UTF8,2020-09-28 19:38:29.211933,2020-09-28 19:38:29.338813,Carhartt Men's Acrylic Watch Hat,Carhartt Sportswear - Mens,1,B002G9UDYG,AE3LRCOFYOIXMTUVY7MELWKBDM6A
121,AF747QO6OQ23YNK3H7BPTQ5WD44A,True,Winter hat,Really liked this hat and fits great.,"October 14, 2019",Meghan,5.0,0,https://www.amazon.ca/gp/profile/amzn1.account.AF747QO6OQ23YNK3H7BPTQ5WD44A/ref=cm_cr_getr_d_gw_btm?ie=UTF8,2020-09-28 19:38:29.342717,2020-09-28 19:38:29.503759,Carhartt Men's Acrylic Watch Hat,Carhartt Sportswear - Mens,1,B002G9UDYG,AE3LRCOFYOIXMTUVY7MELWKBDM6A
122,AHPCRLYWXAMEX7HPUYCHAKEAKD6Q,True,hat,great product. good quality,"January 28, 2020",K Gibson,5.0,0,https://www.amazon.ca/gp/profile/amzn1.account.AHPCRLYWXAMEX7HPUYCHAKEAKD6Q/ref=cm_cr_getr_d_gw_btm?ie=UTF8,2020-09-28 19:38:29.507660,2020-09-28 19:38:29.635538,Carhartt Men's Acrylic Watch Hat,Carhartt Sportswear - Mens,1,B002G9UDYG,AE3LRCOFYOIXMTUVY7MELWKBDM6A
123,AEFDKSTEJA7CBLQUI3DZ5FS47MQQ,True,Classic,"Always a great touque! Good price, well made and shipped fast!","December 13, 2019",Amazon Customer,5.0,0,https://www.amazon.ca/gp/profile/amzn1.account.AEFDKSTEJA7CBLQUI3DZ5FS47MQQ/ref=cm_cr_getr_d_gw_btm?ie=UTF8,2020-09-28 19:38:29.639420,2020-09-28 19:38:29.764348,Carhartt Men's Acrylic Watch Hat,Carhartt Sportswear - Mens,1,B002G9UDYG,AE3LRCOFYOIXMTUVY7MELWKBDM6A
124,AGV4LKXFHSPFXJRCK7XE7ON52SYQ,True,Perfect,Exactly as described,"January 3, 2020",Kaycee Pauquette,5.0,0,https://www.amazon.ca/gp/profile/amzn1.account.AGV4LKXFHSPFXJRCK7XE7ON52SYQ/ref=cm_cr_getr_d_gw_btm?ie=UTF8,2020-09-28 19:38:29.768252,2020-09-28 19:38:29.916607,Carhartt Men's Acrylic Watch Hat,Carhartt Sportswear - Mens,1,B002G9UDYG,AE3LRCOFYOIXMTUVY7MELWKBDM6A
125,AGVIAUWDYYTCPE5PWTO76Q2G6OYQ,True,Does what it should,Purchased for eldest son who works outdoors. Hat keeps his head warm and fit well. He likes that it's not too thick and is breathable,"December 19, 2019",Wendy Piner,5.0,0,https://www.amazon.ca/gp/profile/amzn1.account.AGVIAUWDYYTCPE5PWTO76Q2G6OYQ/ref=cm_cr_getr_d_gw_btm?ie=UTF8,2020-09-28 19:38:29.921510,2020-09-28 19:38:30.047388,Carhartt Men's Acrylic Watch Hat,Carhartt Sportswear - Mens,1,B002G9UDYG,AE3LRCOFYOIXMTUVY7MELWKBDM6A
126,AEANG4FOZA57YWIUW6RJQ5P54BKA,True,Size fits all!,"I like how this fits many head sizes, my brothers is really big and mine is really small and we both love these!","May 6, 2020",Justina Renke,5.0,0,https://www.amazon.ca/gp/profile/amzn1.account.AEANG4FOZA57YWIUW6RJQ5P54BKA/ref=cm_cr_getr_d_gw_btm?ie=UTF8,2020-09-28 19:38:30.051291,2020-09-28 19:38:30.200619,Carhartt Men's Acrylic Watch Hat,Carhartt Sportswear - Mens,1,B002G9UDYG,AE3LRCOFYOIXMTUVY7MELWKBDM6A
127,AHXMXES3AFRUP6MPCI23EBT2RUQQ,True,Nice and warm,Good quality,"January 5, 2020",Amazon Customer,5.0,0,https://www.amazon.ca/gp/profile/amzn1.account.AHXMXES3AFRUP6MPCI23EBT2RUQQ/ref=cm_cr_getr_d_gw_btm?ie=UTF8,2020-09-28 19:38:30.205521,2020-09-28 19:38:30.400700,Carhartt Men's Acrylic Watch Hat,Carhartt Sportswear - Mens,1,B002G9UDYG,AE3LRCOFYOIXMTUVY7MELWKBDM6A
128,AHFGQDJK2K6I5PRJ5GD5KIXYZDMQ,True,As expected.,As expected. Nice material.,"January 25, 2020",S,5.0,0,https://www.amazon.ca/gp/profile/amzn1.account.AHFGQDJK2K6I5PRJ5GD5KIXYZDMQ/ref=cm_cr_getr_d_gw_btm?ie=UTF8,2020-09-28 19:38:30.405579,2020-09-28 19:38:30.521721,Carhartt Men's Acrylic Watch Hat,Carhartt Sportswear - Mens,1,B002G9UDYG,AE3LRCOFYOIXMTUVY7MELWKBDM6A
129,AEMSB6GSI5FT23FLVCZWFTDE5PRQ,True,Good hat,"Hat is comfy, and warm. It fits a little on the small side.","June 5, 2019",Sara,4.0,0,https://www.amazon.ca/gp/profile/amzn1.account.AEMSB6GSI5FT23FLVCZWFTDE5PRQ/ref=cm_cr_getr_d_gw_btm?ie=UTF8,2020-09-28 19:38:30.525626,2020-09-28 19:38:30.658362,Carhartt Men's Acrylic Watch Hat,Carhartt Sportswear - Mens,1,B002G9UDYG,AE3LRCOFYOIXMTUVY7MELWKBDM6A
130,AFJHP7GYMXORAZGPLJH2HY3VB7YQ,True,great tuque and great price,"fits nicely, it's a little snug but it's fitting really well now.
i got both the black and the light grey.","February 15, 2019",LivN,5.0,0,https://www.amazon.ca/gp/profile/amzn1.account.AFJHP7GYMXORAZGPLJH2HY3VB7YQ/ref=cm_cr_getr_d_gw_btm?ie=UTF8,2020-09-28 19:38:34.788542,2020-09-28 19:38:35.004236,Carhartt Men's Acrylic Watch Hat,Carhartt Sportswear - Mens,1,B002G9UDYG,AE3LRCOFYOIXMTUVY7MELWKBDM6A
131,AG7VC2FPW6MLFWDZCBSY572QG5HA,True,Warm!,"It is a warm hat, that has worked so far this winter.","February 13, 2020",Amazon Customer,5.0,0,https://www.amazon.ca/gp/profile/amzn1.account.AG7VC2FPW6MLFWDZCBSY572QG5HA/ref=cm_cr_getr_d_gw_btm?ie=UTF8,2020-09-28 19:38:35.008140,2020-09-28 19:38:35.170159,Carhartt Men's Acrylic Watch Hat,Carhartt Sportswear - Mens,1,B002G9UDYG,AE3LRCOFYOIXMTUVY7MELWKBDM6A
132,AHU2UMK66WMIAMGABWPQSPLUEFAQ,True,Four Stars,Pretty comfortable hat but gets a little irritating after about 2 hours of wears.,"June 4, 2018",Jacob,4.0,0,https://www.amazon.ca/gp/profile/amzn1.account.AHU2UMK66WMIAMGABWPQSPLUEFAQ/ref=cm_cr_getr_d_gw_btm?ie=UTF8,2020-09-28 19:38:35.175037,2020-09-28 19:38:35.298012,Carhartt Men's Acrylic Watch Hat,Carhartt Sportswear - Mens,1,B002G9UDYG,AE3LRCOFYOIXMTUVY7MELWKBDM6A
133,AGG3VMKRIQPDO5YKLJ25BVPYRRAA,True,Not a watchman style hat.,"Not a watchmans hat because it sits 6” above the top of your head. A real watchmans hat should fit tight around all sides, including the top.","December 24, 2019",CF,1.0,0,https://www.amazon.ca/gp/profile/amzn1.account.AGG3VMKRIQPDO5YKLJ25BVPYRRAA/ref=cm_cr_getr_d_gw_btm?ie=UTF8,2020-09-28 19:38:35.302892,2020-09-28 19:38:35.435628,Carhartt Men's Acrylic Watch Hat,Carhartt Sportswear - Mens,1,B002G9UDYG,AE3LRCOFYOIXMTUVY7MELWKBDM6A
134,AGFY6I5MN6AWCZP6PMFG5MQPYIQA,True,Cute,Don’t like how it fits female head,"December 16, 2019",jenna macdonald,3.0,0,https://www.amazon.ca/gp/profile/amzn1.account.AGFY6I5MN6AWCZP6PMFG5MQPYIQA/ref=cm_cr_getr_d_gw_btm?ie=UTF8,2020-09-28 19:38:35.446363,2020-09-28 19:38:35.564459,Carhartt Men's Acrylic Watch Hat,Carhartt Sportswear - Mens,1,B002G9UDYG,AE3LRCOFYOIXMTUVY7MELWKBDM6A
135,AEWYHEXFPWG4PWTGAEQE56ZZDJEQ,True,Great value,Love the matching father and son look so cute,"June 18, 2020",Nicole FLEMING,5.0,0,https://www.amazon.ca/gp/profile/amzn1.account.AEWYHEXFPWG4PWTGAEQE56ZZDJEQ/ref=cm_cr_getr_d_gw_btm?ie=UTF8,2020-09-28 19:38:35.569339,2020-09-28 19:38:35.900203,Carhartt Men's Acrylic Watch Hat,Carhartt Sportswear - Mens,1,B002G9UDYG,AE3LRCOFYOIXMTUVY7MELWKBDM6A
136,AENVHPSO2U5YV3GW3QDS24CLANKA,True,Good for short term wear,This hat kept my head warm nicely but irritated my forehead. I bought it for work and couldn’t wear it two days in a row because my forehead was sore. It’s freat for short term wear,"January 21, 2019",Kris Viss,4.0,0,https://www.amazon.ca/gp/profile/amzn1.account.AENVHPSO2U5YV3GW3QDS24CLANKA/ref=cm_cr_getr_d_gw_btm?ie=UTF8,2020-09-28 19:38:35.907034,2020-09-28 19:38:36.073930,Carhartt Men's Acrylic Watch Hat,Carhartt Sportswear - Mens,1,B002G9UDYG,AE3LRCOFYOIXMTUVY7MELWKBDM6A
137,AHT6MNSG2GUEXP6NMQGPQH56KQYQ,True,Five Stars,"I have a big head they says, one size fits all","January 27, 2018",Gilles Renaud,5.0,One,https://www.amazon.ca/gp/profile/amzn1.account.AHT6MNSG2GUEXP6NMQGPQH56KQYQ/ref=cm_cr_getr_d_gw_btm?ie=UTF8,2020-09-28 19:38:36.077834,2020-09-28 19:38:36.213498,Carhartt Men's Acrylic Watch Hat,Carhartt Sportswear - Mens,1,B002G9UDYG,AE3LRCOFYOIXMTUVY7MELWKBDM6A
138,AHBXDJYAQDM6ACTRDGNFJWRGFXDA,True,Would buy again,"Great hat, very comfy, nice material","May 29, 2020",Michell,5.0,0,https://www.amazon.ca/gp/profile/amzn1.account.AHBXDJYAQDM6ACTRDGNFJWRGFXDA/ref=cm_cr_getr_d_gw_btm?ie=UTF8,2020-09-28 19:38:36.218378,2020-09-28 19:38:36.354042,Carhartt Men's Acrylic Watch Hat,Carhartt Sportswear - Mens,1,B002G9UDYG,AE3LRCOFYOIXMTUVY7MELWKBDM6A
139,AEEXP7UO5OFLWSWTPCRPPRDWUU2A,True,Belle tuque,"J'adore cette tuque. Elle est de qualité, le matériel est resté beau après un hiver complet.","September 23, 2019",Fanny,5.0,0,https://www.amazon.ca/gp/profile/amzn1.account.AEEXP7UO5OFLWSWTPCRPPRDWUU2A/ref=cm_cr_getr_d_gw_btm?ie=UTF8,2020-09-28 19:38:36.366730,2020-09-28 19:38:36.503369,Carhartt Men's Acrylic Watch Hat,Carhartt Sportswear - Mens,1,B002G9UDYG,AE3LRCOFYOIXMTUVY7MELWKBDM6A
140,AH4FGKKD5NBSQIXAJ34XVID2ZESQ,True,Good quality,Too deep But very good quality for the price,"February 22, 2019",lance perrault,4.0,0,https://www.amazon.ca/gp/profile/amzn1.account.AH4FGKKD5NBSQIXAJ34XVID2ZESQ/ref=cm_cr_getr_d_gw_btm?ie=UTF8,2020-09-28 19:38:42.613444,2020-09-28 19:38:42.822307,Carhartt Men's Acrylic Watch Hat,Carhartt Sportswear - Mens,1,B002G9UDYG,AE3LRCOFYOIXMTUVY7MELWKBDM6A
141,AGLWQW6E5KTAMWXLARURC2GKKJGA,True,Perfect Winter hat,"Nice quality hat, with nice stretchy fit.","January 25, 2020",Ashley,5.0,0,https://www.amazon.ca/gp/profile/amzn1.account.AGLWQW6E5KTAMWXLARURC2GKKJGA/ref=cm_cr_getr_d_gw_btm?ie=UTF8,2020-09-28 19:38:42.827188,2020-09-28 19:38:42.977491,Carhartt Men's Acrylic Watch Hat,Carhartt Sportswear - Mens,1,B002G9UDYG,AE3LRCOFYOIXMTUVY7MELWKBDM6A
142,AHD6ML7EJTXYU2BSRQF4LYYO22BA,True,Great gifts,Amazing product!,"January 17, 2020",Kim,5.0,0,https://www.amazon.ca/gp/profile/amzn1.account.AHD6ML7EJTXYU2BSRQF4LYYO22BA/ref=cm_cr_getr_d_gw_btm?ie=UTF8,2020-09-28 19:38:42.981395,2020-09-28 19:38:43.106324,Carhartt Men's Acrylic Watch Hat,Carhartt Sportswear - Mens,1,B002G9UDYG,AE3LRCOFYOIXMTUVY7MELWKBDM6A
143,AHD7ZLYHS6BRN7LXG5FE2B67RHXQ,True,Would buy again,Good material,"October 13, 2019",Elizabeth,5.0,0,https://www.amazon.ca/gp/profile/amzn1.account.AHD7ZLYHS6BRN7LXG5FE2B67RHXQ/ref=cm_cr_getr_d_gw_btm?ie=UTF8,2020-09-28 19:38:43.111203,2020-09-28 19:38:43.292751,Carhartt Men's Acrylic Watch Hat,Carhartt Sportswear - Mens,1,B002G9UDYG,AE3LRCOFYOIXMTUVY7MELWKBDM6A
144,AEY6VAHB7NDCKDOQ7H73JZTJUD5A,True,Good value,"Real Carhartt product at good price, fit nicelly","January 16, 2019",Linuxmtl,5.0,0,https://www.amazon.ca/gp/profile/amzn1.account.AEY6VAHB7NDCKDOQ7H73JZTJUD5A/ref=cm_cr_getr_d_gw_btm?ie=UTF8,2020-09-28 19:38:43.298595,2020-09-28 19:38:43.436211,Carhartt Men's Acrylic Watch Hat,Carhartt Sportswear - Mens,1,B002G9UDYG,AE3LRCOFYOIXMTUVY7MELWKBDM6A
145,AEFVZ4IW724PFTAFE42SQTXOFE5Q,True,J'aime !,J'aime bien ! Un peu grand mais tout de même chaud et confortable !,"September 26, 2020",Fanny,4.0,0,https://www.amazon.ca/gp/profile/amzn1.account.AEFVZ4IW724PFTAFE42SQTXOFE5Q/ref=cm_cr_getr_d_gw_btm?ie=UTF8,2020-09-28 19:38:43.441091,2020-09-28 19:38:43.583586,Carhartt Men's Acrylic Watch Hat,Carhartt Sportswear - Mens,1,B002G9UDYG,AE3LRCOFYOIXMTUVY7MELWKBDM6A
146,AGBQQ5L5ZMCFJ4GQE45CRQNUYSGQ,True,Warm,Black fits very small compared to other colours.,"April 29, 2020",Travis M.,3.0,0,https://www.amazon.ca/gp/profile/amzn1.account.AGBQQ5L5ZMCFJ4GQE45CRQNUYSGQ/ref=cm_cr_getr_d_gw_btm?ie=UTF8,2020-09-28 19:38:43.589443,2020-09-28 19:38:43.801234,Carhartt Men's Acrylic Watch Hat,Carhartt Sportswear - Mens,1,B002G9UDYG,AE3LRCOFYOIXMTUVY7MELWKBDM6A
147,AFK72EYIP26BDSQ2DQ5XWHQADSDA,True,Winter hat,"Fits well, comfortable. I think it will be warm","November 5, 2018",jb,5.0,One,https://www.amazon.ca/gp/profile/amzn1.account.AFK72EYIP26BDSQ2DQ5XWHQADSDA/ref=cm_cr_getr_d_gw_btm?ie=UTF8,2020-09-28 19:38:43.805138,2020-09-28 19:38:43.934947,Carhartt Men's Acrylic Watch Hat,Carhartt Sportswear - Mens,1,B002G9UDYG,AE3LRCOFYOIXMTUVY7MELWKBDM6A
148,AH6CKLE3QNNTE3MHKACJ6DEGAZAQ,True,Excellent,Best price I can find,"December 19, 2019",J.,5.0,0,https://www.amazon.ca/gp/profile/amzn1.account.AH6CKLE3QNNTE3MHKACJ6DEGAZAQ/ref=cm_cr_getr_d_gw_btm?ie=UTF8,2020-09-28 19:38:43.939825,2020-09-28 19:38:44.099889,Carhartt Men's Acrylic Watch Hat,Carhartt Sportswear - Mens,1,B002G9UDYG,AE3LRCOFYOIXMTUVY7MELWKBDM6A
149,AG5SXFAGBEI2FXJY3PMGQKAOI3IQ,True,I bought 3,I bought 3 of these hats for my granddaughters. They all loved them!,"January 13, 2020",Candace Kirby,5.0,0,https://www.amazon.ca/gp/profile/amzn1.account.AG5SXFAGBEI2FXJY3PMGQKAOI3IQ/ref=cm_cr_getr_d_gw_btm?ie=UTF8,2020-09-28 19:38:44.103792,2020-09-28 19:38:44.217051,Carhartt Men's Acrylic Watch Hat,Carhartt Sportswear - Mens,1,B002G9UDYG,AE3LRCOFYOIXMTUVY7MELWKBDM6A
150,AGQPLPCWGP3WYM5VEPSIDMYQ7LTQ,True,Pretty good,"The top of the hat was too long, looked weird. Different in size than the one sold at zumeez. Other than that everything is amazing really, cute hat","December 19, 2019",Grace Wang,4.0,0,https://www.amazon.ca/gp/profile/amzn1.account.AGQPLPCWGP3WYM5VEPSIDMYQ7LTQ/ref=cm_cr_getr_d_gw_btm?ie=UTF8,2020-09-28 19:38:48.365554,2020-09-28 19:38:48.571489,Carhartt Men's Acrylic Watch Hat,Carhartt Sportswear - Mens,1,B002G9UDYG,AE3LRCOFYOIXMTUVY7MELWKBDM6A
151,AECWAIEG4PLOYRNGUA47YQM6IGXQ,True,It fits perfectly,This is a great for anybody it will fit all heads. If ur head is smaller it might bunch up at the top but that Adds to the look!,"December 18, 2018",Destiney,5.0,0,https://www.amazon.ca/gp/profile/amzn1.account.AECWAIEG4PLOYRNGUA47YQM6IGXQ/ref=cm_cr_getr_d_gw_btm?ie=UTF8,2020-09-28 19:38:48.576370,2020-09-28 19:38:48.709104,Carhartt Men's Acrylic Watch Hat,Carhartt Sportswear - Mens,1,B002G9UDYG,AE3LRCOFYOIXMTUVY7MELWKBDM6A
152,AFMBXEG4QMVJOC2UKTKTTTNXJ5EQ,True,Too floppy,Nice and warm but there is too much extra material at the top. Ok for a teenager but looks ridiculous on my adult head lol.,"December 9, 2019",Amazon Customer,3.0,0,https://www.amazon.ca/gp/profile/amzn1.account.AFMBXEG4QMVJOC2UKTKTTTNXJ5EQ/ref=cm_cr_getr_d_gw_btm?ie=UTF8,2020-09-28 19:38:48.716912,2020-09-28 19:38:48.885760,Carhartt Men's Acrylic Watch Hat,Carhartt Sportswear - Mens,1,B002G9UDYG,AE3LRCOFYOIXMTUVY7MELWKBDM6A
153,AEBQALN7ZMWCPRRBTRQ7FN2EPPHQ,True,Warm,I like mine,"November 16, 2019",dave,5.0,0,https://www.amazon.ca/gp/profile/amzn1.account.AEBQALN7ZMWCPRRBTRQ7FN2EPPHQ/ref=cm_cr_getr_d_gw_btm?ie=UTF8,2020-09-28 19:38:48.889663,2020-09-28 19:38:49.006785,Carhartt Men's Acrylic Watch Hat,Carhartt Sportswear - Mens,1,B002G9UDYG,AE3LRCOFYOIXMTUVY7MELWKBDM6A
154,AF4YPPK4RKWDWHCBYOEFXJWIYAIA,True,It's too tall. Floppy at the top. It's ...,"It's too tall. Floppy at the top. It's just not my style. Otherwise it's well made, warm and the one I received is made in Canada. I just cannot wear it though.","December 28, 2017",simpleCity,3.0,One,https://www.amazon.ca/gp/profile/amzn1.account.AF4YPPK4RKWDWHCBYOEFXJWIYAIA/ref=cm_cr_getr_d_gw_btm?ie=UTF8,2020-09-28 19:38:49.010688,2020-09-28 19:38:49.160014,Carhartt Men's Acrylic Watch Hat,Carhartt Sportswear - Mens,1,B002G9UDYG,AE3LRCOFYOIXMTUVY7MELWKBDM6A
155,AFJWC5CB6EKUJH4SM6KOQF4KY4YQ,True,Good buy,Bought as gift and I can see it’s approved as it’s in use and liked. It is said to be very warm. Good value.,"March 23, 2019",SA,5.0,0,https://www.amazon.ca/gp/profile/amzn1.account.AFJWC5CB6EKUJH4SM6KOQF4KY4YQ/ref=cm_cr_getr_d_gw_btm?ie=UTF8,2020-09-28 19:38:49.164896,2020-09-28 19:38:49.284942,Carhartt Men's Acrylic Watch Hat,Carhartt Sportswear - Mens,1,B002G9UDYG,AE3LRCOFYOIXMTUVY7MELWKBDM6A
