,subproduct_author_id,verified_purchase,review_title,reviews,date,reviewer_name,ratings,people_find_helpful,reviewer_profile_url,start_time,end_time,product_name,brand_name,rank,product_id,author_id
0,AF6GTDBA254O77D6EMQYYQOCBGXQ,True,Great leggings!,These pants look great and feel comfortable. They’re the only “leggings “ that I’ve seen that are appropriate for office wear as well. They do size large so although I regularly wear size 5-6 a size 4 fits perfectly. Now that I know that I will order more size 4s in the future,"May 15, 2019",Tina,5.0,6,https://www.amazon.ca/gp/profile/amzn1.account.AF6GTDBA254O77D6EMQYYQOCBGXQ/ref=cm_cr_arp_d_gw_btm?ie=UTF8,2020-09-29 02:45:04.588197,2020-09-29 02:45:04.857681,Suko Jeans Womens Pull on Ponte Pants - Skinny Legging - Figure Flattering - Stretch,No,"8,045",B002G9UDYG,AEL4PEFWBBEB7RDVIFLE6DVJDYKQ
1,AE7FPAO5AK3WPFSW6MXZ57RITFYQ,True,Beautiful!!!,"Love these pants so much!
They fit perfectly and hug to your curves making your butt look great. They are 100% non-seethrough, so you don't have to worry about taking a squat or bending over. They have a waistband to keep them in place, but it can be a little loose on the waist and may slide down a bit.
Was very happy with this order!","September 9, 2019",Rachel,5.0,4,https://www.amazon.ca/gp/profile/amzn1.account.AE7FPAO5AK3WPFSW6MXZ57RITFYQ/ref=cm_cr_arp_d_gw_btm?ie=UTF8,2020-09-29 02:45:04.867443,2020-09-29 02:45:05.139395,Suko Jeans Womens Pull on Ponte Pants - Skinny Legging - Figure Flattering - Stretch,No,"8,045",B002G9UDYG,AEL4PEFWBBEB7RDVIFLE6DVJDYKQ
2,AFJ2ZX47S7VDKMVJPOWNTUWRSCGA,True,Excellent quality pants,"These are extremely well made, thick, well fitting stylish pants, I ordered a size 12 but needed to replace it with size 10 since they are a roomy fit. This is now my favorite pants seller due to high quality materials, machine washable easy care clothes for affordable price. This is a favorite pants seller!.FYI check out their other pants and you'll find their standard size chart. Thank You seller for providing such excellent high quality ,low priced pants, I'm very happy!","March 4, 2020",Ingrid,5.0,One,https://www.amazon.ca/gp/profile/amzn1.account.AFJ2ZX47S7VDKMVJPOWNTUWRSCGA/ref=cm_cr_arp_d_gw_btm?ie=UTF8,2020-09-29 02:45:05.149155,2020-09-29 02:45:05.444710,Suko Jeans Womens Pull on Ponte Pants - Skinny Legging - Figure Flattering - Stretch,No,"8,045",B002G9UDYG,AEL4PEFWBBEB7RDVIFLE6DVJDYKQ
3,AG5YSXOXJQFIVH7ZJZO6YJRSIQRQ,True,Comfy pants for work,"As described, nice and comfy for work while not looking too much like leggings. Fabric is thick and opaque. Pants are nice and long, I’m 5’7 and I may hem them. It took me a couple tries to get the right size, they are not consistent across the brand. I'm an 8 in this style but a 6 in another and a 4 in another! (Yes I have 3 pairs of their pants) The seam on one pair started coming out after months of wear, I just ran it through my sewing machine and it's good as new so I will watch for that on these new pairs","December 15, 2018",MD,4.0,2,https://www.amazon.ca/gp/profile/amzn1.account.AG5YSXOXJQFIVH7ZJZO6YJRSIQRQ/ref=cm_cr_arp_d_gw_btm?ie=UTF8,2020-09-29 02:45:05.454423,2020-09-29 02:45:05.656158,Suko Jeans Womens Pull on Ponte Pants - Skinny Legging - Figure Flattering - Stretch,No,"8,045",B002G9UDYG,AEL4PEFWBBEB7RDVIFLE6DVJDYKQ
4,AGSBKOR2T64IU35JGAA7HB7VLPJQ,True,Pants are good quality and feel very comfortable,"Pants are good quality and feel very comfortable. Were a little too big, so returned and ordered same pant one size smaller! Fantastic service from the seller! Will certainly order from them again!","March 28, 2018",Sandy p.,4.0,4,https://www.amazon.ca/gp/profile/amzn1.account.AGSBKOR2T64IU35JGAA7HB7VLPJQ/ref=cm_cr_arp_d_gw_btm?ie=UTF8,2020-09-29 02:45:05.662989,2020-09-29 02:45:05.866554,Suko Jeans Womens Pull on Ponte Pants - Skinny Legging - Figure Flattering - Stretch,No,"8,045",B002G9UDYG,AEL4PEFWBBEB7RDVIFLE6DVJDYKQ
5,AGTQJG7K7WD55DOCMQSQPD7GK64A,True,Nice pants,"I’m an 8 and these fit perfect (8). I’m 5.7 145.
I love how thick this fabric is. These are nice enough for work.
I probably wouldn’t wear around the house because it’s a bit stiff, but for sure would wear anywhere I would be dressed nicely.
Feels like good quality. Don’t slip down.
And when I bend over you don’t see my undies.","August 20, 2020",Justanother,5.0,0,https://www.amazon.ca/gp/profile/amzn1.account.AGTQJG7K7WD55DOCMQSQPD7GK64A/ref=cm_cr_arp_d_gw_btm?ie=UTF8,2020-09-29 02:45:05.873512,2020-09-29 02:45:06.055190,Suko Jeans Womens Pull on Ponte Pants - Skinny Legging - Figure Flattering - Stretch,No,"8,045",B002G9UDYG,AEL4PEFWBBEB7RDVIFLE6DVJDYKQ
6,AGCGP4VYUGV4Y4L3ECEPBX3V5NAA,True,Please make thicker pants for winter!,"These are the only pants I've found in recent years that stretch just right, fit as perfectly and as comfortably as yoga pants, AND are dressy enough to wear to the office. I just wish Rekucci sold winter fabric pants on Amazon.","November 10, 2018",Aaron Tosca,5.0,2,https://www.amazon.ca/gp/profile/amzn1.account.AGCGP4VYUGV4Y4L3ECEPBX3V5NAA/ref=cm_cr_arp_d_gw_btm?ie=UTF8,2020-09-29 02:45:06.061045,2020-09-29 02:45:06.236777,Suko Jeans Womens Pull on Ponte Pants - Skinny Legging - Figure Flattering - Stretch,No,"8,045",B002G9UDYG,AEL4PEFWBBEB7RDVIFLE6DVJDYKQ
7,AHPKHTNJKTJFOY4R5SI23X5NKYKA,True,they're really nice. The fabric looks and feels nice and is ...,"I'm sorry to say that I'll be returning these pants. Unfortunately they are too large and I just can't make it work. I'm not sure this is the fault of the product or company, I'm very tall and very skinny and I always have a hard time finding pants that fit properly. The reason I say I'm sorry to be returning these pants is that apart from being too large, they're really nice. The fabric looks and feels nice and is not too thin, they are very stretchy without looking like spandex, and they are comfortable. If they had a size 0 I would just exchange them.","July 9, 2018",EK,4.0,One,https://www.amazon.ca/gp/profile/amzn1.account.AHPKHTNJKTJFOY4R5SI23X5NKYKA/ref=cm_cr_arp_d_gw_btm?ie=UTF8,2020-09-29 02:45:06.243714,2020-09-29 02:45:06.503264,Suko Jeans Womens Pull on Ponte Pants - Skinny Legging - Figure Flattering - Stretch,No,"8,045",B002G9UDYG,AEL4PEFWBBEB7RDVIFLE6DVJDYKQ
8,AHVE7Q6QBAUGKMPZAHIVDL5EAWAA,True,Good quality,Nice quality but fits a bit larger than expected and quite long as well. I kind of fit between 2 sizes and probably would have ordered the smaller size had I pre tried them. Will see how they fit after washing them,"January 20, 2019",Linda Jackson,4.0,One,https://www.amazon.ca/gp/profile/amzn1.account.AHVE7Q6QBAUGKMPZAHIVDL5EAWAA/ref=cm_cr_arp_d_gw_btm?ie=UTF8,2020-09-29 02:45:06.514403,2020-09-29 02:45:06.717031,Suko Jeans Womens Pull on Ponte Pants - Skinny Legging - Figure Flattering - Stretch,No,"8,045",B002G9UDYG,AEL4PEFWBBEB7RDVIFLE6DVJDYKQ
9,AHVKLJXNXGJIH6YSVTYYT6JZXZRA,True,I am not sure how I feel,I think the fabric is great. The length is good. The price is expensive for what they are. These would fit someone with large hips or big but . I went over the size chart many times to make sure I ordered the correct size but there is way to much material at the crotch.,"November 6, 2019",Kristina Cathcart,3.0,0,https://www.amazon.ca/gp/profile/amzn1.account.AHVKLJXNXGJIH6YSVTYYT6JZXZRA/ref=cm_cr_arp_d_gw_btm?ie=UTF8,2020-09-29 02:45:06.723862,2020-09-29 02:45:06.941346,Suko Jeans Womens Pull on Ponte Pants - Skinny Legging - Figure Flattering - Stretch,No,"8,045",B002G9UDYG,AEL4PEFWBBEB7RDVIFLE6DVJDYKQ
10,AEDO5YNNLYQWBXCFIVB7IM5ULMMQ,True,a tad short but fits well overall,"shorter in the leg than I was expecting, will avoid the drier. look amazing and fit wonderfully. i'm 5'7 and they are just above the ankle bone, a little higher than the woman in the picture. over all good. would recommend","July 4, 2018",Emily,4.0,2,https://www.amazon.ca/gp/profile/amzn1.account.AEDO5YNNLYQWBXCFIVB7IM5ULMMQ/ref=cm_cr_getr_d_gw_btm?ie=UTF8,2020-09-29 02:45:09.260544,2020-09-29 02:45:09.523603,Suko Jeans Womens Pull on Ponte Pants - Skinny Legging - Figure Flattering - Stretch,No,"8,045",B002G9UDYG,AEL4PEFWBBEB7RDVIFLE6DVJDYKQ
11,AHEW2GHN7KUIEPLT3BETEQI767NQ,True,great quality,"Great fabric. Fairly sturdy.
Embroidery is well done but I expected the green to be a little darker.
I am a 25” waist amd ordered the size 2. I had to take them in quite alot to make them look like ‘leggings’ instead of skinny pants!","November 9, 2018",Ang,4.0,One,https://www.amazon.ca/gp/profile/amzn1.account.AHEW2GHN7KUIEPLT3BETEQI767NQ/ref=cm_cr_getr_d_gw_btm?ie=UTF8,2020-09-29 02:45:09.529459,2020-09-29 02:45:09.718678,Suko Jeans Womens Pull on Ponte Pants - Skinny Legging - Figure Flattering - Stretch,No,"8,045",B002G9UDYG,AEL4PEFWBBEB7RDVIFLE6DVJDYKQ
12,AEL4PEFWBBEB7RDVIFLE6DVJDYKQ,True,Amazing but...,"I love these and I find they fit true to size but unfortunately, if you wear them a few times between washing, the elastic stretches after you wear them and then start to seem looser and baggy until they are washed again.","December 11, 2018",Naomi,4.0,0,https://www.amazon.ca/gp/profile/amzn1.account.AEL4PEFWBBEB7RDVIFLE6DVJDYKQ/ref=cm_cr_getr_d_gw_btm?ie=UTF8,2020-09-29 02:45:09.733318,2020-09-29 02:45:09.879744,Suko Jeans Womens Pull on Ponte Pants - Skinny Legging - Figure Flattering - Stretch,No,"8,045",B002G9UDYG,AEL4PEFWBBEB7RDVIFLE6DVJDYKQ
13,AFGY7QVARGORBZHCKRSCXWVBLZSA,True,that the item fit me,"I do not know what I disliked. the product was leggings that I want to wear for the proper occasion. the colour was perfect and I am certain that I will wear it with pleasure. In short, I really love the wine-red leggings. They fit fantastic. Thanks.","November 18, 2018",ms77,5.0,0,https://www.amazon.ca/gp/profile/amzn1.account.AFGY7QVARGORBZHCKRSCXWVBLZSA/ref=cm_cr_getr_d_gw_btm?ie=UTF8,2020-09-29 02:45:09.884622,2020-09-29 02:45:10.042909,Suko Jeans Womens Pull on Ponte Pants - Skinny Legging - Figure Flattering - Stretch,No,"8,045",B002G9UDYG,AEL4PEFWBBEB7RDVIFLE6DVJDYKQ
14,AHSZ3DJSJOPXWJCN7PBLSZOFLCQA,True,Great purchase,Nice pants. Well made and nice material! Can def b dressed up or down!! Great price point! Cant be beat for sure!,"March 13, 2020",Anna ,5.0,0,https://www.amazon.ca/gp/profile/amzn1.account.AHSZ3DJSJOPXWJCN7PBLSZOFLCQA/ref=cm_cr_getr_d_gw_btm?ie=UTF8,2020-09-29 02:45:10.047755,2020-09-29 02:45:10.199521,Suko Jeans Womens Pull on Ponte Pants - Skinny Legging - Figure Flattering - Stretch,No,"8,045",B002G9UDYG,AEL4PEFWBBEB7RDVIFLE6DVJDYKQ
15,AEGBZV6FQ472ZXVKS2JZF6IMFQEA,True,Don’t waste your money,"Worst. Quality. Ever.
I wouldn’t pay 5$ for these.
Seams were all crooked and stitching was just awful. Faded and stained. One pair came covered in dust and dirt it was disgusting. RUN.","May 6, 2020",Elle,1.0,0,https://www.amazon.ca/gp/profile/amzn1.account.AEGBZV6FQ472ZXVKS2JZF6IMFQEA/ref=cm_cr_getr_d_gw_btm?ie=UTF8,2020-09-29 02:45:10.204402,2020-09-29 02:45:10.352378,Suko Jeans Womens Pull on Ponte Pants - Skinny Legging - Figure Flattering - Stretch,No,"8,045",B002G9UDYG,AEL4PEFWBBEB7RDVIFLE6DVJDYKQ
16,AGAZFQECWUOV2UJL2CY57BGM4L2Q,True,Fitted and comfy what is she doing,Sleek and comfortable. I specifically bought these for work. The legs of the pants are fitted down to the ankle and it has a high waist which I love cuz I'm on the curvier side. Definitely comfortable enough to wear a full day at the office.,"June 20, 2020",Mom2Jas,5.0,0,https://www.amazon.ca/gp/profile/amzn1.account.AGAZFQECWUOV2UJL2CY57BGM4L2Q/ref=cm_cr_getr_d_gw_btm?ie=UTF8,2020-09-29 02:45:10.358257,2020-09-29 02:45:10.508576,Suko Jeans Womens Pull on Ponte Pants - Skinny Legging - Figure Flattering - Stretch,No,"8,045",B002G9UDYG,AEL4PEFWBBEB7RDVIFLE6DVJDYKQ
17,AH5VB67RIPGTBPTCKQ7TBRVJWENA,True,Fits larger than expected,"Comfortable, nice business casual pant. They do fit larger than expected though, I'm normally a 14 and could have bought a 12.","March 17, 2019",Jane,4.0,0,https://www.amazon.ca/gp/profile/amzn1.account.AH5VB67RIPGTBPTCKQ7TBRVJWENA/ref=cm_cr_getr_d_gw_btm?ie=UTF8,2020-09-29 02:45:10.513437,2020-09-29 02:45:10.665763,Suko Jeans Womens Pull on Ponte Pants - Skinny Legging - Figure Flattering - Stretch,No,"8,045",B002G9UDYG,AEL4PEFWBBEB7RDVIFLE6DVJDYKQ
18,AHIWU7FNBGKZVVHYDQ55X2WWOPDA,True,Lovely pants Love suko,These fit really large. Which is odd as my other pair in the same size is just right.,"November 18, 2019",Amazon Customer,3.0,0,https://www.amazon.ca/gp/profile/amzn1.account.AHIWU7FNBGKZVVHYDQ55X2WWOPDA/ref=cm_cr_getr_d_gw_btm?ie=UTF8,2020-09-29 02:45:10.670642,2020-09-29 02:45:10.812478,Suko Jeans Womens Pull on Ponte Pants - Skinny Legging - Figure Flattering - Stretch,No,"8,045",B002G9UDYG,AEL4PEFWBBEB7RDVIFLE6DVJDYKQ
19,AHW332JICFEPMWJXSFYEYBFUCRVQ,True,Great pants for the office,"Love love these. Can be dressed up for the office with heels and a blazer, or office casual with white flats or the like. Very comfortable and easy to move in.","March 24, 2018",minuteinthelife,5.0,0,https://www.amazon.ca/gp/profile/amzn1.account.AHW332JICFEPMWJXSFYEYBFUCRVQ/ref=cm_cr_getr_d_gw_btm?ie=UTF8,2020-09-29 02:45:10.818337,2020-09-29 02:45:11.017086,Suko Jeans Womens Pull on Ponte Pants - Skinny Legging - Figure Flattering - Stretch,No,"8,045",B002G9UDYG,AEL4PEFWBBEB7RDVIFLE6DVJDYKQ
20,AEJTMQZPAY2EG5OSQX2TLPJH4YOA,True,Perfect perfect,Very nice fit. Girlfriend loves them and she usually is very picky and difficult to satisfy on pants especially. Will definitely buy again.,"August 9, 2018",Alessandro,5.0,0,https://www.amazon.ca/gp/profile/amzn1.account.AEJTMQZPAY2EG5OSQX2TLPJH4YOA/ref=cm_cr_getr_d_gw_btm?ie=UTF8,2020-09-29 02:45:17.165664,2020-09-29 02:45:17.469590,Suko Jeans Womens Pull on Ponte Pants - Skinny Legging - Figure Flattering - Stretch,No,"8,045",B002G9UDYG,AEL4PEFWBBEB7RDVIFLE6DVJDYKQ
21,AEEJU34DCV5FKAF54O3OUJHR3X6A,True,So comfortable,"Thought I’d take a chance and order a couple pairs of these and they just arrived (almost a week early too)
I have literally never had pants that fit so well! And they are way better quality than I was expecting. I’ll be buying a few more pairs of these","February 2, 2019",Chelsey,5.0,0,https://www.amazon.ca/gp/profile/amzn1.account.AEEJU34DCV5FKAF54O3OUJHR3X6A/ref=cm_cr_getr_d_gw_btm?ie=UTF8,2020-09-29 02:45:17.477289,2020-09-29 02:45:17.665774,Suko Jeans Womens Pull on Ponte Pants - Skinny Legging - Figure Flattering - Stretch,No,"8,045",B002G9UDYG,AEL4PEFWBBEB7RDVIFLE6DVJDYKQ
22,AGBIPMBIM2MIKL2SDWF6GASLHS7A,True,first time use good,I loved these the first time I wore them then after washing and wearing again they seemed to stretch and hang off,"October 24, 2018",SnUZuluz,3.0,0,https://www.amazon.ca/gp/profile/amzn1.account.AGBIPMBIM2MIKL2SDWF6GASLHS7A/ref=cm_cr_getr_d_gw_btm?ie=UTF8,2020-09-29 02:45:17.672611,2020-09-29 02:45:17.875889,Suko Jeans Womens Pull on Ponte Pants - Skinny Legging - Figure Flattering - Stretch,No,"8,045",B002G9UDYG,AEL4PEFWBBEB7RDVIFLE6DVJDYKQ
23,AFEUZNGA2D4MGHJJJHTHIDZDH4AQ,True,Super achat,Vraiment satisfaite ! Un peu long mais ils ont rapetissé dans la sécheuse donc ils sont presque parfait,"November 19, 2019",Nana,5.0,0,https://www.amazon.ca/gp/profile/amzn1.account.AFEUZNGA2D4MGHJJJHTHIDZDH4AQ/ref=cm_cr_getr_d_gw_btm?ie=UTF8,2020-09-29 02:45:17.882746,2020-09-29 02:45:18.116549,Suko Jeans Womens Pull on Ponte Pants - Skinny Legging - Figure Flattering - Stretch,No,"8,045",B002G9UDYG,AEL4PEFWBBEB7RDVIFLE6DVJDYKQ
24,AEVNT2B6KWXUM5ACDYAYWZ345AIA,True,Read the Reviews before ordering,I read the reviews and ordered a size smaller. Perfect fit - size 12 usually 14. I will order again. Bought these to travel comfortably and wear both day and night. Impressed with the quality.,"December 12, 2019",Christy ,5.0,0,https://www.amazon.ca/gp/profile/amzn1.account.AEVNT2B6KWXUM5ACDYAYWZ345AIA/ref=cm_cr_getr_d_gw_btm?ie=UTF8,2020-09-29 02:45:18.123427,2020-09-29 02:45:18.312924,Suko Jeans Womens Pull on Ponte Pants - Skinny Legging - Figure Flattering - Stretch,No,"8,045",B002G9UDYG,AEL4PEFWBBEB7RDVIFLE6DVJDYKQ
25,AHK3ISVEZQWX7BOMPJONW277A4DQ,True,Nice. Not warm in cooler weather. Embroidery is nice,They fit really well. Not very warm in colder weather. Nice embroidered pattern. Would buy them again,"February 1, 2020",charles,3.0,0,https://www.amazon.ca/gp/profile/amzn1.account.AHK3ISVEZQWX7BOMPJONW277A4DQ/ref=cm_cr_getr_d_gw_btm?ie=UTF8,2020-09-29 02:45:18.319777,2020-09-29 02:45:18.518032,Suko Jeans Womens Pull on Ponte Pants - Skinny Legging - Figure Flattering - Stretch,No,"8,045",B002G9UDYG,AEL4PEFWBBEB7RDVIFLE6DVJDYKQ
26,AEN4FBL7QBWPWLMYH2JYZTAX3DYQ,True,"A little tight, but may loosen up while wearing ...","A little tight, but may loosen up while wearing, I ordered a small, but I think a medium would be big, so I will stick with these.Very cute! Arrived early","September 23, 2018",Donna,4.0,0,https://www.amazon.ca/gp/profile/amzn1.account.AEN4FBL7QBWPWLMYH2JYZTAX3DYQ/ref=cm_cr_getr_d_gw_btm?ie=UTF8,2020-09-29 02:45:18.522912,2020-09-29 02:45:18.699211,Suko Jeans Womens Pull on Ponte Pants - Skinny Legging - Figure Flattering - Stretch,No,"8,045",B002G9UDYG,AEL4PEFWBBEB7RDVIFLE6DVJDYKQ
27,AGSC2QWPF7HESKBT63PDPE6PCE2A,True,Fits big,They fit big but they seem like good quality.,"March 2, 2020",Amazon Customer,4.0,0,https://www.amazon.ca/gp/profile/amzn1.account.AGSC2QWPF7HESKBT63PDPE6PCE2A/ref=cm_cr_getr_d_gw_btm?ie=UTF8,2020-09-29 02:45:18.706028,2020-09-29 02:45:18.887314,Suko Jeans Womens Pull on Ponte Pants - Skinny Legging - Figure Flattering - Stretch,No,"8,045",B002G9UDYG,AEL4PEFWBBEB7RDVIFLE6DVJDYKQ
28,AEOOSWSW6UEV6FC7Q7AIDHVW3QHA,True,Good price Good product,"Leggings arrived today. The fabric is thick and soft and as opaque as leggings get. I'm 5'-11"", 200lbs and ordered a 14 and it fits well (a 12 would also probably have fit). I'm very happy with my purchase.","September 17, 2018",Ann Falardeau,5.0,0,https://www.amazon.ca/gp/profile/amzn1.account.AEOOSWSW6UEV6FC7Q7AIDHVW3QHA/ref=cm_cr_getr_d_gw_btm?ie=UTF8,2020-09-29 02:45:18.894149,2020-09-29 02:45:19.093889,Suko Jeans Womens Pull on Ponte Pants - Skinny Legging - Figure Flattering - Stretch,No,"8,045",B002G9UDYG,AEL4PEFWBBEB7RDVIFLE6DVJDYKQ
29,AHF77PMBMXIDEZRFMLZEC3KKYTHQ,True,Love them!,Love these leggings! Material thicker than most and they look a little dressier as well. Nice and long,"February 16, 2019",Michelle Franche,5.0,0,https://www.amazon.ca/gp/profile/amzn1.account.AHF77PMBMXIDEZRFMLZEC3KKYTHQ/ref=cm_cr_getr_d_gw_btm?ie=UTF8,2020-09-29 02:45:19.099665,2020-09-29 02:45:19.274527,Suko Jeans Womens Pull on Ponte Pants - Skinny Legging - Figure Flattering - Stretch,No,"8,045",B002G9UDYG,AEL4PEFWBBEB7RDVIFLE6DVJDYKQ
30,AHJJQRH2HVWWIRORXDQ6V66MUYHA,True,Ive bought these pants before and LOVED them.,Ive bought these pants before and LOVED them... this time all the seems are tearing? I have three holes after 3 times wearing??,"April 26, 2018",Amazon Customer,1.0,One,https://www.amazon.ca/gp/profile/amzn1.account.AHJJQRH2HVWWIRORXDQ6V66MUYHA/ref=cm_cr_getr_d_gw_btm?ie=UTF8,2020-09-29 02:45:22.445745,2020-09-29 02:45:22.685416,Suko Jeans Womens Pull on Ponte Pants - Skinny Legging - Figure Flattering - Stretch,No,"8,045",B002G9UDYG,AEL4PEFWBBEB7RDVIFLE6DVJDYKQ
31,AHQ2PKA7U5DF7OVK73UROK5IDHCQ,True,"Runs small, poor quality material",Unflattering overall and fits very small!,"July 3, 2020",Jennifer,2.0,0,https://www.amazon.ca/gp/profile/amzn1.account.AHQ2PKA7U5DF7OVK73UROK5IDHCQ/ref=cm_cr_getr_d_gw_btm?ie=UTF8,2020-09-29 02:45:22.695175,2020-09-29 02:45:22.949399,Suko Jeans Womens Pull on Ponte Pants - Skinny Legging - Figure Flattering - Stretch,No,"8,045",B002G9UDYG,AEL4PEFWBBEB7RDVIFLE6DVJDYKQ
32,AHAUQ5JB62DKHDO4YBEXMMQ2B3HA,True,Good leggings for winter,Good leggings for winter. Stitching inside the fabric seems to bothers my skin.,"January 3, 2019",One Stop shopping,3.0,0,https://www.amazon.ca/gp/profile/amzn1.account.AHAUQ5JB62DKHDO4YBEXMMQ2B3HA/ref=cm_cr_getr_d_gw_btm?ie=UTF8,2020-09-29 02:45:22.959155,2020-09-29 02:45:23.191064,Suko Jeans Womens Pull on Ponte Pants - Skinny Legging - Figure Flattering - Stretch,No,"8,045",B002G9UDYG,AEL4PEFWBBEB7RDVIFLE6DVJDYKQ
33,AE7M6EA63RSKPCT3E2CUJOGWKGOA,True,Lovely,"Really good quality, feels very nice on the body, very comfortable","May 4, 2019",Kate,5.0,0,https://www.amazon.ca/gp/profile/amzn1.account.AE7M6EA63RSKPCT3E2CUJOGWKGOA/ref=cm_cr_getr_d_gw_btm?ie=UTF8,2020-09-29 02:45:23.196893,2020-09-29 02:45:23.373630,Suko Jeans Womens Pull on Ponte Pants - Skinny Legging - Figure Flattering - Stretch,No,"8,045",B002G9UDYG,AEL4PEFWBBEB7RDVIFLE6DVJDYKQ
34,AHLQUZWDAUKVS6WJVJGSDBTPXC6Q,True,Ight,Nice good quality,"February 18, 2020",Michelle,4.0,0,https://www.amazon.ca/gp/profile/amzn1.account.AHLQUZWDAUKVS6WJVJGSDBTPXC6Q/ref=cm_cr_getr_d_gw_btm?ie=UTF8,2020-09-29 02:45:23.380464,2020-09-29 02:45:23.561021,Suko Jeans Womens Pull on Ponte Pants - Skinny Legging - Figure Flattering - Stretch,No,"8,045",B002G9UDYG,AEL4PEFWBBEB7RDVIFLE6DVJDYKQ
35,AF7YSB3XRJ2SUXPSKCE7HE7UOM5Q,True,Great value high quality product,Good qu@lity product,"November 15, 2018",Amelia hickey,5.0,0,https://www.amazon.ca/gp/profile/amzn1.account.AF7YSB3XRJ2SUXPSKCE7HE7UOM5Q/ref=cm_cr_getr_d_gw_btm?ie=UTF8,2020-09-29 02:45:23.565900,2020-09-29 02:45:23.743654,Suko Jeans Womens Pull on Ponte Pants - Skinny Legging - Figure Flattering - Stretch,No,"8,045",B002G9UDYG,AEL4PEFWBBEB7RDVIFLE6DVJDYKQ
36,AFQTLZAY6BCL4VE2KURVPPID36JQ,True,No,really nice but fabric begins to bag very fast. droopy bum look is unavoidable.,"October 24, 2018",Angela Betts,2.0,0,https://www.amazon.ca/gp/profile/amzn1.account.AFQTLZAY6BCL4VE2KURVPPID36JQ/ref=cm_cr_getr_d_gw_btm?ie=UTF8,2020-09-29 02:45:23.750349,2020-09-29 02:45:23.926602,Suko Jeans Womens Pull on Ponte Pants - Skinny Legging - Figure Flattering - Stretch,No,"8,045",B002G9UDYG,AEL4PEFWBBEB7RDVIFLE6DVJDYKQ
37,AFT4GHIVPHRVBB7W376IPF5DQARA,True,Fit is perfect.,I am very pleased that the fit was perfect. Love these!,"October 15, 2018",Zuppo,5.0,0,https://www.amazon.ca/gp/profile/amzn1.account.AFT4GHIVPHRVBB7W376IPF5DQARA/ref=cm_cr_getr_d_gw_btm?ie=UTF8,2020-09-29 02:45:23.933434,2020-09-29 02:45:24.132156,Suko Jeans Womens Pull on Ponte Pants - Skinny Legging - Figure Flattering - Stretch,No,"8,045",B002G9UDYG,AEL4PEFWBBEB7RDVIFLE6DVJDYKQ
38,AEOMMB7GXDUVXQDDTIC2P6DHJOZQ,True,Five Stars,It is exactly as described and I am pleased with it.,"September 10, 2018",Terry-Ann,5.0,0,https://www.amazon.ca/gp/profile/amzn1.account.AEOMMB7GXDUVXQDDTIC2P6DHJOZQ/ref=cm_cr_getr_d_gw_btm?ie=UTF8,2020-09-29 02:45:24.137965,2020-09-29 02:45:24.321487,Suko Jeans Womens Pull on Ponte Pants - Skinny Legging - Figure Flattering - Stretch,No,"8,045",B002G9UDYG,AEL4PEFWBBEB7RDVIFLE6DVJDYKQ
39,AEPRHLGY3CNMAUJEJPWPPP2VMF7Q,True,I LOVE these pants.,"I LOVE these pants. I'll buy more. They are too long, but i'm short (Just over 5 feet). I ordered a small and they fit well.","February 8, 2018",Shareena Newman,5.0,0,https://www.amazon.ca/gp/profile/amzn1.account.AEPRHLGY3CNMAUJEJPWPPP2VMF7Q/ref=cm_cr_getr_d_gw_btm?ie=UTF8,2020-09-29 02:45:24.328343,2020-09-29 02:45:24.509962,Suko Jeans Womens Pull on Ponte Pants - Skinny Legging - Figure Flattering - Stretch,No,"8,045",B002G9UDYG,AEL4PEFWBBEB7RDVIFLE6DVJDYKQ
40,AFVTEJPAUSDH62UGR5HXJ2CVYLJQ,True,Great,"Great pants, have 4 suko jeans and i love them all","March 1, 2019",Marianne,5.0,0,https://www.amazon.ca/gp/profile/amzn1.account.AFVTEJPAUSDH62UGR5HXJ2CVYLJQ/ref=cm_cr_getr_d_gw_btm?ie=UTF8,2020-09-29 02:45:26.661974,2020-09-29 02:45:26.886420,Suko Jeans Womens Pull on Ponte Pants - Skinny Legging - Figure Flattering - Stretch,No,"8,045",B002G9UDYG,AEL4PEFWBBEB7RDVIFLE6DVJDYKQ
41,AHH4XLD2D7V76PMSBJJODKI74ECA,True,"Very comfortable, I ordered a size smaller after returning other products","Dressy, but comfortable and fun.","November 16, 2018",LittleFish,5.0,0,https://www.amazon.ca/gp/profile/amzn1.account.AHH4XLD2D7V76PMSBJJODKI74ECA/ref=cm_cr_getr_d_gw_btm?ie=UTF8,2020-09-29 02:45:26.893238,2020-09-29 02:45:27.062684,Suko Jeans Womens Pull on Ponte Pants - Skinny Legging - Figure Flattering - Stretch,No,"8,045",B002G9UDYG,AEL4PEFWBBEB7RDVIFLE6DVJDYKQ
42,AE7EH3YARUS27OKDR6YF5QVH3WIQ,True,Good quality and fit,"Really happy with these. The herringbone pattern fits very well all the way through. Quality is also a nice thicker material, better than I expected. Would buy again.","March 2, 2018",carol ann sabbah,5.0,0,https://www.amazon.ca/gp/profile/amzn1.account.AE7EH3YARUS27OKDR6YF5QVH3WIQ/ref=cm_cr_getr_d_gw_btm?ie=UTF8,2020-09-29 02:45:27.068542,2020-09-29 02:45:27.237009,Suko Jeans Womens Pull on Ponte Pants - Skinny Legging - Figure Flattering - Stretch,No,"8,045",B002G9UDYG,AEL4PEFWBBEB7RDVIFLE6DVJDYKQ
43,AEHKY6V3GS3NT2XBIN76B2OHTW2A,True,Suko stretch jeans,"Excellent jeans
They fit perfectly. The colour is great.

Thank you","August 2, 2018",brenda kraft,5.0,0,https://www.amazon.ca/gp/profile/amzn1.account.AEHKY6V3GS3NT2XBIN76B2OHTW2A/ref=cm_cr_getr_d_gw_btm?ie=UTF8,2020-09-29 02:45:27.243921,2020-09-29 02:45:27.410826,Suko Jeans Womens Pull on Ponte Pants - Skinny Legging - Figure Flattering - Stretch,No,"8,045",B002G9UDYG,AEL4PEFWBBEB7RDVIFLE6DVJDYKQ
44,AEU6T3IESYYXCB665VRMM445XPNQ,True,Feel nice on...,Such beautiful soft comfy material. Fast shipping. Good seller....would definitely buy from again. 5 star 4 sure,"December 1, 2018",Babs,5.0,0,https://www.amazon.ca/gp/profile/amzn1.account.AEU6T3IESYYXCB665VRMM445XPNQ/ref=cm_cr_getr_d_gw_btm?ie=UTF8,2020-09-29 02:45:27.420587,2020-09-29 02:45:27.683775,Suko Jeans Womens Pull on Ponte Pants - Skinny Legging - Figure Flattering - Stretch,No,"8,045",B002G9UDYG,AEL4PEFWBBEB7RDVIFLE6DVJDYKQ
