,subproduct_author_id,verified_purchase,review_title,reviews,date,reviewer_name,ratings,people_find_helpful,reviewer_profile_url,start_time,end_time,product_name,brand_name,rank,product_id,author_id
156,AFO6QKK6XQTZ3HISM32TXHQF2VDQ,True,Une tuque idéale pour les journées froides d'hiver.,Utilisé durant l'hiver. Un peu trop grande sur la tête mais très confortable.,"January 13, 2019",Amazon Customer,4.0,0,https://www.amazon.ca/gp/profile/amzn1.account.AFO6QKK6XQTZ3HISM32TXHQF2VDQ/ref=cm_cr_getr_d_gw_btm?ie=UTF8,2020-09-21 13:10:33.325591,2020-09-21 13:10:33.438806,Carhartt Men's Acrylic Watch Hat,Carhartt Sportswear - Mens,2,B002G9UDYG,AEKDAGTS42KWFP7QZJ5N7AKULXCA
157,AEJWE3MYLOXLFUU6TTDFZ7TOFYLA,True,warm,they are made for our winters and are worth the extra small cost,"February 3, 2020",hooker guy,5.0,0,https://www.amazon.ca/gp/profile/amzn1.account.AEJWE3MYLOXLFUU6TTDFZ7TOFYLA/ref=cm_cr_getr_d_gw_btm?ie=UTF8,2020-09-21 13:10:33.442710,2020-09-21 13:10:33.555925,Carhartt Men's Acrylic Watch Hat,Carhartt Sportswear - Mens,2,B002G9UDYG,AEKDAGTS42KWFP7QZJ5N7AKULXCA
158,AH2K57X3YESFHCEQZUV7Z7KNGTXQ,True,Awesome!,"Great product! Fast shipping, highly recommend it.","October 19, 2018",Tpan,5.0,0,https://www.amazon.ca/gp/profile/amzn1.account.AH2K57X3YESFHCEQZUV7Z7KNGTXQ/ref=cm_cr_getr_d_gw_btm?ie=UTF8,2020-09-21 13:10:33.559830,2020-09-21 13:10:33.684789,Carhartt Men's Acrylic Watch Hat,Carhartt Sportswear - Mens,2,B002G9UDYG,AEKDAGTS42KWFP7QZJ5N7AKULXCA
159,AFLREMKO547VCVINO2PMCLF6EYOQ,True,Excellant,Excellant ! Exactly what I expected !,"December 4, 2018",Daevon,5.0,0,https://www.amazon.ca/gp/profile/amzn1.account.AFLREMKO547VCVINO2PMCLF6EYOQ/ref=cm_cr_getr_d_gw_btm?ie=UTF8,2020-09-21 13:10:33.688695,2020-09-21 13:10:33.810693,Carhartt Men's Acrylic Watch Hat,Carhartt Sportswear - Mens,2,B002G9UDYG,AEKDAGTS42KWFP7QZJ5N7AKULXCA
160,AFTUV2R77TVQHQRQNSGAO64PJQZQ,True,Isn't acrylic a type of paint?,I could not paint with hat.,"February 6, 2020",Dan S.,5.0,0,https://www.amazon.ca/gp/profile/amzn1.account.AFTUV2R77TVQHQRQNSGAO64PJQZQ/ref=cm_cr_getr_d_gw_btm?ie=UTF8,2020-09-21 13:10:36.946575,2020-09-21 13:10:37.087118,Carhartt Men's Acrylic Watch Hat,Carhartt Sportswear - Mens,2,B002G9UDYG,AEKDAGTS42KWFP7QZJ5N7AKULXCA
161,AFGP62DQ4LHYRWG7RHKPW4MJRO6Q,True,Way Too tall,Way Too tall for vary vary big head,"December 6, 2018",Nancy,2.0,0,https://www.amazon.ca/gp/profile/amzn1.account.AFGP62DQ4LHYRWG7RHKPW4MJRO6Q/ref=cm_cr_getr_d_gw_btm?ie=UTF8,2020-09-21 13:10:37.091021,2020-09-21 13:10:37.213022,Carhartt Men's Acrylic Watch Hat,Carhartt Sportswear - Mens,2,B002G9UDYG,AEKDAGTS42KWFP7QZJ5N7AKULXCA
162,AHYVQHGBSOE7AMSF4FGRPHPMZREQ,True,Bien,Fit parfaitement sur ma grosse tête!,"January 27, 2019",Stephanie,5.0,0,https://www.amazon.ca/gp/profile/amzn1.account.AHYVQHGBSOE7AMSF4FGRPHPMZREQ/ref=cm_cr_getr_d_gw_btm?ie=UTF8,2020-09-21 13:10:37.216925,2020-09-21 13:10:37.348729,Carhartt Men's Acrylic Watch Hat,Carhartt Sportswear - Mens,2,B002G9UDYG,AEKDAGTS42KWFP7QZJ5N7AKULXCA
163,AEXOEDV6TSRNTTIN236ULJFHPTQA,True,Different edition hat,This is not the regular carhartt hat that you see other people on the street wear. This is a different edition,"September 6, 2019",Kevin Kim,2.0,0,https://www.amazon.ca/gp/profile/amzn1.account.AEXOEDV6TSRNTTIN236ULJFHPTQA/ref=cm_cr_getr_d_gw_btm?ie=UTF8,2020-09-21 13:10:37.353609,2020-09-21 13:10:37.472713,Carhartt Men's Acrylic Watch Hat,Carhartt Sportswear - Mens,2,B002G9UDYG,AEKDAGTS42KWFP7QZJ5N7AKULXCA
164,AEOMESB76SKVG2XNMOELW3XARH4A,True,Good,Good,"August 22, 2019",Jean Sebastien Veilleux,5.0,0,https://www.amazon.ca/gp/profile/amzn1.account.AEOMESB76SKVG2XNMOELW3XARH4A/ref=cm_cr_getr_d_gw_btm?ie=UTF8,2020-09-21 13:10:37.476618,2020-09-21 13:10:37.591786,Carhartt Men's Acrylic Watch Hat,Carhartt Sportswear - Mens,2,B002G9UDYG,AEKDAGTS42KWFP7QZJ5N7AKULXCA
165,AFNQ2HEYFK4ASU66DGGTQAN2UYMA,True,Great purchase,"This hat is really great , I bought this gift for a friends and he loves it , he said it’s very warm and fits great","January 12, 2020",Ona,5.0,0,https://www.amazon.ca/gp/profile/amzn1.account.AFNQ2HEYFK4ASU66DGGTQAN2UYMA/ref=cm_cr_getr_d_gw_btm?ie=UTF8,2020-09-21 13:10:37.595689,2020-09-21 13:10:37.720617,Carhartt Men's Acrylic Watch Hat,Carhartt Sportswear - Mens,2,B002G9UDYG,AEKDAGTS42KWFP7QZJ5N7AKULXCA
166,AGZSCUCXPGWGJCDNJV7AM22XDZVQ,True,Perfect,Fits perfect !,"February 4, 2020",kkarma,5.0,0,https://www.amazon.ca/gp/profile/amzn1.account.AGZSCUCXPGWGJCDNJV7AM22XDZVQ/ref=cm_cr_getr_d_gw_btm?ie=UTF8,2020-09-21 13:10:37.724521,2020-09-21 13:10:37.841641,Carhartt Men's Acrylic Watch Hat,Carhartt Sportswear - Mens,2,B002G9UDYG,AEKDAGTS42KWFP7QZJ5N7AKULXCA
167,AG6R2DRM67OW5IUN6TQ3IT54HPJA,True,Worth it.,"Very warm, love it.","November 20, 2019",T,5.0,0,https://www.amazon.ca/gp/profile/amzn1.account.AG6R2DRM67OW5IUN6TQ3IT54HPJA/ref=cm_cr_getr_d_gw_btm?ie=UTF8,2020-09-21 13:10:37.845545,2020-09-21 13:10:37.957784,Carhartt Men's Acrylic Watch Hat,Carhartt Sportswear - Mens,2,B002G9UDYG,AEKDAGTS42KWFP7QZJ5N7AKULXCA
168,AG2IEQ3MFIBMMT4SQ25EKL2D3CVA,True,Good,Good,"July 28, 2019",Zhan TYUTYUNIK,5.0,0,https://www.amazon.ca/gp/profile/amzn1.account.AG2IEQ3MFIBMMT4SQ25EKL2D3CVA/ref=cm_cr_getr_d_gw_btm?ie=UTF8,2020-09-21 13:10:37.963640,2020-09-21 13:10:38.088568,Carhartt Men's Acrylic Watch Hat,Carhartt Sportswear - Mens,2,B002G9UDYG,AEKDAGTS42KWFP7QZJ5N7AKULXCA
169,AGG3JLXGJ35AOOADFNAXUWYBCNFA,True,Fit great and warm,Great basic hat my daughter wanted it because it matches her worker boots lol,"November 7, 2019",Chrissy,5.0,0,https://www.amazon.ca/gp/profile/amzn1.account.AGG3JLXGJ35AOOADFNAXUWYBCNFA/ref=cm_cr_getr_d_gw_btm?ie=UTF8,2020-09-21 13:10:38.092472,2020-09-21 13:10:38.213496,Carhartt Men's Acrylic Watch Hat,Carhartt Sportswear - Mens,2,B002G9UDYG,AEKDAGTS42KWFP7QZJ5N7AKULXCA
170,AHT6UXGRKKPQE6U2R6YSWK2M5CAA,True,Very good,Great fit and comforting,"May 29, 2019",Benson Lin,5.0,0,https://www.amazon.ca/gp/profile/amzn1.account.AHT6UXGRKKPQE6U2R6YSWK2M5CAA/ref=cm_cr_getr_d_gw_btm?ie=UTF8,2020-09-21 13:10:42.329029,2020-09-21 13:10:42.464691,Carhartt Men's Acrylic Watch Hat,Carhartt Sportswear - Mens,2,B002G9UDYG,AEKDAGTS42KWFP7QZJ5N7AKULXCA
171,AHNPXED2RLBVF3QDGVUMW64T56HQ,True,Awesome,So comfy ! Fits perfectly . I love it,"November 4, 2018",FaZe xValore,5.0,0,https://www.amazon.ca/gp/profile/amzn1.account.AHNPXED2RLBVF3QDGVUMW64T56HQ/ref=cm_cr_getr_d_gw_btm?ie=UTF8,2020-09-21 13:10:42.470549,2020-09-21 13:10:42.613044,Carhartt Men's Acrylic Watch Hat,Carhartt Sportswear - Mens,2,B002G9UDYG,AEKDAGTS42KWFP7QZJ5N7AKULXCA
172,AGXXYVMEOXAVCGNV5MSYXT6X242Q,True,Five Stars,"Great product, just as described! Seems Authentic, made in Canada.","February 15, 2018",DM,5.0,0,https://www.amazon.ca/gp/profile/amzn1.account.AGXXYVMEOXAVCGNV5MSYXT6X242Q/ref=cm_cr_getr_d_gw_btm?ie=UTF8,2020-09-21 13:10:42.616948,2020-09-21 13:10:42.733091,Carhartt Men's Acrylic Watch Hat,Carhartt Sportswear - Mens,2,B002G9UDYG,AEKDAGTS42KWFP7QZJ5N7AKULXCA
173,AEPVJRHZJFLVI7TPG7ATA77AS5QQ,True,good hat,"Warm, looks durable.","November 26, 2019",Gunwoo Gim,5.0,0,https://www.amazon.ca/gp/profile/amzn1.account.AEPVJRHZJFLVI7TPG7ATA77AS5QQ/ref=cm_cr_getr_d_gw_btm?ie=UTF8,2020-09-21 13:10:42.736996,2020-09-21 13:10:42.859971,Carhartt Men's Acrylic Watch Hat,Carhartt Sportswear - Mens,2,B002G9UDYG,AEKDAGTS42KWFP7QZJ5N7AKULXCA
174,AEZ3EDUT7DWWVMHHL4ID4O5CUO5A,True,Fits too tightly,Not sure about this one size fits all... Its too tight for me.,"November 4, 2019",vivian.wang,2.0,0,https://www.amazon.ca/gp/profile/amzn1.account.AEZ3EDUT7DWWVMHHL4ID4O5CUO5A/ref=cm_cr_getr_d_gw_btm?ie=UTF8,2020-09-21 13:10:42.863874,2020-09-21 13:10:42.994659,Carhartt Men's Acrylic Watch Hat,Carhartt Sportswear - Mens,2,B002G9UDYG,AEKDAGTS42KWFP7QZJ5N7AKULXCA
175,AFCSCD3XYIALXTYAPNSON5EZHGDA,True,Good!,Had all the tags from the company so you knew it was real and looks exactly like the pictures,"December 4, 2019",Liyan,5.0,0,https://www.amazon.ca/gp/profile/amzn1.account.AFCSCD3XYIALXTYAPNSON5EZHGDA/ref=cm_cr_getr_d_gw_btm?ie=UTF8,2020-09-21 13:10:42.999538,2020-09-21 13:10:43.116658,Carhartt Men's Acrylic Watch Hat,Carhartt Sportswear - Mens,2,B002G9UDYG,AEKDAGTS42KWFP7QZJ5N7AKULXCA
176,AGBYE5ZC2E3RZRZ2HCNJH4YAOMKA,True,Warm hat,Very good quality. Arrived quickly.,"December 4, 2019",Becky Brown,5.0,0,https://www.amazon.ca/gp/profile/amzn1.account.AGBYE5ZC2E3RZRZ2HCNJH4YAOMKA/ref=cm_cr_getr_d_gw_btm?ie=UTF8,2020-09-21 13:10:43.119586,2020-09-21 13:10:43.230850,Carhartt Men's Acrylic Watch Hat,Carhartt Sportswear - Mens,2,B002G9UDYG,AEKDAGTS42KWFP7QZJ5N7AKULXCA
177,AHVSOM6ZPU363AXRPXGHSVX2W7OQ,True,Grandson approved!!,Fits perfectly and well made,"December 8, 2018",Sincerely Sande,5.0,0,https://www.amazon.ca/gp/profile/amzn1.account.AHVSOM6ZPU363AXRPXGHSVX2W7OQ/ref=cm_cr_getr_d_gw_btm?ie=UTF8,2020-09-21 13:10:43.234753,2020-09-21 13:10:43.363589,Carhartt Men's Acrylic Watch Hat,Carhartt Sportswear - Mens,2,B002G9UDYG,AEKDAGTS42KWFP7QZJ5N7AKULXCA
178,AHJASOP34KG4NUZZ6MYTL2SDLILQ,True,very warm indeed-,"warm, looking good, size is a little bit large for me, just need to fold more haha","December 2, 2019",Ming,4.0,0,https://www.amazon.ca/gp/profile/amzn1.account.AHJASOP34KG4NUZZ6MYTL2SDLILQ/ref=cm_cr_getr_d_gw_btm?ie=UTF8,2020-09-21 13:10:43.367490,2020-09-21 13:10:43.481681,Carhartt Men's Acrylic Watch Hat,Carhartt Sportswear - Mens,2,B002G9UDYG,AEKDAGTS42KWFP7QZJ5N7AKULXCA
179,AGMKPYR263KXHQOEVVA2JYT2PLGA,True,Longer,It was a bit longer that I was expecting,"May 4, 2020",Cristal,5.0,0,https://www.amazon.ca/gp/profile/amzn1.account.AGMKPYR263KXHQOEVVA2JYT2PLGA/ref=cm_cr_getr_d_gw_btm?ie=UTF8,2020-09-21 13:10:43.485584,2020-09-21 13:10:43.599776,Carhartt Men's Acrylic Watch Hat,Carhartt Sportswear - Mens,2,B002G9UDYG,AEKDAGTS42KWFP7QZJ5N7AKULXCA
180,AHLSFLGIVUASC7W4U3A4RZRUT5QA,True,Great hat but your not getting a deal.,Great hat. A bit pricey. Usually see on sale at TSC for $9.99 and i paid $15.99.,"March 17, 2020",Michael Hann,4.0,0,https://www.amazon.ca/gp/profile/amzn1.account.AHLSFLGIVUASC7W4U3A4RZRUT5QA/ref=cm_cr_getr_d_gw_btm?ie=UTF8,2020-09-21 13:10:48.731939,2020-09-21 13:10:48.887146,Carhartt Men's Acrylic Watch Hat,Carhartt Sportswear - Mens,2,B002G9UDYG,AEKDAGTS42KWFP7QZJ5N7AKULXCA
181,AHESSQK3Q3DAN76RB3M2V4OGC23Q,True,Great product!,Great fit and quality.,"January 5, 2019",Jenna grenier,5.0,0,https://www.amazon.ca/gp/profile/amzn1.account.AHESSQK3Q3DAN76RB3M2V4OGC23Q/ref=cm_cr_getr_d_gw_btm?ie=UTF8,2020-09-21 13:10:48.891026,2020-09-21 13:10:49.013050,Carhartt Men's Acrylic Watch Hat,Carhartt Sportswear - Mens,2,B002G9UDYG,AEKDAGTS42KWFP7QZJ5N7AKULXCA
182,AEVPMWY4FDITI2DJUXZWOEY2RSNA,True,Great quality good fitting,Great quality good fitting tooth,"October 8, 2018",Zurona  Nelson,5.0,0,https://www.amazon.ca/gp/profile/amzn1.account.AEVPMWY4FDITI2DJUXZWOEY2RSNA/ref=cm_cr_getr_d_gw_btm?ie=UTF8,2020-09-21 13:10:49.016929,2020-09-21 13:10:49.141857,Carhartt Men's Acrylic Watch Hat,Carhartt Sportswear - Mens,2,B002G9UDYG,AEKDAGTS42KWFP7QZJ5N7AKULXCA
183,AHV4QPM4PJKWQAKYSZGU3MPZEEXA,True,Very nice,"Bought for a friend who wanted it, she loves it, arrived on time","May 14, 2019",Amazon Customer,5.0,0,https://www.amazon.ca/gp/profile/amzn1.account.AHV4QPM4PJKWQAKYSZGU3MPZEEXA/ref=cm_cr_getr_d_gw_btm?ie=UTF8,2020-09-21 13:10:49.153569,2020-09-21 13:10:49.268737,Carhartt Men's Acrylic Watch Hat,Carhartt Sportswear - Mens,2,B002G9UDYG,AEKDAGTS42KWFP7QZJ5N7AKULXCA
184,AE7WYGIDIRBH3UYR3WBQC5YC4DGQ,True,Good quality,Good quality will purchase additional colours,"January 7, 2019",Katie Sevier,5.0,0,https://www.amazon.ca/gp/profile/amzn1.account.AE7WYGIDIRBH3UYR3WBQC5YC4DGQ/ref=cm_cr_getr_d_gw_btm?ie=UTF8,2020-09-21 13:10:49.272641,2020-09-21 13:10:49.384881,Carhartt Men's Acrylic Watch Hat,Carhartt Sportswear - Mens,2,B002G9UDYG,AEKDAGTS42KWFP7QZJ5N7AKULXCA
185,AGUNU7B2WAMONLUYGMFPP42QIHXQ,True,Good price,Excellent product,"February 4, 2019",Colleen K Clipperton,5.0,0,https://www.amazon.ca/gp/profile/amzn1.account.AGUNU7B2WAMONLUYGMFPP42QIHXQ/ref=cm_cr_getr_d_gw_btm?ie=UTF8,2020-09-21 13:10:49.388784,2020-09-21 13:10:49.513712,Carhartt Men's Acrylic Watch Hat,Carhartt Sportswear - Mens,2,B002G9UDYG,AEKDAGTS42KWFP7QZJ5N7AKULXCA
186,AEJ27GHTZBG2XHCP4UHLGAB3DXNA,True,:),Thought it wouldn’t be as long but other than that great,"June 7, 2020",Customer ,4.0,0,https://www.amazon.ca/gp/profile/amzn1.account.AEJ27GHTZBG2XHCP4UHLGAB3DXNA/ref=cm_cr_getr_d_gw_btm?ie=UTF8,2020-09-21 13:10:49.518591,2020-09-21 13:10:49.633760,Carhartt Men's Acrylic Watch Hat,Carhartt Sportswear - Mens,2,B002G9UDYG,AEKDAGTS42KWFP7QZJ5N7AKULXCA
187,AGDSVGADPL7DWL7TCZFDXXQRBNIA,True,Disappointed,The hat is a very big and thick make and doesn’t fit properly. Almost as if it’s a rip off one of the real brand. Highly disappointed,"February 15, 2019",Charissa ,1.0,0,https://www.amazon.ca/gp/profile/amzn1.account.AGDSVGADPL7DWL7TCZFDXXQRBNIA/ref=cm_cr_getr_d_gw_btm?ie=UTF8,2020-09-21 13:10:49.637664,2020-09-21 13:10:49.749904,Carhartt Men's Acrylic Watch Hat,Carhartt Sportswear - Mens,2,B002G9UDYG,AEKDAGTS42KWFP7QZJ5N7AKULXCA
188,AFCGCUQ7AWLCEOISL673CKVYIZEA,True,Exactly as expected,Exactly as expected,"January 21, 2019",Ami,5.0,0,https://www.amazon.ca/gp/profile/amzn1.account.AFCGCUQ7AWLCEOISL673CKVYIZEA/ref=cm_cr_getr_d_gw_btm?ie=UTF8,2020-09-21 13:10:49.754784,2020-09-21 13:10:49.874832,Carhartt Men's Acrylic Watch Hat,Carhartt Sportswear - Mens,2,B002G9UDYG,AEKDAGTS42KWFP7QZJ5N7AKULXCA
189,AEBGY7RXWZDCVFWKVQL6AF2HW3EA,True,Great,As advertised,"January 16, 2020",Ryan M.,4.0,0,https://www.amazon.ca/gp/profile/amzn1.account.AEBGY7RXWZDCVFWKVQL6AF2HW3EA/ref=cm_cr_getr_d_gw_btm?ie=UTF8,2020-09-21 13:10:49.884591,2020-09-21 13:10:49.998783,Carhartt Men's Acrylic Watch Hat,Carhartt Sportswear - Mens,2,B002G9UDYG,AEKDAGTS42KWFP7QZJ5N7AKULXCA
190,AHRPOQT7R6VSYXODA7YCTZXJEBYQ,True,Good plain and simple hat,Soft fabric that keeps my head super warm. No complaints.,"February 15, 2018",Shuaib,4.0,0,https://www.amazon.ca/gp/profile/amzn1.account.AHRPOQT7R6VSYXODA7YCTZXJEBYQ/ref=cm_cr_getr_d_gw_btm?ie=UTF8,2020-09-21 13:10:52.136605,2020-09-21 13:10:52.262566,Carhartt Men's Acrylic Watch Hat,Carhartt Sportswear - Mens,2,B002G9UDYG,AEKDAGTS42KWFP7QZJ5N7AKULXCA
191,AH5IKOSI4M72IB4MBANSMOR6C57A,True,Black Toque,Can not go wrong,"January 8, 2019",Amazon Customer,5.0,0,https://www.amazon.ca/gp/profile/amzn1.account.AH5IKOSI4M72IB4MBANSMOR6C57A/ref=cm_cr_getr_d_gw_btm?ie=UTF8,2020-09-21 13:10:52.267447,2020-09-21 13:10:52.412872,Carhartt Men's Acrylic Watch Hat,Carhartt Sportswear - Mens,2,B002G9UDYG,AEKDAGTS42KWFP7QZJ5N7AKULXCA
192,AEHUPZHLTNG2MBIMJUYQ7XL6JTMQ,True,Good,Warm and good price,"December 6, 2019",Jung Sook Cho,5.0,0,https://www.amazon.ca/gp/profile/amzn1.account.AEHUPZHLTNG2MBIMJUYQ7XL6JTMQ/ref=cm_cr_getr_d_gw_btm?ie=UTF8,2020-09-21 13:10:52.416774,2020-09-21 13:10:52.549518,Carhartt Men's Acrylic Watch Hat,Carhartt Sportswear - Mens,2,B002G9UDYG,AEKDAGTS42KWFP7QZJ5N7AKULXCA
193,AFHA3KC6BKADKYRQAFKGXPENAQAA,True,Good product,Great product,"January 13, 2020",caz,5.0,0,https://www.amazon.ca/gp/profile/amzn1.account.AFHA3KC6BKADKYRQAFKGXPENAQAA/ref=cm_cr_getr_d_gw_btm?ie=UTF8,2020-09-21 13:10:52.559277,2020-09-21 13:10:52.673471,Carhartt Men's Acrylic Watch Hat,Carhartt Sportswear - Mens,2,B002G9UDYG,AEKDAGTS42KWFP7QZJ5N7AKULXCA
194,AEB7II6GI7OMZLHH6MQEWTSF36WA,True,Five Stars,"Better than in description and at the picture, thanks!","January 28, 2018",Natalia,5.0,0,https://www.amazon.ca/gp/profile/amzn1.account.AEB7II6GI7OMZLHH6MQEWTSF36WA/ref=cm_cr_getr_d_gw_btm?ie=UTF8,2020-09-21 13:10:52.678349,2020-09-21 13:10:52.793517,Carhartt Men's Acrylic Watch Hat,Carhartt Sportswear - Mens,2,B002G9UDYG,AEKDAGTS42KWFP7QZJ5N7AKULXCA
195,AF4H2RIYSFOQN57MRBLAKLBVMFDA,True,👍,👍,"July 22, 2019",Yannick,5.0,0,https://www.amazon.ca/gp/profile/amzn1.account.AF4H2RIYSFOQN57MRBLAKLBVMFDA/ref=cm_cr_getr_d_gw_btm?ie=UTF8,2020-09-21 13:10:52.798397,2020-09-21 13:10:52.923368,Carhartt Men's Acrylic Watch Hat,Carhartt Sportswear - Mens,2,B002G9UDYG,AEKDAGTS42KWFP7QZJ5N7AKULXCA
196,AESUBYP677WJFAHAU7XTYFKNVBWA,True,Hats off to Carhartt,"Great hat, son loves it","January 15, 2020",Randy Straker,5.0,0,https://www.amazon.ca/gp/profile/amzn1.account.AESUBYP677WJFAHAU7XTYFKNVBWA/ref=cm_cr_getr_d_gw_btm?ie=UTF8,2020-09-21 13:10:52.927273,2020-09-21 13:10:53.041464,Carhartt Men's Acrylic Watch Hat,Carhartt Sportswear - Mens,2,B002G9UDYG,AEKDAGTS42KWFP7QZJ5N7AKULXCA
197,AGRQFSUM44VKVLUU2CZZXYJ4CZZQ,True,Great,Love it. Carhartt is some of the best quality workwear and casual clothing I’ve owned.,"January 20, 2020",Joey Kocur,5.0,0,https://www.amazon.ca/gp/profile/amzn1.account.AGRQFSUM44VKVLUU2CZZXYJ4CZZQ/ref=cm_cr_getr_d_gw_btm?ie=UTF8,2020-09-21 13:10:53.045368,2020-09-21 13:10:53.159560,Carhartt Men's Acrylic Watch Hat,Carhartt Sportswear - Mens,2,B002G9UDYG,AEKDAGTS42KWFP7QZJ5N7AKULXCA
198,AHLFOK6BT45IOIUWHG2AEZOWB5BQ,True,Only toque I wear,Use one for work every day in winter. and have a few others. can’t beat how warm they are. Well worth it,"March 15, 2019",Travis Olafson,5.0,0,https://www.amazon.ca/gp/profile/amzn1.account.AHLFOK6BT45IOIUWHG2AEZOWB5BQ/ref=cm_cr_getr_d_gw_btm?ie=UTF8,2020-09-21 13:10:53.163463,2020-09-21 13:10:53.282535,Carhartt Men's Acrylic Watch Hat,Carhartt Sportswear - Mens,2,B002G9UDYG,AEKDAGTS42KWFP7QZJ5N7AKULXCA
199,AFAD555A2NKYBX2ZDKI2UBBVULTQ,True,so cute & very warm,"nice quality beanie, fits the way I wanted it to and im very happy! I ordered the black beanie and it says it was made in Canada which was a big plus!","October 8, 2018",Betty,5.0,0,https://www.amazon.ca/gp/profile/amzn1.account.AFAD555A2NKYBX2ZDKI2UBBVULTQ/ref=cm_cr_getr_d_gw_btm?ie=UTF8,2020-09-21 13:10:53.292296,2020-09-21 13:10:53.406488,Carhartt Men's Acrylic Watch Hat,Carhartt Sportswear - Mens,2,B002G9UDYG,AEKDAGTS42KWFP7QZJ5N7AKULXCA
200,AGEI4MZTUVK75RIJD6HOGNHYYGBQ,True,Good quality,"Great toque,Very warm but a little bit long","December 5, 2019",Amazon Customer,4.0,0,https://www.amazon.ca/gp/profile/amzn1.account.AGEI4MZTUVK75RIJD6HOGNHYYGBQ/ref=cm_cr_getr_d_gw_btm?ie=UTF8,2020-09-21 13:10:56.544856,2020-09-21 13:10:56.672711,Carhartt Men's Acrylic Watch Hat,Carhartt Sportswear - Mens,2,B002G9UDYG,AEKDAGTS42KWFP7QZJ5N7AKULXCA
201,AHQHLZQOXFVFHL7NNA7QDQZ2ADSA,True,good cap,I do like carhartt products this hat is good for my head,"November 27, 2018",Ron Dorey,5.0,0,https://www.amazon.ca/gp/profile/amzn1.account.AHQHLZQOXFVFHL7NNA7QDQZ2ADSA/ref=cm_cr_getr_d_gw_btm?ie=UTF8,2020-09-21 13:10:56.676615,2020-09-21 13:10:56.794712,Carhartt Men's Acrylic Watch Hat,Carhartt Sportswear - Mens,2,B002G9UDYG,AEKDAGTS42KWFP7QZJ5N7AKULXCA
202,AFGT3MXIPST25MW6DOQDOIEMSCBA,True,Love it,Loved it wow worth the money,"January 8, 2019",Amazon Customer,5.0,0,https://www.amazon.ca/gp/profile/amzn1.account.AFGT3MXIPST25MW6DOQDOIEMSCBA/ref=cm_cr_getr_d_gw_btm?ie=UTF8,2020-09-21 13:10:56.799591,2020-09-21 13:10:56.917730,Carhartt Men's Acrylic Watch Hat,Carhartt Sportswear - Mens,2,B002G9UDYG,AEKDAGTS42KWFP7QZJ5N7AKULXCA
203,AEQ7MEADW5P7RWSVNO4HJQBJCVMA,True,Love it!,Awesome quality will order again,"November 8, 2019",Amazon Customer,5.0,0,https://www.amazon.ca/gp/profile/amzn1.account.AEQ7MEADW5P7RWSVNO4HJQBJCVMA/ref=cm_cr_getr_d_gw_btm?ie=UTF8,2020-09-21 13:10:56.927490,2020-09-21 13:10:57.045587,Carhartt Men's Acrylic Watch Hat,Carhartt Sportswear - Mens,2,B002G9UDYG,AEKDAGTS42KWFP7QZJ5N7AKULXCA
204,AE2QL6RYJKG35Y6N73G55EPKFTWQ,True,A great hat to keep you warm through the harshest of winters,"I'm in love with this beanie. It knows how to take a ""-30C Canadian winter"" beating.","December 30, 2017",Nathan D.,5.0,0,https://www.amazon.ca/gp/profile/amzn1.account.AE2QL6RYJKG35Y6N73G55EPKFTWQ/ref=cm_cr_getr_d_gw_btm?ie=UTF8,2020-09-21 13:10:57.049490,2020-09-21 13:10:57.161731,Carhartt Men's Acrylic Watch Hat,Carhartt Sportswear - Mens,2,B002G9UDYG,AEKDAGTS42KWFP7QZJ5N7AKULXCA
205,AHEXS2UQQFFQTOY3WIWPWOTK5WCA,True,Much bigger than expected,"This hat seems way too long and stretched out, not what I expected. Disappointed.","January 14, 2020",Amazon Customer,1.0,0,https://www.amazon.ca/gp/profile/amzn1.account.AHEXS2UQQFFQTOY3WIWPWOTK5WCA/ref=cm_cr_getr_d_gw_btm?ie=UTF8,2020-09-21 13:10:57.165634,2020-09-21 13:10:57.278850,Carhartt Men's Acrylic Watch Hat,Carhartt Sportswear - Mens,2,B002G9UDYG,AEKDAGTS42KWFP7QZJ5N7AKULXCA
206,AEWIM4MRNW6BBVK7C3V2O3QFFTNA,True,Nicely fitted,The hat is exactly as I expected and fits very snuggle around the ears for our cold days :),"December 30, 2019",Maria,4.0,0,https://www.amazon.ca/gp/profile/amzn1.account.AEWIM4MRNW6BBVK7C3V2O3QFFTNA/ref=cm_cr_getr_d_gw_btm?ie=UTF8,2020-09-21 13:10:57.283730,2020-09-21 13:10:57.407681,Carhartt Men's Acrylic Watch Hat,Carhartt Sportswear - Mens,2,B002G9UDYG,AEKDAGTS42KWFP7QZJ5N7AKULXCA
207,AFUKWP6AGJKESSP7UAGNFU3Z7XAQ,True,Awesome fit,Fits great,"December 26, 2018",andrew,5.0,0,https://www.amazon.ca/gp/profile/amzn1.account.AFUKWP6AGJKESSP7UAGNFU3Z7XAQ/ref=cm_cr_getr_d_gw_btm?ie=UTF8,2020-09-21 13:10:57.412562,2020-09-21 13:10:57.526754,Carhartt Men's Acrylic Watch Hat,Carhartt Sportswear - Mens,2,B002G9UDYG,AEKDAGTS42KWFP7QZJ5N7AKULXCA
208,AF7RWH3OOW2BEPLET7OBOPBAFJXA,True,Warm,"Warm, durable and washable","March 5, 2019",Breann Allin,5.0,0,https://www.amazon.ca/gp/profile/amzn1.account.AF7RWH3OOW2BEPLET7OBOPBAFJXA/ref=cm_cr_getr_d_gw_btm?ie=UTF8,2020-09-21 13:10:57.530657,2020-09-21 13:10:57.644848,Carhartt Men's Acrylic Watch Hat,Carhartt Sportswear - Mens,2,B002G9UDYG,AEKDAGTS42KWFP7QZJ5N7AKULXCA
209,AF3XLSSZDOZRPQIZABWUX7DYYN7A,True,Win some and loose some,Ordered a few hats in different colours and this one was a lot smaller than the other hats and isn’t comfortable.,"November 17, 2019",james miller,1.0,0,https://www.amazon.ca/gp/profile/amzn1.account.AF3XLSSZDOZRPQIZABWUX7DYYN7A/ref=cm_cr_getr_d_gw_btm?ie=UTF8,2020-09-21 13:10:57.649729,2020-09-21 13:10:57.764897,Carhartt Men's Acrylic Watch Hat,Carhartt Sportswear - Mens,2,B002G9UDYG,AEKDAGTS42KWFP7QZJ5N7AKULXCA
210,AHN7EVLNY3A5QZKGIEADPATSGP5A,True,Great for price,"Wonderful fabric, came in quickly!","December 30, 2019",Kaylee Kelly,5.0,0,https://www.amazon.ca/gp/profile/amzn1.account.AHN7EVLNY3A5QZKGIEADPATSGP5A/ref=cm_cr_getr_d_gw_btm?ie=UTF8,2020-09-21 13:11:02.867277,2020-09-21 13:11:02.986389,Carhartt Men's Acrylic Watch Hat,Carhartt Sportswear - Mens,2,B002G9UDYG,AEKDAGTS42KWFP7QZJ5N7AKULXCA
211,AFXWWXJX2T2YWCMUTE4DTJWIWMKA,True,fast delivery,Carhartt is always good,"December 23, 2019",Pat De Jonge,5.0,0,https://www.amazon.ca/gp/profile/amzn1.account.AFXWWXJX2T2YWCMUTE4DTJWIWMKA/ref=cm_cr_getr_d_gw_btm?ie=UTF8,2020-09-21 13:11:02.991294,2020-09-21 13:11:03.113315,Carhartt Men's Acrylic Watch Hat,Carhartt Sportswear - Mens,2,B002G9UDYG,AEKDAGTS42KWFP7QZJ5N7AKULXCA
212,AENNODL5GCUCLJ445WEO3XJZG6BQ,True,It's warm,It's good,"November 22, 2019",David Coates,5.0,0,https://www.amazon.ca/gp/profile/amzn1.account.AENNODL5GCUCLJ445WEO3XJZG6BQ/ref=cm_cr_getr_d_gw_btm?ie=UTF8,2020-09-21 13:11:03.117220,2020-09-21 13:11:03.237267,Carhartt Men's Acrylic Watch Hat,Carhartt Sportswear - Mens,2,B002G9UDYG,AEKDAGTS42KWFP7QZJ5N7AKULXCA
213,AHBJJ5DLSSVT5TKLMZCBLB6MQN4A,True,Great hat,Good quality,"January 12, 2019",Karen,5.0,0,https://www.amazon.ca/gp/profile/amzn1.account.AHBJJ5DLSSVT5TKLMZCBLB6MQN4A/ref=cm_cr_getr_d_gw_btm?ie=UTF8,2020-09-21 13:11:03.241173,2020-09-21 13:11:03.363171,Carhartt Men's Acrylic Watch Hat,Carhartt Sportswear - Mens,2,B002G9UDYG,AEKDAGTS42KWFP7QZJ5N7AKULXCA
214,AHNNE7ZD6EZJ54LXRVJ6PKWQFD5Q,True,Excellent,Excellent,"March 30, 2019",Debra Bue,5.0,0,https://www.amazon.ca/gp/profile/amzn1.account.AHNNE7ZD6EZJ54LXRVJ6PKWQFD5Q/ref=cm_cr_getr_d_gw_btm?ie=UTF8,2020-09-21 13:11:03.367076,2020-09-21 13:11:03.486180,Carhartt Men's Acrylic Watch Hat,Carhartt Sportswear - Mens,2,B002G9UDYG,AEKDAGTS42KWFP7QZJ5N7AKULXCA
215,AGT3UQFKEEKFSBRGAVIZVOLWPXIQ,True,Recommended,Good quality. Keeps warm,"November 24, 2019",Natascha Kreker,5.0,0,https://www.amazon.ca/gp/profile/amzn1.account.AGT3UQFKEEKFSBRGAVIZVOLWPXIQ/ref=cm_cr_getr_d_gw_btm?ie=UTF8,2020-09-21 13:11:03.490083,2020-09-21 13:11:03.618914,Carhartt Men's Acrylic Watch Hat,Carhartt Sportswear - Mens,2,B002G9UDYG,AEKDAGTS42KWFP7QZJ5N7AKULXCA
216,AF37A4IME35JZGECEKIYL27TW7DQ,True,Vg,VG,"March 12, 2019",Glen,5.0,0,https://www.amazon.ca/gp/profile/amzn1.account.AF37A4IME35JZGECEKIYL27TW7DQ/ref=cm_cr_getr_d_gw_btm?ie=UTF8,2020-09-21 13:11:03.622819,2020-09-21 13:11:03.737010,Carhartt Men's Acrylic Watch Hat,Carhartt Sportswear - Mens,2,B002G9UDYG,AEKDAGTS42KWFP7QZJ5N7AKULXCA
217,AEAUHYTRFBLGQVOLM6P2S7KMYLNA,True,Nice quality!,"It is a good quality hat, and it fit great just a little long on top - not a skull cap type but it keeps my sons head warm!!","January 1, 2019",Heather ,4.0,0,https://www.amazon.ca/gp/profile/amzn1.account.AEAUHYTRFBLGQVOLM6P2S7KMYLNA/ref=cm_cr_getr_d_gw_btm?ie=UTF8,2020-09-21 13:11:03.741891,2020-09-21 13:11:03.860963,Carhartt Men's Acrylic Watch Hat,Carhartt Sportswear - Mens,2,B002G9UDYG,AEKDAGTS42KWFP7QZJ5N7AKULXCA
218,AE2IWZ4JYKIVS2FUXPQ3UCCOGNOA,True,Came a bit frayed on seams,Good,"October 21, 2019",Izzy,4.0,0,https://www.amazon.ca/gp/profile/amzn1.account.AE2IWZ4JYKIVS2FUXPQ3UCCOGNOA/ref=cm_cr_getr_d_gw_btm?ie=UTF8,2020-09-21 13:11:03.864867,2020-09-21 13:11:03.994673,Carhartt Men's Acrylic Watch Hat,Carhartt Sportswear - Mens,2,B002G9UDYG,AEKDAGTS42KWFP7QZJ5N7AKULXCA
219,AF5JO44B7IZEX64GSZKJOCAMZSIA,True,Would buy a hundred,"Comfy, thick hat. Great for work or outdoors.","February 20, 2020",Brittany,5.0,0,https://www.amazon.ca/gp/profile/amzn1.account.AF5JO44B7IZEX64GSZKJOCAMZSIA/ref=cm_cr_getr_d_gw_btm?ie=UTF8,2020-09-21 13:11:03.998577,2020-09-21 13:11:04.112769,Carhartt Men's Acrylic Watch Hat,Carhartt Sportswear - Mens,2,B002G9UDYG,AEKDAGTS42KWFP7QZJ5N7AKULXCA
