,subproduct_author_id,verified_purchase,review_title,reviews,date,reviewer_name,ratings,people_find_helpful,reviewer_profile_url,start_time,end_time,product_name,brand_name,rank,product_id,author_id
0,AHTYDLUF2D2VPPCOF2WQF2ZQOFQA,True,Where's the quality?,Been purchasing Carhartt for years. This sweater is replacing one that has taken a beating for 5 years. 3rd wash in there is a separation in the seam on the right torso. I expect better than this from Carhartt. Missed the return window by 5 days. Brutal.,"February 18, 2020",Amazon Customer,1.0,2,https://www.amazon.ca/gp/profile/amzn1.account.AHTYDLUF2D2VPPCOF2WQF2ZQOFQA/ref=cm_cr_arp_d_gw_btm?ie=UTF8,2020-09-28 20:07:45.982090,2020-09-28 20:07:46.303199,Carhartt Men's Midweight Hooded Zip Front Sweatshirt,Carhartt,"7,111",B002G9UDYG,AE3LRCOFYOIXMTUVY7MELWKBDM6A
1,AHE5DS2ID5E6DR65OPDXW36HVTRQ,True,Poor quality,"Purchased the Large/Tall version.
- Fit is great.
- Zipper is poor quality. It is not smooth and gets hung up sometimes.
- No loop to hang sewn in behind neck area.
- Looks and feels not much better than a Walmart sweater.

This is the first Carhartt product I have purchased which I am unhappy with. It's very nice that they are making tall versions of clothing now but I would spend more money and get a more expensive version next time.
Wash/dry twice before wearing anything dark as this thing sheds fluff like crazy.","July 18, 2020",Brock,2.0,0,https://www.amazon.ca/gp/profile/amzn1.account.AHE5DS2ID5E6DR65OPDXW36HVTRQ/ref=cm_cr_arp_d_gw_btm?ie=UTF8,2020-09-28 20:07:46.308072,2020-09-28 20:07:46.513031,Carhartt Men's Midweight Hooded Zip Front Sweatshirt,Carhartt,"7,111",B002G9UDYG,AE3LRCOFYOIXMTUVY7MELWKBDM6A
2,AGQIMTYRZA67P7BUGPVB3CASCTWQ,True,Good quality. Good Fit. Will buy again,"People mentioned that this item was over-sized so I bought a 2XLT instead of my usual 3XLT .
It fits tight - wish I had ordered my reg size.... NEXT time .. and there will be a next time because the quality is very good and I just like wearing it. Nice length on arms and hips, not to long at all!
Recommend this jacket!","September 1, 2019",Big Everything,5.0,One,https://www.amazon.ca/gp/profile/amzn1.account.AGQIMTYRZA67P7BUGPVB3CASCTWQ/ref=cm_cr_arp_d_gw_btm?ie=UTF8,2020-09-28 20:07:46.518888,2020-09-28 20:07:46.659431,Carhartt Men's Midweight Hooded Zip Front Sweatshirt,Carhartt,"7,111",B002G9UDYG,AE3LRCOFYOIXMTUVY7MELWKBDM6A
3,AGJORMTC45LCZZ7HZGWY2AWFM34A,True,Tall size is main reason for using this company .,"This about the 3rd or 4rth product I got from this company . The quality Is always very good and the material is always substantial (heavy) . The main reason I use this company is how it accomidates people with long torsos . For me 2xl is always short and big all over , but xl Tall is perfect .","October 25, 2018",Dan,4.0,0,https://www.amazon.ca/gp/profile/amzn1.account.AGJORMTC45LCZZ7HZGWY2AWFM34A/ref=cm_cr_arp_d_gw_btm?ie=UTF8,2020-09-28 20:07:46.663335,2020-09-28 20:07:46.803880,Carhartt Men's Midweight Hooded Zip Front Sweatshirt,Carhartt,"7,111",B002G9UDYG,AE3LRCOFYOIXMTUVY7MELWKBDM6A
4,AHFBBQMMHYEFVFJQYDJX73NQUQ4Q,True,Carhartt is quality.,"Fast shipping, was as described. Good quality as Carhartt always is. Its thick without being bulky and its light feeling but warm. I'm 5'11 200 I got the xl tall and fits fine maybe abit big next time I'll do a L tall or just xl and that would be a nicer fit for myself. Would buy again.","January 3, 2019",Amazon Customer,5.0,0,https://www.amazon.ca/gp/profile/amzn1.account.AHFBBQMMHYEFVFJQYDJX73NQUQ4Q/ref=cm_cr_arp_d_gw_btm?ie=UTF8,2020-09-28 20:07:46.807783,2020-09-28 20:07:46.964919,Carhartt Men's Midweight Hooded Zip Front Sweatshirt,Carhartt,"7,111",B002G9UDYG,AE3LRCOFYOIXMTUVY7MELWKBDM6A
5,AFS3IUKCX45MFPXLB7NDSFXBCRZQ,True,Large Fit Well made Hoodie,"As always with Carhartt, I have no complaints about the quality, but I find the fit to be too large, like WAY too large. I'm 6'4"" tall and a 3X Tall is far too big for me.","October 23, 2019",MrBabylon9000,3.0,0,https://www.amazon.ca/gp/profile/amzn1.account.AFS3IUKCX45MFPXLB7NDSFXBCRZQ/ref=cm_cr_arp_d_gw_btm?ie=UTF8,2020-09-28 20:07:46.968822,2020-09-28 20:07:47.103510,Carhartt Men's Midweight Hooded Zip Front Sweatshirt,Carhartt,"7,111",B002G9UDYG,AE3LRCOFYOIXMTUVY7MELWKBDM6A
6,AFY654MKASRROO3UFUMGHDGGKEBQ,True,Really good quality,Carhartt really good quality for cloathed last in time color stay you put it in drying machine dont reduce really like their product,"April 11, 2020",Christian Bergeron,5.0,0,https://www.amazon.ca/gp/profile/amzn1.account.AFY654MKASRROO3UFUMGHDGGKEBQ/ref=cm_cr_arp_d_gw_btm?ie=UTF8,2020-09-28 20:07:47.108390,2020-09-28 20:07:47.245030,Carhartt Men's Midweight Hooded Zip Front Sweatshirt,Carhartt,"7,111",B002G9UDYG,AE3LRCOFYOIXMTUVY7MELWKBDM6A
7,AG747KXO2OST3RLRKTEZZJQTAA7A,True,Perfect,"Perfect, a bit on the large side on the length area but it keeps it from riding up and exposing your back when reaching up to grab something, specially when working outside. Thanks.","March 9, 2019",LATINO,5.0,0,https://www.amazon.ca/gp/profile/amzn1.account.AG747KXO2OST3RLRKTEZZJQTAA7A/ref=cm_cr_arp_d_gw_btm?ie=UTF8,2020-09-28 20:07:47.248934,2020-09-28 20:07:47.400213,Carhartt Men's Midweight Hooded Zip Front Sweatshirt,Carhartt,"7,111",B002G9UDYG,AE3LRCOFYOIXMTUVY7MELWKBDM6A
8,AG747KXO2OST3RLRKTEZZJQTAA7A,True,had to return this one since I ordered tall version and could reach the pockets but not at a comfortable height.,"Seems that the fabric is a lot thinner then the 2 other sweaters I have, same model (K122), had to return this one since I ordered tall version and could reach the pockets but not at a comfortable height.","December 5, 2017",LATINO,3.0,0,https://www.amazon.ca/gp/profile/amzn1.account.AG747KXO2OST3RLRKTEZZJQTAA7A/ref=cm_cr_arp_d_gw_btm?ie=UTF8,2020-09-28 20:07:47.405093,2020-09-28 20:07:47.530021,Carhartt Men's Midweight Hooded Zip Front Sweatshirt,Carhartt,"7,111",B002G9UDYG,AE3LRCOFYOIXMTUVY7MELWKBDM6A
9,AE3LRCOFYOIXMTUVY7MELWKBDM6A,True,"Very comfortable, high quality.",You really can't beat Carhartt for their quality at this price point. Excellent product.,"June 10, 2020",genericname,5.0,0,https://www.amazon.ca/gp/profile/amzn1.account.AE3LRCOFYOIXMTUVY7MELWKBDM6A/ref=cm_cr_arp_d_gw_btm?ie=UTF8,2020-09-28 20:07:47.535878,2020-09-28 20:07:47.669589,Carhartt Men's Midweight Hooded Zip Front Sweatshirt,Carhartt,"7,111",B002G9UDYG,AE3LRCOFYOIXMTUVY7MELWKBDM6A
10,AHMC2EAF3UUZINFVLHHNIFGYZNXQ,True,Carhartt awesome,Love the big and tall fit. Good quality and looks nice.,"June 7, 2020",Cobra Commander,5.0,0,https://www.amazon.ca/gp/profile/amzn1.account.AHMC2EAF3UUZINFVLHHNIFGYZNXQ/ref=cm_cr_getr_d_gw_btm?ie=UTF8,2020-09-28 20:07:52.891403,2020-09-28 20:07:53.029018,Carhartt Men's Midweight Hooded Zip Front Sweatshirt,Carhartt,"7,111",B002G9UDYG,AE3LRCOFYOIXMTUVY7MELWKBDM6A
11,AEBDMHDCXMIJATRJACRJC3MB7LIA,True,generaiiy pleased with carhart,"I purchased this hoodie a while back,but just recently started using it,it has not been laundered,but nevertheless the zipper has started falling apart,I'm really not impressed and I was wondering if there was anything that could be done about it.
signed a generally happy and pleased Amazon customer.","February 1, 2019",rick orchard,1.0,0,https://www.amazon.ca/gp/profile/amzn1.account.AEBDMHDCXMIJATRJACRJC3MB7LIA/ref=cm_cr_getr_d_gw_btm?ie=UTF8,2020-09-28 20:07:53.033898,2020-09-28 20:07:53.157882,Carhartt Men's Midweight Hooded Zip Front Sweatshirt,Carhartt,"7,111",B002G9UDYG,AE3LRCOFYOIXMTUVY7MELWKBDM6A
12,AHUUPUCIR54JDRSZYHR5WYXLGF2Q,True,Fixs right and looks right,The sweater is looks and fits as expected. Took a little longer getting here because of covid but all and all good product.,"June 14, 2020",Nathan MacDonald,5.0,0,https://www.amazon.ca/gp/profile/amzn1.account.AHUUPUCIR54JDRSZYHR5WYXLGF2Q/ref=cm_cr_getr_d_gw_btm?ie=UTF8,2020-09-28 20:07:53.162762,2020-09-28 20:07:53.287690,Carhartt Men's Midweight Hooded Zip Front Sweatshirt,Carhartt,"7,111",B002G9UDYG,AE3LRCOFYOIXMTUVY7MELWKBDM6A
13,AEDWLGEGCR7SJGY23BPVOQW4GGNA,True,Surprise,Part of zipper fell off in washer after three months. Same thing happened to another one of a different colour.,"January 25, 2020",Firm and Fair,1.0,0,https://www.amazon.ca/gp/profile/amzn1.account.AEDWLGEGCR7SJGY23BPVOQW4GGNA/ref=cm_cr_getr_d_gw_btm?ie=UTF8,2020-09-28 20:07:53.292570,2020-09-28 20:07:53.427258,Carhartt Men's Midweight Hooded Zip Front Sweatshirt,Carhartt,"7,111",B002G9UDYG,AE3LRCOFYOIXMTUVY7MELWKBDM6A
14,AE7T3J24KORMIYUHONHZM44GSIOA,True,Finally!,"I am 6'0, 210lbs with Neanderthal arms. I finally have a hoodie that fits my long arms, and has a nice length. Very happy with this. (Ordered a Large)","March 27, 2018",BonerJamz1986,5.0,0,https://www.amazon.ca/gp/profile/amzn1.account.AE7T3J24KORMIYUHONHZM44GSIOA/ref=cm_cr_getr_d_gw_btm?ie=UTF8,2020-09-28 20:07:53.431163,2020-09-28 20:07:53.556090,Carhartt Men's Midweight Hooded Zip Front Sweatshirt,Carhartt,"7,111",B002G9UDYG,AE3LRCOFYOIXMTUVY7MELWKBDM6A
15,AEPE3BH2G6ELVQZNR7VVYDBIBWEQ,True,RECOMMENDED !!,very comfy and well made. but surprisingly big for a 3x. husband will wear it with pride. thank you,"March 15, 2018",Amy St Christopher,5.0,One,https://www.amazon.ca/gp/profile/amzn1.account.AEPE3BH2G6ELVQZNR7VVYDBIBWEQ/ref=cm_cr_getr_d_gw_btm?ie=UTF8,2020-09-28 20:07:53.559993,2020-09-28 20:07:53.698606,Carhartt Men's Midweight Hooded Zip Front Sweatshirt,Carhartt,"7,111",B002G9UDYG,AE3LRCOFYOIXMTUVY7MELWKBDM6A
16,AGQAUHT77EGRYKDHMOUDXRIF6AYQ,True,Great jacket!,My husband is very happy with this jacket for work. He is a home builder and is outside often. He appreciates the length as he’s a tall guy and it’s nice to have something long enough.,"December 18, 2018",Amazon Customer,5.0,0,https://www.amazon.ca/gp/profile/amzn1.account.AGQAUHT77EGRYKDHMOUDXRIF6AYQ/ref=cm_cr_getr_d_gw_btm?ie=UTF8,2020-09-28 20:07:53.703486,2020-09-28 20:07:53.863550,Carhartt Men's Midweight Hooded Zip Front Sweatshirt,Carhartt,"7,111",B002G9UDYG,AE3LRCOFYOIXMTUVY7MELWKBDM6A
17,AHIPH7VG6RJRVGLIZ3D7EDSDFVNA,True,Finally found a zip up hoodie that fits him!!,I bought this for my husband. He’s had a hard time finding a zip up hoodie that fit him properly. This one fit great and he’s really happy with it.,"July 5, 2020",Karine Seidman,5.0,0,https://www.amazon.ca/gp/profile/amzn1.account.AHIPH7VG6RJRVGLIZ3D7EDSDFVNA/ref=cm_cr_getr_d_gw_btm?ie=UTF8,2020-09-28 20:07:53.868430,2020-09-28 20:07:53.991405,Carhartt Men's Midweight Hooded Zip Front Sweatshirt,Carhartt,"7,111",B002G9UDYG,AE3LRCOFYOIXMTUVY7MELWKBDM6A
18,AGDXPMNMRXZ5HPGAUKKWDABMSKZA,True,Awesome,Great product.,"April 17, 2020",Amazon Customer,5.0,0,https://www.amazon.ca/gp/profile/amzn1.account.AGDXPMNMRXZ5HPGAUKKWDABMSKZA/ref=cm_cr_getr_d_gw_btm?ie=UTF8,2020-09-28 20:07:53.995309,2020-09-28 20:07:54.130972,Carhartt Men's Midweight Hooded Zip Front Sweatshirt,Carhartt,"7,111",B002G9UDYG,AE3LRCOFYOIXMTUVY7MELWKBDM6A
19,AFXVJ5TWTA6CKNG27L5DPCUFIDMQ,True,Good quality,Good quality hoodie. Wished the logo was not visible on front of pocket. It's small though and can probably be removed with a stitch remover.,"November 23, 2019",Amazon Customer,5.0,0,https://www.amazon.ca/gp/profile/amzn1.account.AFXVJ5TWTA6CKNG27L5DPCUFIDMQ/ref=cm_cr_getr_d_gw_btm?ie=UTF8,2020-09-28 20:07:54.135853,2020-09-28 20:07:54.260813,Carhartt Men's Midweight Hooded Zip Front Sweatshirt,Carhartt,"7,111",B002G9UDYG,AE3LRCOFYOIXMTUVY7MELWKBDM6A
20,AGGCZ6Q7S4VRHEYJ2DDHWWDTYOFA,True,Good product,Good quality and nice soft material on the inside. Well made,"January 15, 2019",roopster,5.0,0,https://www.amazon.ca/gp/profile/amzn1.account.AGGCZ6Q7S4VRHEYJ2DDHWWDTYOFA/ref=cm_cr_getr_d_gw_btm?ie=UTF8,2020-09-28 20:07:58.418835,2020-09-28 20:07:58.576944,Carhartt Men's Midweight Hooded Zip Front Sweatshirt,Carhartt,"7,111",B002G9UDYG,AE3LRCOFYOIXMTUVY7MELWKBDM6A
21,AGLAEVC7XQVEPCAWQOH47OPA3OSA,True,The sizes are slightly bigger for the tall,"I'm a big man standing at 6""5 , I have never had hoodie fit so perfectly. I'm usually 4XL but this 3XT size fits perfectly. Love the zipper always get a zipper .","March 13, 2020",Said Hussien,5.0,0,https://www.amazon.ca/gp/profile/amzn1.account.AGLAEVC7XQVEPCAWQOH47OPA3OSA/ref=cm_cr_getr_d_gw_btm?ie=UTF8,2020-09-28 20:07:58.581824,2020-09-28 20:07:58.705776,Carhartt Men's Midweight Hooded Zip Front Sweatshirt,Carhartt,"7,111",B002G9UDYG,AE3LRCOFYOIXMTUVY7MELWKBDM6A
22,AF5HTQKVEZ754UVNH6N3A35ZWF7Q,True,high quality,high quality product and the tall size provides ample arm length and body length for my six foot 4 inch height,"January 27, 2019",helper,5.0,0,https://www.amazon.ca/gp/profile/amzn1.account.AF5HTQKVEZ754UVNH6N3A35ZWF7Q/ref=cm_cr_getr_d_gw_btm?ie=UTF8,2020-09-28 20:07:58.709680,2020-09-28 20:07:58.846319,Carhartt Men's Midweight Hooded Zip Front Sweatshirt,Carhartt,"7,111",B002G9UDYG,AE3LRCOFYOIXMTUVY7MELWKBDM6A
23,AFKN45BBHQ2ZUOLG5OZWNRPSE66Q,True,Small,I'm not really sure how I can order the exact same hoodie as I've ordered before and this one be a lot smaller than the other. Are they made for different seasons or something?,"April 25, 2018",Amazon Customer,1.0,0,https://www.amazon.ca/gp/profile/amzn1.account.AFKN45BBHQ2ZUOLG5OZWNRPSE66Q/ref=cm_cr_getr_d_gw_btm?ie=UTF8,2020-09-28 20:07:58.851199,2020-09-28 20:07:58.969295,Carhartt Men's Midweight Hooded Zip Front Sweatshirt,Carhartt,"7,111",B002G9UDYG,AE3LRCOFYOIXMTUVY7MELWKBDM6A
24,AG5ILSJRXZ2H27ZLBAST5BYIWWXQ,True,Little big.,Fits a little big but has that carhart quality!,"February 25, 2019",Derek Thompson,5.0,0,https://www.amazon.ca/gp/profile/amzn1.account.AG5ILSJRXZ2H27ZLBAST5BYIWWXQ/ref=cm_cr_getr_d_gw_btm?ie=UTF8,2020-09-28 20:07:58.973199,2020-09-28 20:07:59.094224,Carhartt Men's Midweight Hooded Zip Front Sweatshirt,Carhartt,"7,111",B002G9UDYG,AE3LRCOFYOIXMTUVY7MELWKBDM6A
25,AGQHRLOMDZJZOSD2OVK5HFQX5NPQ,True,Exactly as expected & portrayed,Perfect,"December 12, 2019",Billy Shears,5.0,0,https://www.amazon.ca/gp/profile/amzn1.account.AGQHRLOMDZJZOSD2OVK5HFQX5NPQ/ref=cm_cr_getr_d_gw_btm?ie=UTF8,2020-09-28 20:07:59.102031,2020-09-28 20:07:59.218174,Carhartt Men's Midweight Hooded Zip Front Sweatshirt,Carhartt,"7,111",B002G9UDYG,AE3LRCOFYOIXMTUVY7MELWKBDM6A
26,AFNSKEAYULQT37HONTBZJSV5TLAA,True,Runs large,"Great product, just ordered too big.","April 5, 2019",What is this?,5.0,0,https://www.amazon.ca/gp/profile/amzn1.account.AFNSKEAYULQT37HONTBZJSV5TLAA/ref=cm_cr_getr_d_gw_btm?ie=UTF8,2020-09-28 20:07:59.222079,2020-09-28 20:07:59.339198,Carhartt Men's Midweight Hooded Zip Front Sweatshirt,Carhartt,"7,111",B002G9UDYG,AE3LRCOFYOIXMTUVY7MELWKBDM6A
27,AE5COXVUMZGPGYP4RVZJYVHMRNAQ,True,Bon,Bon prix,"September 4, 2019",Patrick ,3.0,0,https://www.amazon.ca/gp/profile/amzn1.account.AE5COXVUMZGPGYP4RVZJYVHMRNAQ/ref=cm_cr_getr_d_gw_btm?ie=UTF8,2020-09-28 20:07:59.343103,2020-09-28 20:07:59.471934,Carhartt Men's Midweight Hooded Zip Front Sweatshirt,Carhartt,"7,111",B002G9UDYG,AE3LRCOFYOIXMTUVY7MELWKBDM6A
28,AEXWNM3OIXFD5T6DNDVK2IBSGR5A,True,Good quality,"It’s too long, returned it","March 9, 2019",Maryanne,4.0,0,https://www.amazon.ca/gp/profile/amzn1.account.AEXWNM3OIXFD5T6DNDVK2IBSGR5A/ref=cm_cr_getr_d_gw_btm?ie=UTF8,2020-09-28 20:07:59.475839,2020-09-28 20:07:59.596862,Carhartt Men's Midweight Hooded Zip Front Sweatshirt,Carhartt,"7,111",B002G9UDYG,AE3LRCOFYOIXMTUVY7MELWKBDM6A
29,AF52Z2ZPWI2LWWTHZUVONILBZ2KA,True,Great sweater,Just what i wanted for work,"November 12, 2018",Brad,5.0,0,https://www.amazon.ca/gp/profile/amzn1.account.AF52Z2ZPWI2LWWTHZUVONILBZ2KA/ref=cm_cr_getr_d_gw_btm?ie=UTF8,2020-09-28 20:07:59.600765,2020-09-28 20:07:59.727646,Carhartt Men's Midweight Hooded Zip Front Sweatshirt,Carhartt,"7,111",B002G9UDYG,AE3LRCOFYOIXMTUVY7MELWKBDM6A
30,AEJKJEPX7EF4WKHCVRDPC2QNTECA,True,Hoodie,Awesome quality,"December 28, 2018",Amazon Customer,5.0,0,https://www.amazon.ca/gp/profile/amzn1.account.AEJKJEPX7EF4WKHCVRDPC2QNTECA/ref=cm_cr_getr_d_gw_btm?ie=UTF8,2020-09-28 20:08:03.876199,2020-09-28 20:08:03.999176,Carhartt Men's Midweight Hooded Zip Front Sweatshirt,Carhartt,"7,111",B002G9UDYG,AE3LRCOFYOIXMTUVY7MELWKBDM6A
31,AFNVE3FALVTZ2NJDPS3AZAK4ANTQ,True,Love it,Fantastic sweater,"December 27, 2018",Alyssa Cabby,5.0,0,https://www.amazon.ca/gp/profile/amzn1.account.AFNVE3FALVTZ2NJDPS3AZAK4ANTQ/ref=cm_cr_getr_d_gw_btm?ie=UTF8,2020-09-28 20:08:04.003079,2020-09-28 20:08:04.133863,Carhartt Men's Midweight Hooded Zip Front Sweatshirt,Carhartt,"7,111",B002G9UDYG,AE3LRCOFYOIXMTUVY7MELWKBDM6A
32,AHWEB3BKKCO7H6J3HZ66LC6BWZDA,True,good,good,"July 21, 2020",Peter Douthwaite,4.0,0,https://www.amazon.ca/gp/profile/amzn1.account.AHWEB3BKKCO7H6J3HZ66LC6BWZDA/ref=cm_cr_getr_d_gw_btm?ie=UTF8,2020-09-28 20:08:04.136790,2020-09-28 20:08:04.253913,Carhartt Men's Midweight Hooded Zip Front Sweatshirt,Carhartt,"7,111",B002G9UDYG,AE3LRCOFYOIXMTUVY7MELWKBDM6A
33,AFO6QKK6XQTZ3HISM32TXHQF2VDQ,True,Confortable et chaud lorsqu'il fait froid.,Très confortable mais un peu trop grand.,"December 8, 2018",Amazon Customer,4.0,0,https://www.amazon.ca/gp/profile/amzn1.account.AFO6QKK6XQTZ3HISM32TXHQF2VDQ/ref=cm_cr_getr_d_gw_btm?ie=UTF8,2020-09-28 20:08:04.257815,2020-09-28 20:08:04.386646,Carhartt Men's Midweight Hooded Zip Front Sweatshirt,Carhartt,"7,111",B002G9UDYG,AE3LRCOFYOIXMTUVY7MELWKBDM6A
34,AETJERVCBTQH6BNKU6T2NQUUWD2A,True,Tall not long enough,"Ordered tall fit 6’, Jacket short.","September 24, 2020",Monica ross,5.0,0,https://www.amazon.ca/gp/profile/amzn1.account.AETJERVCBTQH6BNKU6T2NQUUWD2A/ref=cm_cr_getr_d_gw_btm?ie=UTF8,2020-09-28 20:08:04.390550,2020-09-28 20:08:04.505718,Carhartt Men's Midweight Hooded Zip Front Sweatshirt,Carhartt,"7,111",B002G9UDYG,AE3LRCOFYOIXMTUVY7MELWKBDM6A
35,AEMAMEN45ZX3FH5RBEHV5U6YCZTA,True,Not the carthartt quality I prefer,Product arrived with a spot of colour faded directly on the front,"September 13, 2020",wanda ryan,1.0,0,https://www.amazon.ca/gp/profile/amzn1.account.AEMAMEN45ZX3FH5RBEHV5U6YCZTA/ref=cm_cr_getr_d_gw_btm?ie=UTF8,2020-09-28 20:08:04.509622,2020-09-28 20:08:04.624790,Carhartt Men's Midweight Hooded Zip Front Sweatshirt,Carhartt,"7,111",B002G9UDYG,AE3LRCOFYOIXMTUVY7MELWKBDM6A
36,AF5EHPO35RZQPZYATR7O45ALCFUQ,True,"Excellent product, great price!","Overall a great product. Very happy, arrived ahead of schedule.","November 25, 2018",Neil Gibbons,5.0,0,https://www.amazon.ca/gp/profile/amzn1.account.AF5EHPO35RZQPZYATR7O45ALCFUQ/ref=cm_cr_getr_d_gw_btm?ie=UTF8,2020-09-28 20:08:04.628693,2020-09-28 20:08:04.765334,Carhartt Men's Midweight Hooded Zip Front Sweatshirt,Carhartt,"7,111",B002G9UDYG,AE3LRCOFYOIXMTUVY7MELWKBDM6A
37,AHUWIQ7CMBC4OPSY26H2ASEC5VBA,True,Nice Hoodie,Comfortable and warm. HD zipper.,"December 14, 2017",Amazon Customer,5.0,0,https://www.amazon.ca/gp/profile/amzn1.account.AHUWIQ7CMBC4OPSY26H2ASEC5VBA/ref=cm_cr_getr_d_gw_btm?ie=UTF8,2020-09-28 20:08:04.772165,2020-09-28 20:08:04.900021,Carhartt Men's Midweight Hooded Zip Front Sweatshirt,Carhartt,"7,111",B002G9UDYG,AE3LRCOFYOIXMTUVY7MELWKBDM6A
38,AFPF2SOA7PAP5HHE6PG2RA4OCLWQ,True,Three Stars,Thank!,"October 3, 2018",Pat,3.0,0,https://www.amazon.ca/gp/profile/amzn1.account.AFPF2SOA7PAP5HHE6PG2RA4OCLWQ/ref=cm_cr_getr_d_gw_btm?ie=UTF8,2020-09-28 20:08:04.903925,2020-09-28 20:08:05.031780,Carhartt Men's Midweight Hooded Zip Front Sweatshirt,Carhartt,"7,111",B002G9UDYG,AE3LRCOFYOIXMTUVY7MELWKBDM6A
39,AHOQYYV2HF32M2QBIJ3FMGMEM2FQ,True,Great quality,Great quality.,"February 5, 2020",Amazon Customer,5.0,0,https://www.amazon.ca/gp/profile/amzn1.account.AHOQYYV2HF32M2QBIJ3FMGMEM2FQ/ref=cm_cr_getr_d_gw_btm?ie=UTF8,2020-09-28 20:08:05.036661,2020-09-28 20:08:05.152848,Carhartt Men's Midweight Hooded Zip Front Sweatshirt,Carhartt,"7,111",B002G9UDYG,AE3LRCOFYOIXMTUVY7MELWKBDM6A
40,AGSDXLS3VSAS235B6FA65M5N2F3Q,True,Perfect,Great product,"January 1, 2020",Amanda Duplain,5.0,0,https://www.amazon.ca/gp/profile/amzn1.account.AGSDXLS3VSAS235B6FA65M5N2F3Q/ref=cm_cr_getr_d_gw_btm?ie=UTF8,2020-09-28 20:08:07.311678,2020-09-28 20:08:07.437580,Carhartt Men's Midweight Hooded Zip Front Sweatshirt,Carhartt,"7,111",B002G9UDYG,AE3LRCOFYOIXMTUVY7MELWKBDM6A
41,AHONWRACTAEPVE47FBYHQZ2CTSCA,True,Good quality hoodie,Good quality hoodie.,"October 6, 2019",Amazon Customer,5.0,0,https://www.amazon.ca/gp/profile/amzn1.account.AHONWRACTAEPVE47FBYHQZ2CTSCA/ref=cm_cr_getr_d_gw_btm?ie=UTF8,2020-09-28 20:08:07.440508,2020-09-28 20:08:07.555675,Carhartt Men's Midweight Hooded Zip Front Sweatshirt,Carhartt,"7,111",B002G9UDYG,AE3LRCOFYOIXMTUVY7MELWKBDM6A
42,AFUR7QNAENVHXRQ5YQ7L6N5DQWGA,True,Five Stars,Great price and quality!,"August 29, 2018",rocket princess,5.0,0,https://www.amazon.ca/gp/profile/amzn1.account.AFUR7QNAENVHXRQ5YQ7L6N5DQWGA/ref=cm_cr_getr_d_gw_btm?ie=UTF8,2020-09-28 20:08:07.559579,2020-09-28 20:08:07.684507,Carhartt Men's Midweight Hooded Zip Front Sweatshirt,Carhartt,"7,111",B002G9UDYG,AE3LRCOFYOIXMTUVY7MELWKBDM6A
43,AG5STMAU7K7OMTHYU6GCNNBLCTUA,True,Great quality,Great quality fits a bit large,"March 10, 2019",Amazon Customer,5.0,0,https://www.amazon.ca/gp/profile/amzn1.account.AG5STMAU7K7OMTHYU6GCNNBLCTUA/ref=cm_cr_getr_d_gw_btm?ie=UTF8,2020-09-28 20:08:07.688411,2020-09-28 20:08:07.806507,Carhartt Men's Midweight Hooded Zip Front Sweatshirt,Carhartt,"7,111",B002G9UDYG,AE3LRCOFYOIXMTUVY7MELWKBDM6A
44,AH2IHLYF6YOP5BVJUCQPXQNDDQMA,False,Quality hoodie for a reasonable price,"I bought one of these a few years ago, wear it all the time, and its still in good condition. If you consider the longevity of these products they are definitely worth paying a little more for. I just bought a second one.","January 19, 2019",Amazon Customer,5.0,0,https://www.amazon.ca/gp/profile/amzn1.account.AH2IHLYF6YOP5BVJUCQPXQNDDQMA/ref=cm_cr_getr_d_gw_btm?ie=UTF8,2020-09-28 20:08:07.809434,2020-09-28 20:08:07.918747,Carhartt Men's Midweight Hooded Zip Front Sweatshirt,Carhartt,"7,111",B002G9UDYG,AE3LRCOFYOIXMTUVY7MELWKBDM6A
