,author_id,date_review_posted,review_title,reviews,verified_purchase,people_find_helpful,ratings,product_url,start,end,reviewer_name,product_category,product_id
0,AEL2VWAASBDPV3WI77CQUCZUDH5Q,"December 28, 2019",Good quality...,Good quality toque.,yes,0,5.0,https://www.amazon.ca/Carhartt-Acrylic-Watch-Black-Size/dp/B002G9UDYG/ref=cm_cr_srp_d_product_top?ie=UTF8,2020-09-29 17:31:43.183223,2020-09-29 17:31:50.451218,JLD,Clothing & Accessories,B002G9UDYG
1,AEL2VWAASBDPV3WI77CQUCZUDH5Q,"December 4, 2019",A nice way...,A nice way to work on sorting shapes and colours. 2 year old niece loved putting them back where they were supposed to go and naming their colours.,yes,0,5.0,https://www.amazon.ca/Melissa-Doug-Colorful-Wooden-Chunky/dp/B06XH1NZN6/ref=cm_cr_srp_d_product_top?ie=UTF8,2020-09-29 17:32:00.548265,2020-09-29 17:32:07.837558,JLD,Clothing & Accessories,B002G9UDYG
2,AEL2VWAASBDPV3WI77CQUCZUDH5Q,"November 12, 2019",Perfect little spoons...,Perfect little spoons for feeding a baby.,yes,0,5.0,https://www.amazon.ca/Munchkin-10062-Soft-Tip-Infant-6-Pack/dp/B000LSL5ZK/ref=cm_cr_srp_d_product_top?ie=UTF8,2020-09-29 17:32:15.935336,2020-09-29 17:32:25.155329,JLD,Clothing & Accessories,B002G9UDYG
3,AEL2VWAASBDPV3WI77CQUCZUDH5Q,"November 12, 2019",These are...,These are good quality socks. Great for work.,yes,0,5.0,https://www.amazon.ca/Dickies-Dri-Tech-Comfort-Socks-Black/dp/B004QF0TFQ/ref=cm_cr_srp_d_product_top?ie=UTF8,2020-09-29 17:32:34.246552,2020-09-29 17:32:40.552995,JLD,Clothing & Accessories,B002G9UDYG
4,AEL2VWAASBDPV3WI77CQUCZUDH5Q,"November 12, 2019",These work great,These work great!! Highly reccomend these if you are cleaning metal bottles. It got rid of all the staining and the slight metallic smell that had developed.,yes,0,5.0,https://www.amazon.ca/Bottle-Bright-Biodegradable-Chlorine-Free-Odor-Free/dp/B06XYCVDB9/ref=cm_cr_srp_d_product_top?ie=UTF8,2020-09-29 17:32:49.657228,2020-09-29 17:32:56.972220,JLD,Clothing & Accessories,B002G9UDYG
5,AEL2VWAASBDPV3WI77CQUCZUDH5Q,"November 12, 2019",These were...,These were good quality! Much better than I anticipated for the price and they fit perfectly in tiny hands!,yes,0,5.0,https://www.amazon.ca/Sanei-Stackable-Animal-Stuffed-Plush-Crocodile/dp/B01MYXTADE/ref=cm_cr_srp_d_product_top?ie=UTF8,2020-09-29 17:33:06.055213,2020-09-29 17:33:13.320852,JLD,Clothing & Accessories,B002G9UDYG
6,AEL2VWAASBDPV3WI77CQUCZUDH5Q,"November 12, 2019",I'm not sure...,"I'm not sure if I got a one off or if this is how the sweater fits but it was a strange fit. The mid section was really loose and baggy, the sleeves were on the shorter length, and it was quite short.",yes,0,3.0,https://www.amazon.ca/Hanes-Pullover-EcoSmart-Fleece-Sweatshirt/dp/B072K69L61/ref=cm_cr_srp_d_product_top?ie=UTF8,2020-09-29 17:33:21.418100,2020-09-29 17:33:28.678072,JLD,Clothing & Accessories,B002G9UDYG
7,AEL2VWAASBDPV3WI77CQUCZUDH5Q,"October 17, 2019",I bought a...,"I bought a size 0-6 and 6-12 as I wasn't sure how it would fit. My daughter is 6 months and I find the 0-6 to just fit her. She is pretty much an average size 6 month old. I am returning the smaller size and keeping the larger one so she has a bit more room. It is super soft and cozy. Definitely look at their size guide as it will give you a good reference for their sizing.
I received a follow up email from the company in regards to my recently placed order. Great customer service!",yes,0,5.0,https://www.amazon.ca/Tonwhar-Babys-Comfy-Totoro-Costume/dp/B01H050APC/ref=cm_cr_srp_d_product_top?ie=UTF8,2020-09-29 17:33:38.778394,2020-09-29 17:33:48.055751,JLD,Clothing & Accessories,B002G9UDYG
8,AEL2VWAASBDPV3WI77CQUCZUDH5Q,"October 17, 2019",My daughter...,My daughter loves to bounce so this is perfect. It is so fun watching her go.,no,0,5.0,https://www.amazon.ca/Jolly-Jumper-108-with-Stand/dp/B000JPYEJY/ref=cm_cr_srp_d_product_top?ie=UTF8,2020-09-29 17:33:56.147094,2020-09-29 17:34:05.422884,JLD,Clothing & Accessories,B002G9UDYG
9,AEL2VWAASBDPV3WI77CQUCZUDH5Q,"October 17, 2019",My package had...,My package had labels and funnel included. One label for cinnamon is spelled wrong but doesn't bother me as I don't plan on using those labels. Good jars and the best price I could find for the quantity.,yes,3,5.0,https://www.amazon.ca/Tebery-Capacity-Silver-Shaker-Labels/dp/B07B1XHRT6/ref=cm_cr_srp_d_product_top?ie=UTF8,2020-09-29 17:34:12.518899,2020-09-29 17:34:20.812030,JLD,Clothing & Accessories,B002G9UDYG
10,AEL2VWAASBDPV3WI77CQUCZUDH5Q,"October 7, 2019",Not a bad...,"Not a bad thin cotton legging for the price, although it pilled right away.",yes,0,4.0,https://www.amazon.ca/Hanes-Womens-Stretch-Legging-X-Large/dp/B01I21GX2W/ref=cm_cr_srp_d_product_top?ie=UTF8,2020-09-29 17:34:28.912455,2020-09-29 17:34:36.153988,JLD,Clothing & Accessories,B002G9UDYG
11,AEL2VWAASBDPV3WI77CQUCZUDH5Q,"October 7, 2019",A bit...,A bit bigger than expected. Also the colour was darker than what is pictured.,yes,0,4.0,https://www.amazon.ca/Goodthreads-Standard-Fit-Short-Sleeve-Oxford-X-Large/dp/B07735NQR9/ref=cm_cr_srp_d_product_top?ie=UTF8,2020-09-29 17:34:43.248409,2020-09-29 17:34:49.551782,JLD,Clothing & Accessories,B002G9UDYG
12,AEL2VWAASBDPV3WI77CQUCZUDH5Q,"October 7, 2019",At first...,At first I was quite pleased with these. They are nice and strong and work well with thick hair. I was disappointed when one broke after less than a month.,yes,0,3.0,https://www.amazon.ca/Revlon-Strong-Hold-Clips-Count/dp/B01E6UJTGU/ref=cm_cr_srp_d_product_top?ie=UTF8,2020-09-29 17:34:59.646967,2020-09-29 17:35:07.906017,JLD,Clothing & Accessories,B002G9UDYG
13,AEL2VWAASBDPV3WI77CQUCZUDH5Q,"October 7, 2019",Great,Great decorations,yes,0,5.0,https://www.amazon.ca/Harry-Potter-Party-Decoration-Kit/dp/B06W2KKPGC/ref=cm_cr_srp_d_product_top?ie=UTF8,2020-09-29 17:35:18.007622,2020-09-29 17:35:24.281913,JLD,Clothing & Accessories,B002G9UDYG
14,AEL2VWAASBDPV3WI77CQUCZUDH5Q,"October 7, 2019",Nice simple,Nice simple brown leather belt.,yes,0,5.0,https://www.amazon.ca/Gurscour-Belts-Dress-Leather-Width/dp/B078LWB1V2/ref=cm_cr_srp_d_product_top?ie=UTF8,2020-09-29 17:35:33.374314,2020-09-29 17:35:41.645962,JLD,Clothing & Accessories,B002G9UDYG
15,AEL2VWAASBDPV3WI77CQUCZUDH5Q,"October 7, 2019",Fit a bit bigger,Fit a bit bigger than expected. It's a decent quality.,yes,0,4.0,https://www.amazon.ca/Goodthreads-Slim-Fit-Long-Sleeve-Chambray-X-Large/dp/B0773BLZRH/ref=cm_cr_srp_d_product_top?ie=UTF8,2020-09-29 17:35:51.739693,2020-09-29 17:36:01.022584,JLD,Clothing & Accessories,B002G9UDYG
16,AEL2VWAASBDPV3WI77CQUCZUDH5Q,"October 7, 2019",Great socks,Great socks. They keep their elasticy after many wears and washes,yes,0,5.0,https://www.amazon.ca/Hanes-Mens-Champion-Performance-White/dp/B075X6MC2H/ref=cm_cr_srp_d_product_top?ie=UTF8,2020-09-29 17:36:09.109355,2020-09-29 17:36:18.376414,JLD,Clothing & Accessories,B002G9UDYG
17,AEL2VWAASBDPV3WI77CQUCZUDH5Q,"October 7, 2019",Great high chair...,Great high chair for the price. Super easy to clean.,yes,0,5.0,https://www.amazon.ca/Ingenuity-Trio-Elite-High-Chair/dp/B07FTWYFYQ/ref=cm_cr_srp_d_product_top?ie=UTF8,2020-09-29 17:36:25.467182,2020-09-29 17:36:34.769372,JLD,Clothing & Accessories,B002G9UDYG
18,AEL2VWAASBDPV3WI77CQUCZUDH5Q,"October 7, 2019",My cats like...,My cats like them but I wish I had looked at the ingredients first as wheat is the second ingredient and I'm trying to get away from that.,yes,0,4.0,https://www.amazon.ca/Greenies-Dental-Treats-for-Cats/dp/B008PNN8C6/ref=cm_cr_srp_d_product_top?ie=UTF8,2020-09-29 17:36:44.853393,2020-09-29 17:36:52.124922,JLD,Clothing & Accessories,B002G9UDYG
19,AEL2VWAASBDPV3WI77CQUCZUDH5Q,"October 7, 2019",Good quality,Good quality. Fit as expected.,yes,0,5.0,https://www.amazon.ca/Simple-Joys-Carters-4-Pack-Months/dp/B01MRDV6RU/ref=cm_cr_srp_d_product_top?ie=UTF8,2020-09-29 17:37:01.219080,2020-09-29 17:37:10.485426,JLD,Clothing & Accessories,B002G9UDYG
20,AEL2VWAASBDPV3WI77CQUCZUDH5Q,"October 7, 2019",Cute good...,Cute good quality pants. Fit as expected for size.,yes,0,5.0,https://www.amazon.ca/Simple-Joys-Carters-4-Pack-Newborn/dp/B01M8QGDTB/ref=cm_cr_srp_d_product_top?ie=UTF8,2020-09-29 17:37:18.575404,2020-09-29 17:37:25.846465,JLD,Clothing & Accessories,B002G9UDYG
21,AEL2VWAASBDPV3WI77CQUCZUDH5Q,"October 7, 2019",Great case...,Great case for the price. A bit of glare from the screen protector in certain light but for the protection it offers it's worth it. Definitely reccomend.,yes,0,5.0,https://www.amazon.ca/YOUMAKER-Protection-Kickstand-Protector-Shockproof/dp/B07CK3BV9D/ref=cm_cr_srp_d_product_top?ie=UTF8,2020-09-29 17:37:34.931660,2020-09-29 17:37:44.198132,JLD,Clothing & Accessories,B002G9UDYG
22,AEL2VWAASBDPV3WI77CQUCZUDH5Q,"October 7, 2019",I've had this...,I've had this case for two months and it has been doing a great job. I drop my phone on a daily basis so this case is a life saver. The screen protector has some minor scratches but I am not the easiest on my phone! In certain sunlight there is a bit of a glare from the protector but it's not that bad. Worth the protection of the screen. Also it is a great price!,yes,0,5.0,https://www.amazon.ca/SUPCASE-Kickstand-Protector-Shockproof-Samsung/dp/B07DWLBLTK/ref=cm_cr_srp_d_product_top?ie=UTF8,2020-09-29 17:37:52.292288,2020-09-29 17:38:00.563081,JLD,Clothing & Accessories,B002G9UDYG
23,AEL2VWAASBDPV3WI77CQUCZUDH5Q,"October 7, 2019",Lots of different...,Lots of different textures for them to chew on. Easy for little hands to hold as well.,yes,0,5.0,https://www.amazon.ca/Baby-Teething-Toys-Pacifier-Non-Toxic/dp/B07BYT5R5Z/ref=cm_cr_srp_d_product_top?ie=UTF8,2020-09-29 17:38:07.658135,2020-09-29 17:38:15.923063,JLD,Clothing & Accessories,B002G9UDYG
24,AEL2VWAASBDPV3WI77CQUCZUDH5Q,"October 7, 2019",Great...,Great tasting chip,yes,0,5.0,https://www.amazon.ca/Kettle-Chips-Honey-Dijon-Gram/dp/B00QJRMCEK/ref=cm_cr_srp_d_product_top?ie=UTF8,2020-09-29 17:38:25.018985,2020-09-29 17:38:32.272186,JLD,Clothing & Accessories,B002G9UDYG
25,AEL2VWAASBDPV3WI77CQUCZUDH5Q,"October 7, 2019",Basic but great,Got it half price during prime days so can't beat that price. Most basic model but does it's job well.,no,0,5.0,https://www.amazon.ca/Keurig-Compact-Brewing-System-Black/dp/B071FQS4TM/ref=cm_cr_srp_d_product_top?ie=UTF8,2020-09-29 17:38:40.365766,2020-09-29 17:38:49.630181,JLD,Clothing & Accessories,B002G9UDYG
26,AEL2VWAASBDPV3WI77CQUCZUDH5Q,"October 7, 2019",Love it,Looked great. I wasn't expecting to have to string it together myself but that wasn't a big deal.,yes,0,5.0,https://www.amazon.ca/MZYARD-Harry-Potter-Party-Supplies/dp/B07WFDFY83/ref=cm_cr_srp_d_product_top?ie=UTF8,2020-09-29 17:38:57.721274,2020-09-29 17:39:03.984047,JLD,Clothing & Accessories,B002G9UDYG
27,AEL2VWAASBDPV3WI77CQUCZUDH5Q,"October 7, 2019",Good shoes,Fit good for size. Comfortable.,yes,0,5.0,https://www.amazon.ca/Adidas-ORIGINALS-Gazelle-Sneakers-Footwear/dp/B07J2F26NG/ref=cm_cr_srp_d_product_top?ie=UTF8,2020-09-29 17:39:12.078513,2020-09-29 17:39:18.365723,JLD,Clothing & Accessories,B002G9UDYG
28,AEL2VWAASBDPV3WI77CQUCZUDH5Q,"October 7, 2019",Great bibs,I like that these do up on the side. Super easy to clean. Food wipes off and if things get really messy just a bit of warm water and soap does the trick.,yes,0,5.0,https://www.amazon.ca/Bumkins-Waterproof-SuperBib-Umbrella-Raindrop/dp/B01A628THW/ref=cm_cr_srp_d_product_top?ie=UTF8,2020-09-29 17:39:25.459090,2020-09-29 17:39:33.742148,JLD,Clothing & Accessories,B002G9UDYG
29,AEL2VWAASBDPV3WI77CQUCZUDH5Q,"September 7, 2019",Great for pumping,The first time worn the plastic clip snapped. Refunded with no issue and haven't had that happen with the second one. Great for pumping but not for breast feeding.,yes,0,4.0,https://www.amazon.ca/Momcozy-Adjustable-Suitable-Breast-Pumps-Lansinoh/dp/B07QG77VLN/ref=cm_cr_srp_d_product_top?ie=UTF8,2020-09-29 17:39:40.838971,2020-09-29 17:39:49.112647,JLD,Clothing & Accessories,B002G9UDYG
30,AEL2VWAASBDPV3WI77CQUCZUDH5Q,"September 7, 2019",A nice lightweight short,Great for in the heat or for being active. Very breathable.,yes,0,5.0,https://www.amazon.ca/Under-Armour-Shorts-Black-Graphite/dp/B00KWKD3YI/ref=cm_cr_srp_d_product_top?ie=UTF8,2020-09-29 17:39:56.205279,2020-09-29 17:40:04.491578,JLD,Clothing & Accessories,B002G9UDYG
31,AEL2VWAASBDPV3WI77CQUCZUDH5Q,"September 7, 2019",Good quality,I bought newborn for my nephew who is about 6lb 9oz and it fit great. Still some room to grow into.,yes,0,5.0,https://www.amazon.ca/Simple-Joys-Carters-6-Piece-Character/dp/B01M3Y325C/ref=cm_cr_srp_d_product_top?ie=UTF8,2020-09-29 17:40:12.584507,2020-09-29 17:40:18.857214,JLD,Clothing & Accessories,B002G9UDYG
32,AEL2VWAASBDPV3WI77CQUCZUDH5Q,"September 7, 2019",Super cute,I bought the newborn size and it fit my 6lb 12oz perfectly with a little room to grow.,yes,0,5.0,https://www.amazon.ca/Simple-Joys-Carters-6-Piece-Character/dp/B01MSM0UMR/ref=cm_cr_srp_d_product_top?ie=UTF8,2020-09-29 17:40:27.953747,2020-09-29 17:40:36.228067,JLD,Clothing & Accessories,B002G9UDYG
33,AEL2VWAASBDPV3WI77CQUCZUDH5Q,"September 7, 2019",Great workout shirt,My husband loves it. Light weight and very comfortable. Also very breathable,yes,0,5.0,https://www.amazon.ca/Under-Armour-Sleeve-Artillery-X-Large/dp/B077XLVGBQ/ref=cm_cr_srp_d_product_top?ie=UTF8,2020-09-29 17:40:46.317456,2020-09-29 17:40:55.596620,JLD,Clothing & Accessories,B002G9UDYG
34,AEL2VWAASBDPV3WI77CQUCZUDH5Q,"July 25, 2019",Great dress for the price,I love this dress. Nice and light and fits well! I wish I had read the reviews before buying because I didn't size down and I had to exchange for a smaller size.,yes,One,5.0,https://www.amazon.ca/Amazon-Essentials-Womens-Solid-Surplice/dp/B07JMVR485/ref=cm_cr_srp_d_product_top?ie=UTF8,2020-09-29 17:41:04.690127,2020-09-29 17:41:11.968188,JLD,Clothing & Accessories,B002G9UDYG
35,AEL2VWAASBDPV3WI77CQUCZUDH5Q,"July 19, 2019",Great buy,They were a cute Halloween costume/baby announcement. Sizing was accurate.,yes,0,5.0,https://www.amazon.ca/Halloween-Skeleton-Maternity-Matching-Couples/dp/B07FSDPT3T/ref=cm_cr_srp_d_product_top?ie=UTF8,2020-09-29 17:41:19.051090,2020-09-29 17:41:27.294249,JLD,Clothing & Accessories,B002G9UDYG
36,AEL2VWAASBDPV3WI77CQUCZUDH5Q,"July 19, 2019",Great gift idea,My niece was thrilled with this. Inexpensive but a great gift for a child who likes hot wheels.,yes,One,5.0,https://www.amazon.ca/Hot-Wheels-CKC09-Mega-Hauler/dp/B00RYZR3SG/ref=cm_cr_srp_d_product_top?ie=UTF8,2020-09-29 17:41:34.384201,2020-09-29 17:41:43.653485,JLD,Clothing & Accessories,B002G9UDYG
37,AEL2VWAASBDPV3WI77CQUCZUDH5Q,"July 19, 2019",Recommended,Makes a great gift for little $,yes,0,5.0,https://www.amazon.ca/Hot-Wheels-Gift-Pack-Styles/dp/B002ZCZ0F6/ref=cm_cr_srp_d_product_top?ie=UTF8,2020-09-29 17:41:51.747512,2020-09-29 17:41:58.031959,JLD,Clothing & Accessories,B002G9UDYG
38,AEL2VWAASBDPV3WI77CQUCZUDH5Q,"July 19, 2019",Great cost efficient gift,Makes a great gift and very affordable.,yes,0,5.0,https://www.amazon.ca/Hot-Wheels-10-Car-Pack-Styles-Vary/dp/B000B6MKMO/ref=cm_cr_srp_d_product_top?ie=UTF8,2020-09-29 17:42:05.117953,2020-09-29 17:42:14.384405,JLD,Clothing & Accessories,B002G9UDYG
39,AEL2VWAASBDPV3WI77CQUCZUDH5Q,"July 19, 2019",Good quality,They feel like good quality and they're comfy.,no,0,5.0,https://www.amazon.ca/Calvin-Klein-Stretch-Heather-X-Large/dp/B017QFA0TC/ref=cm_cr_srp_d_product_top?ie=UTF8,2020-09-29 17:42:23.476289,2020-09-29 17:42:32.737807,JLD,Clothing & Accessories,B002G9UDYG
40,AEL2VWAASBDPV3WI77CQUCZUDH5Q,"July 19, 2019",Great flavour!,Has a great flavour. Used this in my beef jerky marinade and it was awesome!,yes,0,5.0,https://www.amazon.ca/Stubbs-Hickory-Liquid-Smoke-148ml/dp/B0011BPCVO/ref=cm_cr_srp_d_product_top?ie=UTF8,2020-09-29 17:42:42.831841,2020-09-29 17:42:50.093690,JLD,Clothing & Accessories,B002G9UDYG
41,AEL2VWAASBDPV3WI77CQUCZUDH5Q,"July 19, 2019",Great water bottle,Nice and sturdy water bottle. Already dropped it once and not even a scratch! A bit of a bigger bottle especially at the bottom (won't fit in my car's cup holders) but that's not a deal breaker for me. I love the bright colour!,yes,0,5.0,https://www.amazon.ca/Contigo-AUTOSPOUT-Ashland-Bottle-Sangria/dp/B01D67AB52/ref=cm_cr_srp_d_product_top?ie=UTF8,2020-09-29 17:42:59.180749,2020-09-29 17:43:06.486069,JLD,Clothing & Accessories,B002G9UDYG
42,AEL2VWAASBDPV3WI77CQUCZUDH5Q,"July 19, 2019",Cute style but completely see through.,I liked the cut but it was completely see through. Ordered the large and fit as expected.,yes,0,3.0,https://www.amazon.ca/Amazon-Essentials-Relaxed-Fit-Lightweight-Crewneck/dp/B07FFRW7L8/ref=cm_cr_srp_d_product_top?ie=UTF8,2020-09-29 17:43:15.581382,2020-09-29 17:43:22.849464,JLD,Clothing & Accessories,B002G9UDYG
43,AEL2VWAASBDPV3WI77CQUCZUDH5Q,"July 15, 2019",Fun craft,Bought for my 6 year old niece and she loved it. A fun little craft and perfect for her age!,yes,0,5.0,https://www.amazon.ca/Melissa-Doug-9582-Magnets-Stickers/dp/B0794TN3Z6/ref=cm_cr_srp_d_product_top?ie=UTF8,2020-09-29 17:43:29.943591,2020-09-29 17:43:38.237692,JLD,Clothing & Accessories,B002G9UDYG
44,AEL2VWAASBDPV3WI77CQUCZUDH5Q,"June 22, 2019",Fun socks,Quality is good.,yes,0,5.0,https://www.amazon.ca/Good-Luck-Sock-Orange-Riding/dp/B01CDFD1MI/ref=cm_cr_srp_d_product_top?ie=UTF8,2020-09-29 17:43:46.326129,2020-09-29 17:43:53.592544,JLD,Clothing & Accessories,B002G9UDYG
45,AEL2VWAASBDPV3WI77CQUCZUDH5Q,"June 22, 2019",Not the best,I found these didn't stay in place. The silicone would move in my shoe.,yes,0,3.0,https://www.amazon.ca/Changeshopping-Corrector-Protector-Straightener-Separator/dp/B013WAVENG/ref=cm_cr_srp_d_product_top?ie=UTF8,2020-09-29 17:44:03.688504,2020-09-29 17:44:11.955363,JLD,Clothing & Accessories,B002G9UDYG
46,AEL2VWAASBDPV3WI77CQUCZUDH5Q,"June 22, 2019",Nice simple hoody.,Nice thin hoody. Exactly what I was looking for.,yes,0,5.0,https://www.amazon.ca/Fruit-Loom-Hooded-Sweatshirt-X-Large/dp/B0196XAIF8/ref=cm_cr_srp_d_product_top?ie=UTF8,2020-09-29 17:44:22.045483,2020-09-29 17:44:29.320346,JLD,Clothing & Accessories,B002G9UDYG
47,AEL2VWAASBDPV3WI77CQUCZUDH5Q,"June 22, 2019",Good quality,A little bit bigger than expected but that's ok. Otherwise came exactly as pictured. Quality is good.,yes,0,5.0,https://www.amazon.ca/Tstars-Screwed-Grandpa-T-Shirt-X-Large/dp/B01ALB2ITS/ref=cm_cr_srp_d_product_top?ie=UTF8,2020-09-29 17:44:38.411200,2020-09-29 17:44:47.674237,JLD,Clothing & Accessories,B002G9UDYG
48,AEL2VWAASBDPV3WI77CQUCZUDH5Q,"June 22, 2019",Cute,Cute book for dad and baby to read together.,yes,0,5.0,https://www.amazon.ca/Your-Babys-First-Word-Will/dp/1250009340/ref=cm_cr_srp_d_product_top?ie=UTF8,2020-09-29 17:44:57.768643,2020-09-29 17:45:04.063142,JLD,Clothing & Accessories,B002G9UDYG
49,AEL2VWAASBDPV3WI77CQUCZUDH5Q,"June 9, 2019",Great swing!,I love this swing! The options it has are great.,no,0,5.0,https://www.amazon.ca/Fisher-Price-Sweet-Snugapuppy-Dreams-Cradle/dp/B01MQM7W6M/ref=cm_cr_srp_d_product_top?ie=UTF8,2020-09-29 17:45:14.143328,2020-09-29 17:45:22.425352,JLD,Clothing & Accessories,B002G9UDYG
50,AEL2VWAASBDPV3WI77CQUCZUDH5Q,"May 22, 2019",5 stars,Great product all around,yes,0,5.0,https://www.amazon.ca/Samsung-Charger-Soulen-High-Speed-Braided/dp/B07GGHXDCY/ref=cm_cr_srp_d_product_top?ie=UTF8,2020-09-29 17:45:30.524221,2020-09-29 17:45:39.810862,JLD,Clothing & Accessories,B002G9UDYG
51,AEL2VWAASBDPV3WI77CQUCZUDH5Q,"May 22, 2019",Happy with product,Heats up to a good temperature.,yes,0,5.0,https://www.amazon.ca/Sunbeam-Standard-Heating-Arthritic-Controller/dp/B00942VULI/ref=cm_cr_srp_d_product_top?ie=UTF8,2020-09-29 17:45:48.908243,2020-09-29 17:45:57.149797,JLD,Clothing & Accessories,B002G9UDYG
52,AEL2VWAASBDPV3WI77CQUCZUDH5Q,"May 13, 2019",Highly recommend,Two year old niece loves this! Really good quality and keeps her entertained.,yes,0,5.0,https://www.amazon.ca/Melissa-Doug-Latches-Wooden-Activity/dp/B0026ZPTYY/ref=cm_cr_srp_d_product_top?ie=UTF8,2020-09-29 17:46:07.234428,2020-09-29 17:46:14.512042,JLD,Clothing & Accessories,B002G9UDYG
53,AEL2VWAASBDPV3WI77CQUCZUDH5Q,"May 13, 2019",Recommended,No issues with the graphic cracking after being washed and dried. Fit good.,yes,0,5.0,https://www.amazon.ca/TeeStars-Strong-Novelty-Bodysuit-Onesie/dp/B00YX9XCHM/ref=cm_cr_srp_d_product_top?ie=UTF8,2020-09-29 17:46:22.604414,2020-09-29 17:46:29.890746,JLD,Clothing & Accessories,B002G9UDYG
54,AEL2VWAASBDPV3WI77CQUCZUDH5Q,"May 13, 2019",Good quality,Exactly as pictured. Reusable which is nice.,yes,0,5.0,https://www.amazon.ca/Oversize-Calendar-Birthday-15%C3%A2%E2%82%AC%EF%BF%BDx72%C3%A2%E2%82%AC%EF%BF%BD-Decoration/dp/B079Z13CD8/ref=cm_cr_srp_d_product_top?ie=UTF8,2020-09-29 17:46:37.984643,2020-09-29 17:46:46.229874,JLD,Clothing & Accessories,B002G9UDYG
55,AEL2VWAASBDPV3WI77CQUCZUDH5Q,"March 14, 2019",Great quality,I bought this in Feb and have used daily to bounce on with my newborn to soothe her back to sleep. I haven't had to add air to it once.,yes,0,5.0,https://www.amazon.ca/Exercise-Professional-Equipment-Supports-2200lbs/dp/B01MU0BI2H/ref=cm_cr_srp_d_product_top?ie=UTF8,2020-09-29 17:46:54.318822,2020-09-29 17:47:00.554910,JLD,Clothing & Accessories,B002G9UDYG
