,author_id,date_review_posted,review_title,reviews,verified_purchase,people_find_helpful,ratings,product_url,start,end,reviewer_name,product_category,product_id
0,AEYPUHKUFYNXNOYWLXKLRYHOL4FQ,"October 8, 2017",The colour is nice and vibrant,"The colour is nice and vibrant. I like the soft texture. A few keys on the keyboard cover aren't sitting exactly over the keys. The top piece of the case doesn't quite fit over, it stays on but doesn't latch on (I have macbook pro 15""). Makes the laptop feel SO heavy, I was shocked.",yes,One,3.0,https://www.amazon.ca/Rubberized-Silicone-Generation-Macbook-Cover-Aqua/dp/B01LXHJ1FI/ref=cm_cr_srp_d_product_top?ie=UTF8,2020-09-30 13:38:50.106347,2020-09-30 13:38:58.552194,Amazon Customer,Clothing & Accessories,B002G9UDYG
1,AEYPUHKUFYNXNOYWLXKLRYHOL4FQ,"October 8, 2017",Disappointed that I've only used it a handful of times ...,Disappointed that I've only used it a handful of times and it's stopped working with my USB to wall charger box which is the Apple brand.,yes,0,1.0,https://www.amazon.ca/dp/B07415N1YG/ref=cm_cr_srp_d_product_top?ie=UTF8,2020-09-30 13:39:07.683446,2020-09-30 13:39:14.141978,Amazon Customer,Clothing & Accessories,B002G9UDYG
2,AEYPUHKUFYNXNOYWLXKLRYHOL4FQ,"October 8, 2017",It's a nice hat but there's too much fabric on the top,"It's a nice hat but there's too much fabric on the top, it sticks up and looks funny. We're going to cut the top and sew it back to make it a normal size.",no,0,3.0,https://www.amazon.ca/Carhartt-Acrylic-Watch-Black-Size/dp/B002G9UDYG/ref=cm_cr_srp_d_product_top?ie=UTF8,2020-09-30 13:39:24.256968,2020-09-30 13:39:33.668111,Amazon Customer,Clothing & Accessories,B002G9UDYG
3,AEYPUHKUFYNXNOYWLXKLRYHOL4FQ,"September 25, 2017",Good quality water bottle,"Good quality water bottle. Compared to my stainless steel water bottle I notice how quickly my water gets warm in this one. Even with ice cubes, they're gone soon after putting them in. The smaller hole for drinking is convenient but it doesn't come out as a smooth flow as I had read in other comments. Arrived on time, in new packaging. If you're looking for a standard water bottle, this may be it! Main reason I chose this one was for cute colours.",yes,0,4.0,https://www.amazon.ca/Nathan-Shot-1-Liter-Bottle-Light/dp/B00MN9XFQW/ref=cm_cr_srp_d_product_top?ie=UTF8,2020-09-30 13:39:43.783006,2020-09-30 13:39:50.214965,Amazon Customer,Clothing & Accessories,B002G9UDYG
4,AEYPUHKUFYNXNOYWLXKLRYHOL4FQ,"December 30, 2016",Perhaps I'm just sensitive but they did make me want ...,"Perhaps I'm just sensitive but they did make me want to gag while I wore them. It was hard to keep them in for so long without them sliding around on my teeth because of saliva. When you take them out, you can see where it wasn't properly stuck to your teeth and where the bubbles were because some parts of your teeth are more white than others.",yes,0,3.0,https://www.amazon.ca/Whitestrips-Onuge-Lovely-Professional-Quality/dp/B00SGBTOYI/ref=cm_cr_srp_d_product_top?ie=UTF8,2020-09-30 13:39:57.325810,2020-09-30 13:40:05.751103,Amazon Customer,Clothing & Accessories,B002G9UDYG
5,AEYPUHKUFYNXNOYWLXKLRYHOL4FQ,"December 30, 2016",Would not purchase again.,"The tempered glass screen protector that came with it never adhered to my phone correctly so I was left with large spots on both top corners of my screen. The case itself isn't too bad, although easy to crack. It does make your phone nice and slim and looks well covered, although I do have scratches on the back of my phone now from dirt getting in. Overall, cheap quality and not very satisfied. I've since changed to a commuter otterbox and love it.",yes,0,2.0,https://www.amazon.ca/MagicMobile-Protective-Shockproof-Anti-Scratch-Polycarbonate/dp/B01F2JB3GS/ref=cm_cr_srp_d_product_top?ie=UTF8,2020-09-30 13:40:13.873634,2020-09-30 13:40:23.265522,Amazon Customer,Clothing & Accessories,B002G9UDYG
6,AEYPUHKUFYNXNOYWLXKLRYHOL4FQ,"December 30, 2016","Fits nicely, looks great and is of good quality","I bought this as a gift for my boyfriend and he loves it! Fits nicely, looks great and is of good quality. I would recommend for fellow john deere lovers!",yes,0,5.0,https://www.amazon.ca/John-Deere-Contrast-Baseball-Size/dp/B00BFRZIPO/ref=cm_cr_srp_d_product_top?ie=UTF8,2020-09-30 13:40:31.374374,2020-09-30 13:40:38.807467,Amazon Customer,Clothing & Accessories,B002G9UDYG
