,author_id,date_review_posted,review_title,reviews,verified_purchase,people_find_helpful,ratings,product_url,start,end,reviewer_name,product_category,product_id
0,AHJASOP34KG4NUZZ6MYTL2SDLILQ,"December 2, 2019",emm....,"didn't expect a lot from it, overall it was ok, given the price;
but my eyes feel swell and sore when I wore them for a long time",yes,0,3.0,https://www.amazon.ca/CGID-Blocking-glasses-Computer-Transparent/dp/B07DNSHLQ9/ref=cm_cr_srp_d_product_top?ie=UTF8,2020-09-30 01:54:30.242391,2020-09-30 01:54:36.591972,Ming,Clothing & Accessories,B002G9UDYG
1,AHJASOP34KG4NUZZ6MYTL2SDLILQ,"December 2, 2019",durable,"used for couple months now, i like the patterns and they are pretty durable, would be wonderful if it was cheaper haha",yes,0,5.0,https://www.amazon.ca/BLUETTEK-Summer-Cactus-Decorative-Bedroom/dp/B07D5GZ24L/ref=cm_cr_srp_d_product_top?ie=UTF8,2020-09-30 01:54:46.685737,2020-09-30 01:54:56.042429,Ming,Clothing & Accessories,B002G9UDYG
2,AHJASOP34KG4NUZZ6MYTL2SDLILQ,"December 2, 2019",VERY useful,"bought it for lichen ID, it's very useful and easy to bring too, i used it so often that i had to change batteries frequently",yes,0,4.0,https://www.amazon.ca/SE-MJ37801L-Illuminated-Jewelers-Professional/dp/B002E0MU7U/ref=cm_cr_srp_d_product_top?ie=UTF8,2020-09-30 01:55:06.140061,2020-09-30 01:55:12.441874,Ming,Clothing & Accessories,B002G9UDYG
3,AHJASOP34KG4NUZZ6MYTL2SDLILQ,"December 2, 2019",worth the price:),"it's good, i've used for couple months now, stays sturdy and reliable, sometimes it moves a bit as my bed frame is slighly larger than this slat",yes,0,4.0,https://www.amazon.ca/Zinus-Assembly-Quick-Bunkie-Replacement/dp/B072PC9SW7/ref=cm_cr_srp_d_product_top?ie=UTF8,2020-09-30 01:55:20.540892,2020-09-30 01:55:29.902010,Ming,Clothing & Accessories,B002G9UDYG
4,AHJASOP34KG4NUZZ6MYTL2SDLILQ,"December 2, 2019",great and handy,"very good :) protable and handy, have enough information, does the job for me as a starting dictionary for latin",yes,0,5.0,https://www.amazon.ca/College-English-Dictionary-Revised-Updated/dp/055359012X/ref=cm_cr_srp_d_product_top?ie=UTF8,2020-09-30 01:55:39.008622,2020-09-30 01:55:45.335218,Ming,Clothing & Accessories,B002G9UDYG
5,AHJASOP34KG4NUZZ6MYTL2SDLILQ,"December 2, 2019",insightful,"love the book, enjoy its view of looking at materials through daily lives",yes,0,5.0,https://www.amazon.ca/Stuff-Matters-Strange-Marvellous-Materials/dp/0241955181/ref=cm_cr_srp_d_product_top?ie=UTF8,2020-09-30 01:55:52.434405,2020-09-30 01:55:58.753853,Ming,Clothing & Accessories,B002G9UDYG
6,AHJASOP34KG4NUZZ6MYTL2SDLILQ,"December 2, 2019",very warm indeed-,"warm, looking good, size is a little bit large for me, just need to fold more haha",yes,0,4.0,https://www.amazon.ca/Carhartt-Acrylic-Watch-Black-Size/dp/B002G9UDYG/ref=cm_cr_srp_d_product_top?ie=UTF8,2020-09-30 01:56:06.851732,2020-09-30 01:56:16.211187,Ming,Clothing & Accessories,B002G9UDYG
7,AHJASOP34KG4NUZZ6MYTL2SDLILQ,"May 19, 2019",Thoughtful instructions,A good choice for beginners learning:),yes,0,5.0,https://www.amazon.ca/AKLOT-Mahogany-Beginners-Accessories-AKS21/dp/B0736L8Q7Q/ref=cm_cr_srp_d_product_top?ie=UTF8,2020-09-30 01:56:25.317004,2020-09-30 01:56:32.621019,Ming,Clothing & Accessories,B002G9UDYG
