,author_id,date_review_posted,review_title,reviews,verified_purchase,people_find_helpful,ratings,product_url,start,end,reviewer_name,product_category,product_id
0,AHOIZMUMONWXZKBEFD3KAYTCGNAA,"July 9, 2019","Can be easy picked, drilled, shimmed and hammered off.","Ignore the advertising. This lock, despite being touted as ""pick-resistant"", can be picked. And within seconds. Please, please just do a simple Youtube search of this and see. I don't enjoy talking trash about products or companies, but when a product is meant to protect 1000's of dollars, well, my attitude changes.

Moving on from that, the design is just weak. The steel is too thin and although it also claims ""pry"" resistance, im sure with a long enough breaker bar this thing would give in. In fact just hammering this thing would be enough I bet, because of how cheap and thin this metal appears.

The too long didn't read of this is: Cheap, thin, blantitly lying advertising. Easily picked, easily pried, easily drilled, and easily hammered off. A garbage product.",no,0,1.0,https://www.amazon.ca/Reese-Towpower-72783-Universal-Coupler/dp/B0008FUH46/ref=cm_cr_srp_d_product_top?ie=UTF8,2020-09-30 07:54:16.931811,2020-09-30 07:54:25.163050,Ryan,Clothing & Accessories,B002G9UDYG
1,AHOIZMUMONWXZKBEFD3KAYTCGNAA,"January 1, 2019",Great product.,"These will fit any standard game, cd, or dvd perfectly.",yes,0,5.0,https://www.amazon.ca/Urban-Supplies-Eco-Lite-Bubble-Mailer/dp/B079VVK48L/ref=cm_cr_srp_d_product_top?ie=UTF8,2020-09-30 07:54:34.251419,2020-09-30 07:54:42.523637,Ryan,Clothing & Accessories,B002G9UDYG
2,AHOIZMUMONWXZKBEFD3KAYTCGNAA,"November 24, 2018","Great fit, great quality","Toque fits bigger as some people have already said, this just appears to be Carhartts M.O with the majority of their clothing.",yes,0,5.0,https://www.amazon.ca/Carhartt-Acrylic-Watch-Black-Size/dp/B002G9UDYG/ref=cm_cr_srp_d_product_top?ie=UTF8,2020-09-30 07:54:50.613465,2020-09-30 07:54:57.888368,Ryan,Clothing & Accessories,B002G9UDYG
3,AHOIZMUMONWXZKBEFD3KAYTCGNAA,"August 16, 2018",Wouldn't buy any other cleaner,"The best glasses cleaner I've ever used. Bought the three pack so I could have one in the car, one at work and one at home. Definitely worth the price.",yes,0,5.0,https://www.amazon.ca/Glasses-Cleaners-Microfiber-Eyeglass-Cleaning/dp/B074ZMSYK8/ref=cm_cr_srp_d_product_top?ie=UTF8,2020-09-30 07:55:06.978392,2020-09-30 07:55:16.227736,Ryan,Clothing & Accessories,B002G9UDYG
