,subproduct_author_id,verified_purchase,review_title,reviews,date,reviewer_name,ratings,people_find_helpful,reviewer_profile_url,start_time,end_time,product_name,brand_name,rank,product_id,author_id,subproduct_id
87,AHN553YVOZJZWKIVW4QNAGPHOALA,True,Little short,It is a nice jacket but not as long as expected for a « tall » sized item,"January 16, 2019",Natalie Groulx,4.0,0,https://www.amazon.ca/gp/profile/amzn1.account.AHN553YVOZJZWKIVW4QNAGPHOALA/ref=cm_cr_getr_d_gw_btm?ie=UTF8,2020-10-05 15:32:44.032232,2020-10-05 15:32:44.255869,Carhartt Men's Quilted Flannel Lined Duck Active Jacket J140,Carhartt Apparel Mens,"2,366",B002G9UDYG,AE3ELE4EUIMY3CPGP4A6IH6BMSCQ,B002GHC2VU
88,AFTAVFDX3UX7WL5VQCGOXQCID7EQ,True,Well Done,Was everything I was looking for,"November 2, 2018",carl,5.0,0,https://www.amazon.ca/gp/profile/amzn1.account.AFTAVFDX3UX7WL5VQCGOXQCID7EQ/ref=cm_cr_getr_d_gw_btm?ie=UTF8,2020-10-05 15:32:44.260749,2020-10-05 15:32:44.418223,Carhartt Men's Quilted Flannel Lined Duck Active Jacket J140,Carhartt Apparel Mens,"2,366",B002G9UDYG,AE3ELE4EUIMY3CPGP4A6IH6BMSCQ,B002GHC2VU
89,AG5WZDKFZQRRVHNT2FUFRKMPT4VQ,True,the hood is enormous which is great when the wind is biting,"Very warm, the hood is enormous which is great when the wind is biting cold","January 11, 2018",Amazon Customer,5.0,0,https://www.amazon.ca/gp/profile/amzn1.account.AG5WZDKFZQRRVHNT2FUFRKMPT4VQ/ref=cm_cr_getr_d_gw_btm?ie=UTF8,2020-10-05 15:32:44.424415,2020-10-05 15:32:44.571878,Carhartt Men's Quilted Flannel Lined Duck Active Jacket J140,Carhartt Apparel Mens,"2,366",B002G9UDYG,AE3ELE4EUIMY3CPGP4A6IH6BMSCQ,B002GHC2VU
90,AE3GXBK42QRY56NHQXRU2PUTPOJQ,True,Four Stars,Excellent material!,"December 17, 2017",Randy Holtkamp,4.0,0,https://www.amazon.ca/gp/profile/amzn1.account.AE3GXBK42QRY56NHQXRU2PUTPOJQ/ref=cm_cr_getr_d_gw_btm?ie=UTF8,2020-10-05 15:32:50.700995,2020-10-05 15:32:50.887225,Carhartt Men's Quilted Flannel Lined Duck Active Jacket J140,Carhartt Apparel Mens,"2,366",B002G9UDYG,AE3ELE4EUIMY3CPGP4A6IH6BMSCQ,B002GHC2VU
91,AE3ELE4EUIMY3CPGP4A6IH6BMSCQ,True,Love it,Excellent,"January 1, 2019",JSm,5.0,0,https://www.amazon.ca/gp/profile/amzn1.account.AE3ELE4EUIMY3CPGP4A6IH6BMSCQ/ref=cm_cr_getr_d_gw_btm?ie=UTF8,2020-10-05 15:32:50.896010,2020-10-05 15:32:51.113363,Carhartt Men's Quilted Flannel Lined Duck Active Jacket J140,Carhartt Apparel Mens,"2,366",B002G9UDYG,AE3ELE4EUIMY3CPGP4A6IH6BMSCQ,B002GHC2VU
92,AHQ6AW4EC5PZMDMWNMSWYBO34PJA,True,Good quality,"Fits great , use it as a hunting jacket","December 10, 2018",Dale,4.0,0,https://www.amazon.ca/gp/profile/amzn1.account.AHQ6AW4EC5PZMDMWNMSWYBO34PJA/ref=cm_cr_getr_d_gw_btm?ie=UTF8,2020-10-05 15:32:51.119218,2020-10-05 15:32:51.268784,Carhartt Men's Quilted Flannel Lined Duck Active Jacket J140,Carhartt Apparel Mens,"2,366",B002G9UDYG,AE3ELE4EUIMY3CPGP4A6IH6BMSCQ,B002GHC2VU
93,AED2G4HO76TZDKK4JRF2GYYQ5S5Q,True,Five Stars,Very nice,"December 5, 2017",Jean Morin,5.0,0,https://www.amazon.ca/gp/profile/amzn1.account.AED2G4HO76TZDKK4JRF2GYYQ5S5Q/ref=cm_cr_getr_d_gw_btm?ie=UTF8,2020-10-05 15:32:51.274226,2020-10-05 15:32:51.464735,Carhartt Men's Quilted Flannel Lined Duck Active Jacket J140,Carhartt Apparel Mens,"2,366",B002G9UDYG,AE3ELE4EUIMY3CPGP4A6IH6BMSCQ,B002GHC2VU
94,AFMXCZ2FRQSSWVIH3WKM6CRKVF4A,True,One Star,Item is extremely big. Ordered a medium and fits as an XL+.,"March 24, 2018",Courtney Gallant,1.0,0,https://www.amazon.ca/gp/profile/amzn1.account.AFMXCZ2FRQSSWVIH3WKM6CRKVF4A/ref=cm_cr_getr_d_gw_btm?ie=UTF8,2020-10-05 15:32:51.469929,2020-10-05 15:32:51.656099,Carhartt Men's Quilted Flannel Lined Duck Active Jacket J140,Carhartt Apparel Mens,"2,366",B002G9UDYG,AE3ELE4EUIMY3CPGP4A6IH6BMSCQ,B002GHC2VU
95,AE6TAIT66NTAS46GMQIPNQVPSA6A,False,A coat that actually fits!!,"Bought this for my son for work. After taking him yet again to a dozen different local stores including Mark's work warehouse and nothing was long enough in torso or sleeves I bought tall on Amazon. He is 6'5 with an extremely long arm and super skinny at 178 lbs so 2x regular always fits like a weird bell on him but he needs it for length and sleeve and a 2x most of the time still isnt long enough.
He loves it. He said he finally has a coat that fits him properly and is warm and durable for work. (Hes an electricians apprentice)","November 4, 2019",Suzanne ,5.0,0,https://www.amazon.ca/gp/profile/amzn1.account.AE6TAIT66NTAS46GMQIPNQVPSA6A/ref=cm_cr_getr_d_gw_btm?ie=UTF8,2020-10-05 15:32:51.661957,2020-10-05 15:32:51.819215,Carhartt Men's Quilted Flannel Lined Duck Active Jacket J140,Carhartt Apparel Mens,"2,366",B002G9UDYG,AE3ELE4EUIMY3CPGP4A6IH6BMSCQ,B002GHC2VU
96,AF5RHOHZD5XG7C6YYZWOQTYCC6RQ,False,Top notch quality,"Very pleased with this coat . Bought for my husband, he is in the construction business. Very sturdy quality, for someone
who works outside. Large zippered pocket inside, for cell phone, keys, pen and paper, whatever.
Highly recommended.","December 28, 2018",Tricia,5.0,0,https://www.amazon.ca/gp/profile/amzn1.account.AF5RHOHZD5XG7C6YYZWOQTYCC6RQ/ref=cm_cr_getr_d_gw_btm?ie=UTF8,2020-10-05 15:32:51.825070,2020-10-05 15:32:51.959392,Carhartt Men's Quilted Flannel Lined Duck Active Jacket J140,Carhartt Apparel Mens,"2,366",B002G9UDYG,AE3ELE4EUIMY3CPGP4A6IH6BMSCQ,B002GHC2VU
97,AGXQL5WRTCFRUGIPDLTEYNPQHOMQ,False,Carhartt = Quality!!,"Love the value for the money, CARHARTT is a quality product and anyone who works outside will tell you that Carhartt is the industry leader!!!","December 24, 2018",Amazon Customer,5.0,0,https://www.amazon.ca/gp/profile/amzn1.account.AGXQL5WRTCFRUGIPDLTEYNPQHOMQ/ref=cm_cr_getr_d_gw_btm?ie=UTF8,2020-10-05 15:32:51.965247,2020-10-05 15:32:52.154760,Carhartt Men's Quilted Flannel Lined Duck Active Jacket J140,Carhartt Apparel Mens,"2,366",B002G9UDYG,AE3ELE4EUIMY3CPGP4A6IH6BMSCQ,B002GHC2VU
98,AH7YNCBZK5N3REY7P3LBYHUZOMLA,False,Awesome Jacket,Great jacket. This is my go to jacket to keep warm.,"July 22, 2018",DW,5.0,0,https://www.amazon.ca/gp/profile/amzn1.account.AH7YNCBZK5N3REY7P3LBYHUZOMLA/ref=cm_cr_getr_d_gw_btm?ie=UTF8,2020-10-05 15:32:52.161565,2020-10-05 15:32:52.295806,Carhartt Men's Quilted Flannel Lined Duck Active Jacket J140,Carhartt Apparel Mens,"2,366",B002G9UDYG,AE3ELE4EUIMY3CPGP4A6IH6BMSCQ,B002GHC2VU
99,AGFYZPFTCMKRNEWU4MXUXUITCNNA,True,MADE IN THE USA,Fits really big. I’m usually a Xl and the large was too big for me.,"November 15, 2019",Sergio O.,5.0,0,https://www.amazon.ca/gp/profile/amzn1.account.AGFYZPFTCMKRNEWU4MXUXUITCNNA/ref=cm_cr_getr_d_gw_btm?ie=UTF8,2020-10-05 15:32:52.299710,2020-10-05 15:32:52.451161,Carhartt Men's Quilted Flannel Lined Duck Active Jacket J140,Carhartt Apparel Mens,"2,366",B002G9UDYG,AE3ELE4EUIMY3CPGP4A6IH6BMSCQ,B002GHC2VU
