,author_id,date_review_posted,review_title,reviews,verified_purchase,people_find_helpful,ratings,product_url,start,end,reviewer_name,product_category,product_id
0,AHKRLK3RS6HVZCAM6WX5UDJVHX4A,"February 10, 2020",Luxyry quality box,Tiffany blue so appropriate! love this box,yes,0,5.0,https://www.amazon.ca/Two-Layer-Jewelry-Organizer-Display-Storage/dp/B0823CGSKH/ref=cm_cr_srp_d_product_top?ie=UTF8,2020-09-17 21:48:11.202159,2020-09-17 21:48:19.512609,Amazon Customer,Clothing & Accessories,B002G9UDYG
1,AHKRLK3RS6HVZCAM6WX5UDJVHX4A,"February 2, 2020",Fits small,Nice knit hat fits small.,yes,0,5.0,https://www.amazon.ca/Carhartt-Mens-Acrylic-Knit-Heather/dp/B002BU7FEG/ref=cm_cr_srp_d_product_top?ie=UTF8,2020-09-17 21:48:26.608591,2020-09-17 21:48:35.864961,Amazon Customer,Clothing & Accessories,B002G9UDYG
2,AHKRLK3RS6HVZCAM6WX5UDJVHX4A,"January 28, 2020",Best purchase this year!,"Wow!!!! is this the real deal??? Love this bag looks identical to the real Never full LV design worth $2000.00. for less than $200.00 You cannot beat this price!

Quality is A1!

Shopper Kricket",yes,One,5.0,https://www.amazon.ca/dp/B083BYQ7Q8/ref=cm_cr_srp_d_product_top?ie=UTF8,2020-09-17 21:48:44.964326,2020-09-17 21:48:54.279282,Amazon Customer,Clothing & Accessories,B002G9UDYG
3,AHKRLK3RS6HVZCAM6WX5UDJVHX4A,"January 26, 2020",Great!,"Order up i went with size M/L and they fit perfect, nice and loose. No pockets though... Im 5'3 and 120 lbs",yes,One,5.0,https://www.amazon.ca/Miss-Boho-Chic-Oversized-Tracksuit/dp/B07ZDMNH4R/ref=cm_cr_srp_d_product_top?ie=UTF8,2020-09-17 21:49:04.387115,2020-09-17 21:49:10.732262,Amazon Customer,Clothing & Accessories,B002G9UDYG
4,AHKRLK3RS6HVZCAM6WX5UDJVHX4A,"January 26, 2020",Five stars!!!,I have the large LV never full bag and bought the Medium Incert. Fits perfectly!!!,yes,0,5.0,https://www.amazon.ca/NOTAG-Handbag-Organizer-Multipocket-Neverfull/dp/B0774MS61G/ref=cm_cr_srp_d_product_top?ie=UTF8,2020-09-17 21:49:17.832364,2020-09-17 21:49:26.144621,Amazon Customer,Clothing & Accessories,B002G9UDYG
5,AHKRLK3RS6HVZCAM6WX5UDJVHX4A,"January 26, 2020",Five stars!!!,Love this cosmetic bag great durable quality. Good LV dupe without the logos,yes,0,3.0,https://www.amazon.ca/dp/B083SGLMKX/ref=cm_cr_srp_d_product_top?ie=UTF8,2020-09-17 21:49:33.242061,2020-09-17 21:49:41.549389,Amazon Customer,Clothing & Accessories,B002G9UDYG
6,AHKRLK3RS6HVZCAM6WX5UDJVHX4A,"January 15, 2020",Floss watch,"So may compliments on this Luxury inspired reinstone watch. The stones are so tiny and subtle you would never expect they were cubic's Very classy and discreet ... Love this!!!

You wont regret this buy
Shopper Kricket",yes,0,5.0,https://www.amazon.ca/Lancardo-Rhinestone-Gold-tone-Stainless-Quartz/dp/B012ZI2R4Q/ref=cm_cr_srp_d_product_top?ie=UTF8,2020-09-17 21:49:49.635358,2020-09-17 21:49:56.880110,Amazon Customer,Clothing & Accessories,B002G9UDYG
7,AHKRLK3RS6HVZCAM6WX5UDJVHX4A,"January 15, 2020",Leopard sun dress,"Typically I find this print to be very aggressive, but the style of this shoulder tie-up sun dress was irresistible.
So girly-Love it!!! *Size up on this one

Shopper Kricket",yes,One,5.0,https://www.amazon.ca/SUPEYA-Leopard-Sleeveless-Backless-Clubwear/dp/B07PHHMGKY/ref=cm_cr_srp_d_product_top?ie=UTF8,2020-09-17 21:50:06.988157,2020-09-17 21:50:16.262789,Amazon Customer,Clothing & Accessories,B002G9UDYG
8,AHKRLK3RS6HVZCAM6WX5UDJVHX4A,"January 15, 2020",Wrap skirt,"This wrap skirt (has the matching crop top) lovely fitting wrap skirt perfect for vacation, and summer nights I pared it with a white bandeau!, . Looks awesome with tall fall boots too.

You won't regret this buy
Shoppers Kricket",yes,0,5.0,https://www.amazon.ca/Womens-Floral-Print-Asymmetrical-Waist/dp/B073J8T13W/ref=cm_cr_srp_d_product_top?ie=UTF8,2020-09-17 21:50:23.383033,2020-09-17 21:50:29.629574,Amazon Customer,Clothing & Accessories,B002G9UDYG
9,AHKRLK3RS6HVZCAM6WX5UDJVHX4A,"January 15, 2020",Wrap dress,"For the girly girl. This short floral wrap dress, so feminine and pretty. Lilac flower print on soft sheer fabric (not see through) with tie up. Great summer dress -Order up on this one.

Shopper Kricket",yes,0,5.0,https://www.amazon.ca/GONKOMA-Womens-Summer-Floral-Holiday/dp/B07N91S5MG/ref=cm_cr_srp_d_product_top?ie=UTF8,2020-09-17 21:50:37.724545,2020-09-17 21:50:47.004930,Amazon Customer,Clothing & Accessories,B002G9UDYG
10,AHKRLK3RS6HVZCAM6WX5UDJVHX4A,"January 15, 2020",Two tone watch,"Perfect alternative to a pricey luxury watch brand. Fossil lives up to its reputation with this watch. So gorgeous with large face and tiny reinstone details.

Many compliments on this well crafted piece.

You won't regret this buy
Shopper Kricket",yes,0,5.0,https://www.amazon.ca/Fossil-Womens-ES3204-Analog-Display/dp/B009BEO9DU/ref=cm_cr_srp_d_product_top?ie=UTF8,2020-09-17 21:50:57.097321,2020-09-17 21:51:05.401396,Amazon Customer,Clothing & Accessories,B002G9UDYG
11,AHKRLK3RS6HVZCAM6WX5UDJVHX4A,"January 15, 2020",Warp Top,"This wrap top is a wardrobe staple. So flattering on any body type. True Navy color and soft cotton/spandex fabric -order up on this one.

You wont regret this buy
Shopper Kricket",yes,One,5.0,https://www.amazon.ca/OwlFay-Criss-Cross-T-Shirts-Bandage-Bodycon/dp/B07MCWFYR9/ref=cm_cr_srp_d_product_top?ie=UTF8,2020-09-17 21:51:14.490519,2020-09-17 21:51:20.796857,Amazon Customer,Clothing & Accessories,B002G9UDYG
12,AHKRLK3RS6HVZCAM6WX5UDJVHX4A,"January 15, 2020",Lashes,"Best lashes on the market! Dark intense black and very wispy appearance. Use with Quo lash adhesive.

You won't regret this buy
Shopper Kricket",yes,0,5.0,https://www.amazon.ca/ARDELL-Multipack-Demi-Wispies-Count/dp/B014MEFHNY/ref=cm_cr_srp_d_product_top?ie=UTF8,2020-09-17 21:51:30.891338,2020-09-17 21:51:39.221653,Amazon Customer,Clothing & Accessories,B002G9UDYG
13,AHKRLK3RS6HVZCAM6WX5UDJVHX4A,"January 15, 2020",Jumper,"Order up on this one. This green jumper is made well with a back zipper and beautiful soft green fabric.

You wont regret this buy
Shopper Kricket",yes,One,5.0,https://www.amazon.ca/Womens-Spaghetti-Sleeveless-Jumpsuits-Rompers/dp/B07CKXH85G/ref=cm_cr_srp_d_product_top?ie=UTF8,2020-09-17 21:51:48.306864,2020-09-17 21:51:54.594841,Amazon Customer,Clothing & Accessories,B002G9UDYG
14,AHKRLK3RS6HVZCAM6WX5UDJVHX4A,"January 15, 2020",Black sexy sweater,"At first I wasn't sure how to wear this. Once I figured it out, paired it with a fitted black bandeau, tank top. Jeans/leather pants. Great winter /Fall piece.

You won't regret this buy
Shopper Kricket",yes,0,5.0,https://www.amazon.ca/Womens-Shoulder-Cross-Sweater-Blouse/dp/B078MTB8NY/ref=cm_cr_srp_d_product_top?ie=UTF8,2020-09-17 21:52:03.682286,2020-09-17 21:52:09.994657,Amazon Customer,Clothing & Accessories,B002G9UDYG
15,AHKRLK3RS6HVZCAM6WX5UDJVHX4A,"January 15, 2020",Men's black Europe style swim trunk,"Men's black European style swim trunk. Great fit and fabric, affordable style option.

You won't regret this buy
Shopper Kricket",yes,27,5.0,https://www.amazon.ca/MADHERO-Trunk-Quick-Bathing-Shorts/dp/B071YXH939/ref=cm_cr_srp_d_product_top?ie=UTF8,2020-09-17 21:52:20.085639,2020-09-17 21:52:27.354376,Amazon Customer,Clothing & Accessories,B002G9UDYG
16,AHKRLK3RS6HVZCAM6WX5UDJVHX4A,"January 15, 2020",Chanel,"Tweed Chanel inspired! I love this cute little mini bag. Surprisingly fits a lot of small items. Sturdy with a slim faux leather handle and adjustable strap.

You wont regret this buy
Shopper Kricket",yes,0,5.0,https://www.amazon.ca/LEOO-Handbags-Leather-Shoulder-Satchel/dp/B07PH5JW4K/ref=cm_cr_srp_d_product_top?ie=UTF8,2020-09-17 21:52:36.446138,2020-09-17 21:52:45.729998,Amazon Customer,Clothing & Accessories,B002G9UDYG
17,AHKRLK3RS6HVZCAM6WX5UDJVHX4A,"January 15, 2020",Kate Spade?,"This belt is so cute and reminds me of a Kate spade brand belt. Black, sturdy many holes for adjusting, adorable heart pendant. with a black dress pant or plain 'ol pair of black jeans.

Shopper Kricket",yes,0,5.0,https://www.amazon.ca/UTENEW-Heart-Leather-Dresses-Buckle/dp/B07KK4S9R9/ref=cm_cr_srp_d_product_top?ie=UTF8,2020-09-17 21:52:53.854487,2020-09-17 21:53:02.186416,Amazon Customer,Clothing & Accessories,B002G9UDYG
18,AHKRLK3RS6HVZCAM6WX5UDJVHX4A,"January 15, 2020",White pop up Grip,"Plain all white was so hard to find. I love this one, goes great with my ""Ideal of Sweden"" inspired Phone case -in Marble

You won't regret this buy
Shopper Kricket",yes,0,5.0,https://www.amazon.ca/Smartphone-Expanding-Multifunction-Android-Tablets/dp/B07MBBSCF7/ref=cm_cr_srp_d_product_top?ie=UTF8,2020-09-17 21:53:11.278949,2020-09-17 21:53:19.509841,Amazon Customer,Clothing & Accessories,B002G9UDYG
19,AHKRLK3RS6HVZCAM6WX5UDJVHX4A,"January 15, 2020",Ideal of Sweden?,"LOVE!!!! this designer-inspired phone case and purchased it with a white pop up grip. Looks like the Ideal of Sweden Brand. This marble pattern can be used in all the seasons.

You won't regret this buy
Shopper Kricket",yes,0,5.0,https://www.amazon.ca/iPhone-Marble-Flexible-Pattern-Sierra/dp/B07413T1Y1/ref=cm_cr_srp_d_product_top?ie=UTF8,2020-09-17 21:53:27.624020,2020-09-17 21:53:33.904568,Amazon Customer,Clothing & Accessories,B002G9UDYG
20,AHKRLK3RS6HVZCAM6WX5UDJVHX4A,"January 15, 2020",Champion,"He will love these joggers and the matching Top to go with! Well made and a most comfortable fit.

You won't regret this buy
Shopper Kricket",yes,0,5.0,https://www.amazon.ca/Champion-Closed-Bottom-Jersey-X-Large/dp/B00FSB662C/ref=cm_cr_srp_d_product_top?ie=UTF8,2020-09-17 21:53:44.104953,2020-09-17 21:53:51.399618,Amazon Customer,Clothing & Accessories,B002G9UDYG
21,AHKRLK3RS6HVZCAM6WX5UDJVHX4A,"January 15, 2020",Champion,"He will love this and the matching joggers that go with. Great fabric, well made true to photo.

You wont regret this buy
Shopper Kricket",yes,0,5.0,https://www.amazon.ca/Champion-Heritage-Sleeve-Embroidered-Script/dp/B07KCY8MPR/ref=cm_cr_srp_d_product_top?ie=UTF8,2020-09-17 21:53:58.472038,2020-09-17 21:54:04.739337,Amazon Customer,Clothing & Accessories,B002G9UDYG
22,AHKRLK3RS6HVZCAM6WX5UDJVHX4A,"January 15, 2020",Straw Purse,"Vacation clutch. Great for small items like cell phone or cosmetics. Perfect for dinner out on vacation.
Most affordable find for a luxury-like brand-Just love this clutch!!

You won't regret this buy
Shopper Kricket",yes,0,5.0,https://www.amazon.ca/Clutch-Handbag-JOSEKO-Envelope-Wallet/dp/B07DCPN63M/ref=cm_cr_srp_d_product_top?ie=UTF8,2020-09-17 21:54:14.824126,2020-09-17 21:54:23.103939,Amazon Customer,Clothing & Accessories,B002G9UDYG
23,AHKRLK3RS6HVZCAM6WX5UDJVHX4A,"January 15, 2020",Mens vacation shirt,"Most vacation shirts are so cheesy. Not this one! Fabric soft, well made, looks and feels like a luxury Men's brand.
The colors and unique pattern is gorgeous.

You wont regret this buy
Shopper Kricket",yes,0,5.0,https://www.amazon.ca/Summer-Casual-Button-Hawaiian-Holiday/dp/B07TXQZ4VK/ref=cm_cr_srp_d_product_top?ie=UTF8,2020-09-17 21:54:32.190098,2020-09-17 21:54:41.491802,Amazon Customer,Clothing & Accessories,B002G9UDYG
24,AHKRLK3RS6HVZCAM6WX5UDJVHX4A,"January 15, 2020",Two pc Skirt/Top,"This vibrant two pc floral crop top and skirt outfit is adorable. Perfect for that European vacation to Greece, Italy or any where in the south of France!

Top fits larger, skirt fits as expected. I wear a size small. (120 lbs 5'4)

Shopper Kricket",yes,0,5.0,https://www.amazon.ca/X-Future-Womens-Outfits-Casual-Summer/dp/B07TSTTXKJ/ref=cm_cr_srp_d_product_top?ie=UTF8,2020-09-17 21:54:49.580973,2020-09-17 21:54:57.846051,Amazon Customer,Clothing & Accessories,B002G9UDYG
25,AHKRLK3RS6HVZCAM6WX5UDJVHX4A,"January 15, 2020",Straw back pack,"So well made, great colour and holds many small items and had an inside pocket. The straps are sturdy and adjustable for comfort and the closing clasp is snug. Use as a dressy purse or trendy vacation back pack.

You won't regret this buy
Shopper Kricket",yes,0,5.0,https://www.amazon.ca/dp/B07TM9G7WT/ref=cm_cr_srp_d_product_top?ie=UTF8,2020-09-17 21:55:07.952647,2020-09-17 21:55:16.246905,Amazon Customer,Clothing & Accessories,B002G9UDYG
26,AHKRLK3RS6HVZCAM6WX5UDJVHX4A,"January 15, 2020",Beach Blanket,"Aztec print is solid. This is good to have on the beach chair, on the sand and in the background for Instagram photos or other... Folds up small, perfect for your beach bag!

You won't regret this buy
Shopper Kricket",yes,0,3.0,https://www.amazon.ca/YANG-YI-Housekeeping-Clearance-Swimwear-Bathing/dp/B07CTD239G/ref=cm_cr_srp_d_product_top?ie=UTF8,2020-09-17 21:55:24.337804,2020-09-17 21:55:31.607921,Amazon Customer,Clothing & Accessories,B002G9UDYG
27,AHKRLK3RS6HVZCAM6WX5UDJVHX4A,"January 15, 2020",Vintage skirt,"This skirt is so cute and affordable. Mustard yellow and black plaid w/ sturdy silver loop zipper. Perfect for any fall/winter outfit. Pair it with a tank top or sweater. *not lined

You won't regret this buy
Shopper Kricket",yes,One,5.0,https://www.amazon.ca/Corriee-Ladies-Skirts-Womens-Zipper/dp/B07NS7ZM51/ref=cm_cr_srp_d_product_top?ie=UTF8,2020-09-17 21:55:41.707879,2020-09-17 21:55:50.996900,Amazon Customer,Clothing & Accessories,B002G9UDYG
28,AHKRLK3RS6HVZCAM6WX5UDJVHX4A,"January 15, 2020",Tulum,"What to wear? These came in handy on my beach vaca! So soft and light. the crochet fabric is so delicate and pretty.
I ordered size small (120 lbs 5'4) made long in length, and comes with adjustable draw string * Perfect for Taller girls

You won't regret this buy
Shopper Kricket",yes,One,5.0,https://www.amazon.ca/Romose-Crochet-Swimsuits-Trousers-X-Small/dp/B07SRT1BJ5/ref=cm_cr_srp_d_product_top?ie=UTF8,2020-09-17 21:55:59.092763,2020-09-17 21:56:07.393342,Amazon Customer,Clothing & Accessories,B002G9UDYG
29,AHKRLK3RS6HVZCAM6WX5UDJVHX4A,"January 15, 2020",Chanel,"This skirt is so cute and fits like a glove. I wear size small (120 lbs 5'4) the tweed is black, grey with a hint of pink and silver stitching. I opted for this instead of a real chanel brand mini skirt. I do not regret this buy

You won't regret this buy
Shopper Kricket",yes,0,5.0,https://www.amazon.ca/Gocgt-Womens-Waist-Houndstooth-Plaid/dp/B07MPD1GWY/ref=cm_cr_srp_d_product_top?ie=UTF8,2020-09-17 21:56:17.487685,2020-09-17 21:56:23.755881,Amazon Customer,Clothing & Accessories,B002G9UDYG
30,AHKRLK3RS6HVZCAM6WX5UDJVHX4A,"January 15, 2020",Spanish earnings,"Talk about senorita! These beautifully crafted earnings are statement for sure. So well made, beautiful vibrant colors.
These were worn on vacation in Mexico.

You won't regret this buy
Shopper Kricket",yes,0,5.0,https://www.amazon.ca/earrings-sterling-stainless-zirconia-non-piercing/dp/B077W2393F/ref=cm_cr_srp_d_product_top?ie=UTF8,2020-09-17 21:56:30.851856,2020-09-17 21:56:40.105681,Amazon Customer,Clothing & Accessories,B002G9UDYG
31,AHKRLK3RS6HVZCAM6WX5UDJVHX4A,"January 15, 2020",Black out Sun Glasses,"You want black out? you got it These frames fit small but are great and an affordable alternative to the pricey over-sized sunglass Brands i'e, Dior, Gucci etc. *Great for smaller faces.

You won't regret this buy
Shopper Kricket",yes,0,5.0,https://www.amazon.ca/SunglassUP-Trapezoid-Blacked-Oversized-Sunglasses/dp/B07RVDHS77/ref=cm_cr_srp_d_product_top?ie=UTF8,2020-09-17 21:56:49.215930,2020-09-17 21:56:58.551846,Amazon Customer,Clothing & Accessories,B002G9UDYG
32,AHKRLK3RS6HVZCAM6WX5UDJVHX4A,"January 15, 2020",Wide lens,"These are gorgeous. Perfect for adding trend to your outfit. Clear frames wide lens, great style.

You won't regret this buy
Shopper Kricket",yes,0,5.0,https://www.amazon.ca/frameless-colorful-fashion-sunglasses-transparent/dp/B07FQLQ9B7/ref=cm_cr_srp_d_product_top?ie=UTF8,2020-09-17 21:57:08.667406,2020-09-17 21:57:17.977902,Amazon Customer,Clothing & Accessories,B002G9UDYG
33,AHKRLK3RS6HVZCAM6WX5UDJVHX4A,"January 15, 2020",Carry on,"The ultimate boho vacation bag/carry on. This bag material is soooo perfect for a vacation. I thought is was a true wicker type material, its more like a fine hard acrylic material, woven to mimic wicker, so it can get wet and will not be destroyed. Fully lined on the inside with a back wall pocket. It was perfect to use as my carry on bag and for the beach in Mexico!

You won't regret this buy",yes,0,5.0,https://www.amazon.ca/dp/B075SB4GY2/ref=cm_cr_srp_d_product_top?ie=UTF8,2020-09-17 21:57:28.080060,2020-09-17 21:57:35.391412,Amazon Customer,Clothing & Accessories,B002G9UDYG
34,AHKRLK3RS6HVZCAM6WX5UDJVHX4A,"January 15, 2020",Iphone tripod,"This was the best buy around, so sturdy and well made. Comes with remote, what!?? A velvet carry case and Stores perfectly in a carry on or back pack for travel!

YOU wont regret this buy
Shopper Kricket",yes,13,5.0,https://www.amazon.ca/Aureday-Portable-Adjustable-Extendable-Wireless/dp/B07S7H1XNH/ref=cm_cr_srp_d_product_top?ie=UTF8,2020-09-17 21:57:45.490020,2020-09-17 21:57:51.771260,Amazon Customer,Clothing & Accessories,B002G9UDYG
35,AHKRLK3RS6HVZCAM6WX5UDJVHX4A,"January 15, 2020",Black fleece,"This vintage gem is so well made, soft thick fleece fabric with soild death Row logo. The perfect birthday gift for the old school music lover.

You wont regret this buy
Shopper Kricket",yes,0,5.0,https://www.amazon.ca/Ripple-Junction-Death-Records-Sweatshirt/dp/B00U0I0R0U/ref=cm_cr_srp_d_product_top?ie=UTF8,2020-09-17 21:57:59.899888,2020-09-17 21:58:09.158069,Amazon Customer,Clothing & Accessories,B002G9UDYG
36,AHKRLK3RS6HVZCAM6WX5UDJVHX4A,"January 15, 2020",Cat Bow Tie,"Well made tweed black and red cat collar /bow tie. My Cat loved it and looked adorable over Christmas in this.
-Adjustable I have a medium size cat.

You wont regret this buy",yes,0,5.0,https://www.amazon.ca/Christmas-Collar-Adjustable-Puppy-Lovely/dp/B07LD8T8QY/ref=cm_cr_srp_d_product_top?ie=UTF8,2020-09-17 21:58:19.262129,2020-09-17 21:58:25.597562,Amazon Customer,Clothing & Accessories,B002G9UDYG
37,AHKRLK3RS6HVZCAM6WX5UDJVHX4A,"January 15, 2020",Tie Die Hoodie,"WoW! quality is 100% this tie die is a show stopper. Pictures will not do it justice i promise you. I feel like a Kardashian in this hoodie LOL

You wont regret this buy
Shopper Kricket",yes,0,5.0,https://www.amazon.ca/Hoodie-Sweatshirt-Ocean-Adults-Cotton/dp/B018F628M8/ref=cm_cr_srp_d_product_top?ie=UTF8,2020-09-17 21:58:35.688297,2020-09-17 21:58:42.974413,Amazon Customer,Clothing & Accessories,B002G9UDYG
38,AHKRLK3RS6HVZCAM6WX5UDJVHX4A,"January 15, 2020",Adidas Crop Sock,"Its really hard to find this type of crop sock Two pairs, what a deal! These Sox are the cutest with you favorite it Adidas trainer, shorts or even a dress. Perfect fit, I'm a shoe size 7.5

You wont regret this buy.
Shopper Kricket",yes,0,5.0,https://www.amazon.ca/Adidas-ORIGINALS-Womens-Swimwear-White/dp/B07S259F75/ref=cm_cr_srp_d_product_top?ie=UTF8,2020-09-17 21:58:50.055082,2020-09-17 21:58:56.338144,Amazon Customer,Clothing & Accessories,B002G9UDYG
39,AHKRLK3RS6HVZCAM6WX5UDJVHX4A,"January 15, 2020",Gimbal for Iphone,"What can I say this Gimbal is PERFECTION, so sturdy and light perfect for vacation vlogging, selfies and comfortable video/picture capturing. This Gimbal easily screws apart and fits in the tiniest of spaces, I kept it in my purse when it wasn't in use.

You wont regret this buy.
Shopper Kricket",yes,0,5.0,https://www.amazon.ca/Stabilizer-Smartphone-Support-Landscape-Portrait/dp/B07G9CYTZP/ref=cm_cr_srp_d_product_top?ie=UTF8,2020-09-17 21:59:03.450041,2020-09-17 21:59:12.743200,Amazon Customer,Clothing & Accessories,B002G9UDYG
40,AHKRLK3RS6HVZCAM6WX5UDJVHX4A,"January 15, 2020",Birthday Gift 40 Plus,"I gifted this to myself and keep it by my bedside. Each morning its used and I love it! learning a new word everyday , so fun to use, exercises my brain and expands your vocab quickly.

You wont regret this buy.
Shopper Kricket",yes,0,4.0,https://www.amazon.ca/Acer-Apps-Memory-Game/dp/B007GGB2VC/ref=cm_cr_srp_d_product_top?ie=UTF8,2020-09-17 21:59:21.822697,2020-09-17 21:59:30.065475,Amazon Customer,Clothing & Accessories,B002G9UDYG
41,AHKRLK3RS6HVZCAM6WX5UDJVHX4A,"January 15, 2020",Carhartt Black toque 2020 trending,"This toque!!! so well made tightly woven perfectly stitched Carhartt Logo. A staple for my winter/fall wardrobe Carhartt since 1889 I mean c'mon, definitely a reliable Brand.

You wont regret this buy.
Shopper Kricket",yes,0,5.0,https://www.amazon.ca/Carhartt-Acrylic-Watch-Black-Size/dp/B002G9UDYG/ref=cm_cr_srp_d_product_top?ie=UTF8,2020-09-17 21:59:37.164830,2020-09-17 21:59:46.453240,Amazon Customer,Clothing & Accessories,B002G9UDYG
42,AHKRLK3RS6HVZCAM6WX5UDJVHX4A,"January 15, 2020",Natural Health Books,"The tips in the book are unreal and have improved my overall chemical balance, drastically. Highly recommended.
Dr. Sebi has cured patients with, diabetes, Lupus, HIV, Heart disease and other ailments using these methods outlined in this book!

You wont regret this buy.
Shopper Kricket",yes,0,5.0,https://www.amazon.ca/Complete-Dr-Sebi-Bible-Practising/dp/1087003539/ref=cm_cr_srp_d_product_top?ie=UTF8,2020-09-17 21:59:56.535591,2020-09-17 22:00:02.831133,Amazon Customer,Clothing & Accessories,B002G9UDYG
43,AHKRLK3RS6HVZCAM6WX5UDJVHX4A,"September 10, 2019",Great!,Looks and feels expensive!! good buy,yes,0,5.0,https://www.amazon.ca/Jeasona-Womens-Bathing-Bikini-Cardigan/dp/B0769CVM8T/ref=cm_cr_srp_d_product_top?ie=UTF8,2020-09-17 22:00:10.926345,2020-09-17 22:00:18.239056,Amazon Customer,Clothing & Accessories,B002G9UDYG
44,AHKRLK3RS6HVZCAM6WX5UDJVHX4A,"September 10, 2019",Great!,Ready to wear in Mexico!,yes,0,5.0,https://www.amazon.ca/Bsubseach-Crochet-Hollow-Sleeve-Swimwear/dp/B07P7F3K4Q/ref=cm_cr_srp_d_product_top?ie=UTF8,2020-09-17 22:00:28.318863,2020-09-17 22:00:35.578633,Amazon Customer,Clothing & Accessories,B002G9UDYG
45,AHKRLK3RS6HVZCAM6WX5UDJVHX4A,"September 10, 2019",Great!,"Silky soft , good quality! looks great on black mini purse",yes,0,5.0,https://www.amazon.ca/Urban-CoCo-Womens-Graphic-Neckerchief/dp/B074DT6H3J/ref=cm_cr_srp_d_product_top?ie=UTF8,2020-09-17 22:00:45.666686,2020-09-17 22:00:54.981863,Amazon Customer,Clothing & Accessories,B002G9UDYG
46,AHKRLK3RS6HVZCAM6WX5UDJVHX4A,"August 28, 2019",Fit,Beautiful!!,yes,0,3.0,https://www.amazon.ca/HZSONNE-Vintage-Pockets-Cardigan-Pointelle/dp/B07KNVK58W/ref=cm_cr_srp_d_product_top?ie=UTF8,2020-09-17 22:01:02.070687,2020-09-17 22:01:08.333874,Amazon Customer,Clothing & Accessories,B002G9UDYG
47,AHKRLK3RS6HVZCAM6WX5UDJVHX4A,"August 28, 2019",Fit,bad fabric,yes,0,1.0,https://www.amazon.ca/DORIC-Dresses-Summer-Bohemian-Spaghetti/dp/B07QX6GRFD/ref=cm_cr_srp_d_product_top?ie=UTF8,2020-09-17 22:01:15.419520,2020-09-17 22:01:23.688939,Amazon Customer,Clothing & Accessories,B002G9UDYG
48,AHKRLK3RS6HVZCAM6WX5UDJVHX4A,"August 28, 2019",Fit,Beautiful!!,yes,0,1.0,https://www.amazon.ca/Sumen-Backless-Chiffon-Jumpsuits-Rompers/dp/B07CLGC3G7/ref=cm_cr_srp_d_product_top?ie=UTF8,2020-09-17 22:01:30.795821,2020-09-17 22:01:37.114434,Amazon Customer,Clothing & Accessories,B002G9UDYG
49,AHKRLK3RS6HVZCAM6WX5UDJVHX4A,"August 28, 2019",Great!,Beautiful!!,yes,0,3.0,https://www.amazon.ca/BCDshop-Headbands-Vintage-Stretch-Accessories/dp/B07RW9VBB2/ref=cm_cr_srp_d_product_top?ie=UTF8,2020-09-17 22:01:45.204358,2020-09-17 22:01:54.478977,Amazon Customer,Clothing & Accessories,B002G9UDYG
50,AHKRLK3RS6HVZCAM6WX5UDJVHX4A,"August 28, 2019",Not as advertised,This item is not the colour in the photo. cheaply made,yes,0,1.0,https://www.amazon.ca/dp/B07QWK9RBM/ref=cm_cr_srp_d_product_top?ie=UTF8,2020-09-17 22:02:03.566024,2020-09-17 22:02:09.871022,Amazon Customer,Clothing & Accessories,B002G9UDYG
51,AHKRLK3RS6HVZCAM6WX5UDJVHX4A,"August 8, 2019",Wrap dress,"Flattering for any body type *Size up on this dress. Cute black and white tiny flower print. Soft cotton-like fabric with comfortable loose sleeves. Wear to the office or on a breezy summer day.

Shopper Kricket",yes,0,5.0,https://www.amazon.ca/LANISEN-Womens-Summer-Floral-Sleeve/dp/B07TC29QB3/ref=cm_cr_srp_d_product_top?ie=UTF8,2020-09-17 22:02:17.948266,2020-09-17 22:02:27.219893,Amazon Customer,Clothing & Accessories,B002G9UDYG
52,AHKRLK3RS6HVZCAM6WX5UDJVHX4A,"June 18, 2019",Great!,tHESE SHOES ARE AMAZING WENT UP ON SIZE FOR COMFORT-NARROW FIT,yes,0,5.0,https://www.amazon.ca/Reebok-Classic-Womens-Freestyle-Sneakers/dp/B0000ANC7S/ref=cm_cr_srp_d_product_top?ie=UTF8,2020-09-17 22:02:37.301735,2020-09-17 22:02:43.630900,Amazon Customer,Clothing & Accessories,B002G9UDYG
53,AHKRLK3RS6HVZCAM6WX5UDJVHX4A,"June 5, 2019",Great!,The material is shinier than i expected. Fits great! size small,yes,0,4.0,https://www.amazon.ca/Amacok-Womens-Bodycon-V-Neck-Evening/dp/B07HYZV692/ref=cm_cr_srp_d_product_top?ie=UTF8,2020-09-17 22:02:52.710306,2020-09-17 22:03:00.978298,Amazon Customer,Clothing & Accessories,B002G9UDYG
54,AHKRLK3RS6HVZCAM6WX5UDJVHX4A,"June 5, 2019",Great!,Works well for my small pores. I've also been sing it as a makeup primer!,yes,0,4.0,https://www.amazon.ca/SKINMISO-Pore-Minimizer-Shrink-Effect/dp/B01IAWFIUG/ref=cm_cr_srp_d_product_top?ie=UTF8,2020-09-17 22:03:08.083769,2020-09-17 22:03:15.433074,Amazon Customer,Clothing & Accessories,B002G9UDYG
55,AHKRLK3RS6HVZCAM6WX5UDJVHX4A,"May 22, 2019",Fit,I'm usually a Small I got a Medium Fit. Fits Great! small would have been to tight and too short.,yes,0,3.0,https://www.amazon.ca/Emubody-Women-Tank-Tops-T-Shirt/dp/B07NVRQQ33/ref=cm_cr_srp_d_product_top?ie=UTF8,2020-09-17 22:03:24.510404,2020-09-17 22:03:33.821689,Amazon Customer,Clothing & Accessories,B002G9UDYG
56,AHKRLK3RS6HVZCAM6WX5UDJVHX4A,"May 22, 2019",Great!,Perfect!!,yes,0,5.0,https://www.amazon.ca/Hanes-Pullover-EcoSmart-Fleece-Sweatshirt/dp/B071WWXL63/ref=cm_cr_srp_d_product_top?ie=UTF8,2020-09-17 22:03:40.900083,2020-09-17 22:03:47.245823,Amazon Customer,Clothing & Accessories,B002G9UDYG
