,id,date_review_posted,review_title,review,verified_purchase,people_find_helpful,ratings,product_url,start,end,author,product_category
0,AGE63FSZC6QHYTDEU7ECKCZBATLQ,"August 28, 2020",Great mouse,Been great so far.works really well.battery last longs,yes,0,5.0,https://www.amazon.ca/Jelly-Comb-Wireless-Mouse-Receiver/dp/B07RLB8D9Z/ref=cm_cr_srp_d_product_top?ie=UTF8,2020-09-14 02:57:58.346774,2020-09-14 02:58:05.659196,Ejehi,Electronics
1,AGE63FSZC6QHYTDEU7ECKCZBATLQ,"August 28, 2020","Great for the price,works well but poor camera quality",It has performed well so far after about a month of usage.the only dislike is the camera quality. Blacks out when using for a zoo cal.but i got a webcam from amazon to solve that.,yes,0,5.0,https://www.amazon.ca/Acer-Aspire-Celeron-Windows-A115-31-C2Y3/dp/B086XXW87C/ref=cm_cr_srp_d_product_top?ie=UTF8,2020-09-14 02:58:14.774146,2020-09-14 02:58:22.070302,Ejehi,Electronics
2,AGE63FSZC6QHYTDEU7ECKCZBATLQ,"June 30, 2020",sleek colour and lightweight,"so far so good, its been an awesome experience so far. i did a lot of downloads as soon as i got it and it was very efficient.works well.though i would have preferred better camera quality every other thing is fine",yes,0,5.0,https://www.amazon.ca/Laptop-14-Inch-Windows-10-Processor-Extension/dp/B087N85577/ref=cm_cr_srp_d_product_top?ie=UTF8,2020-09-14 02:58:31.155206,2020-09-14 02:58:38.425000,Ejehi,Electronics
3,AGE63FSZC6QHYTDEU7ECKCZBATLQ,"June 26, 2020","An Awesome Product ,much more additions than expected","A lovely product,had much more than i expected, came with so many additions like a screen cleaner dust absober,side case for the sides of the phine and most of all a free gift! So many options to pick a free gift.this is so lovely.and then a life warranty.i love it!",yes,0,5.0,https://www.amazon.ca/LK-Protector-Tempered-Friendly-Coverage/dp/B07W5ZRX95/ref=cm_cr_srp_d_product_top?ie=UTF8,2020-09-14 02:58:45.536672,2020-09-14 02:58:54.818019,Ejehi,Electronics
4,AGE63FSZC6QHYTDEU7ECKCZBATLQ,"June 26, 2020",Nice dress,"Its a really cute dress,it also stretches,so fits well.but it came shorter than expected.looks more.like dress u have to were pants under.but still very cure",yes,0,5.0,https://www.amazon.ca/dp/B07MFH5PGT/ref=cm_cr_srp_d_product_top?ie=UTF8,2020-09-14 02:59:02.917577,2020-09-14 02:59:11.178627,Ejehi,Electronics
5,AGE63FSZC6QHYTDEU7ECKCZBATLQ,"February 5, 2020",Perfect Adidas jacket,"It was awesome,and the delivery was perfect.the courier company made sure it was delivered with 24 hours as promised.",yes,0,5.0,https://www.amazon.ca/adidas-Womens-Tiro19-Training-Jacket/dp/B07H4RG437/ref=cm_cr_srp_d_product_top?ie=UTF8,2020-09-14 02:59:20.314808,2020-09-14 02:59:27.674644,Ejehi,Electronics
