,id,date_review_posted,review_title,review,verified_purchase,people_find_helpful,ratings,product_url,start,end,author,product_category
0,AFZB4DKIMOXC5FAKTOFW3EJBJZTA,"September 13, 2020",C est mon 2 éme Astérix et je suis pas déçu,Il fait bon lire ça divertit bien,yes,0,5.0,https://www.amazon.ca/AST%C3%89RIX-RENTR%C3%89E-GAULOISE-REN%C3%89-GOSCINNY/dp/2864971534/ref=cm_cr_srp_d_product_top?ie=UTF8,2020-09-14 03:07:40.699500,2020-09-14 03:07:48.068492,Le grand,Electronics
1,AFZB4DKIMOXC5FAKTOFW3EJBJZTA,"September 13, 2020",Livre bien illustré bien fait,C est exactement ce à quoi j espérait,yes,0,5.0,https://www.amazon.ca/AVENTURES-TINTIN-T-16-OBJECTIF-LUNE/dp/2203001151/ref=cm_cr_srp_d_product_top?ie=UTF8,2020-09-14 03:07:57.168679,2020-09-14 03:08:03.453728,Le grand,Electronics
2,AFZB4DKIMOXC5FAKTOFW3EJBJZTA,"August 14, 2020",Coton et polyester doux et confortable,La preuve qu il n est pas nécessaire de payer cher pour avoir un produit de qualité,yes,0,5.0,https://www.amazon.ca/Russell-Athletic-Essential-Sleeve-Orange/dp/B071DVSCMC/ref=cm_cr_srp_d_product_top?ie=UTF8,2020-09-14 03:08:11.541937,2020-09-14 03:08:19.792559,Le grand,Electronics
3,AFZB4DKIMOXC5FAKTOFW3EJBJZTA,"August 14, 2020",Prends peu de place sur mon bureau informatique,Facile à fonctionner et éclaire très bien,yes,0,5.0,https://www.amazon.ca/TOPELEK-Eye-caring-Touch-sensitive-Lighting-Working-Black/dp/B07B3NDYH1/ref=cm_cr_srp_d_product_top?ie=UTF8,2020-09-14 03:08:26.873744,2020-09-14 03:08:33.119522,Le grand,Electronics
4,AFZB4DKIMOXC5FAKTOFW3EJBJZTA,"August 14, 2020",Achemine bien le son,Pour le prix moi et mon i phone ne pouvons s en passer,yes,0,5.0,https://www.amazon.ca/dp/B08DY1N8CJ/ref=cm_cr_srp_d_product_top?ie=UTF8,2020-09-14 03:08:41.214954,2020-09-14 03:08:50.479496,Le grand,Electronics
5,AFZB4DKIMOXC5FAKTOFW3EJBJZTA,"August 14, 2020",Bon rapport qualité prix,Des chansons qui sont vivantes à écouter,yes,0,5.0,https://www.amazon.ca/Slippery-When-Wet-Bon-Jovi/dp/B00000I07P/ref=cm_cr_srp_d_product_top?ie=UTF8,2020-09-14 03:08:59.587994,2020-09-14 03:09:07.844745,Le grand,Electronics
6,AFZB4DKIMOXC5FAKTOFW3EJBJZTA,"August 14, 2020",Tissu coton bio agréable à porter,T shirt qui s annexe bien avec un jeans,yes,0,5.0,https://www.amazon.ca/econscious-Organic-Cotton-Pacific-X-Large/dp/B0018MITJI/ref=cm_cr_srp_d_product_top?ie=UTF8,2020-09-14 03:09:16.936561,2020-09-14 03:09:26.202031,Le grand,Electronics
7,AFZB4DKIMOXC5FAKTOFW3EJBJZTA,"August 14, 2020",Garde le corps au frais,Pour la visibilité c est super et léger,yes,0,5.0,https://www.amazon.ca/adidas-Tabela-Jersey-Yellow-White/dp/B078LCD3NZ/ref=cm_cr_srp_d_product_top?ie=UTF8,2020-09-14 03:09:35.288887,2020-09-14 03:09:42.566879,Le grand,Electronics
8,AFZB4DKIMOXC5FAKTOFW3EJBJZTA,"August 14, 2020",Bien content de l achat,Très confortable et extensible,yes,0,5.0,https://www.amazon.ca/Stanfields-Essentials-Regular-Underwear-Heather/dp/B07W3MJK4H/ref=cm_cr_srp_d_product_top?ie=UTF8,2020-09-14 03:09:49.682786,2020-09-14 03:09:56.972134,Le grand,Electronics
9,AFZB4DKIMOXC5FAKTOFW3EJBJZTA,"August 14, 2020",Bon rapport qualité prix,Facile à configurer et processeur rapide,yes,0,5.0,https://www.amazon.ca/Acer-Aspire-Celeron-Windows-A115-31-C2Y3/dp/B086XXW87C/ref=cm_cr_srp_d_product_top?ie=UTF8,2020-09-14 03:10:04.096364,2020-09-14 03:10:11.418606,Le grand,Electronics
10,AFZB4DKIMOXC5FAKTOFW3EJBJZTA,"July 30, 2020",Encore la bon rapport qualité prix merci !,Beaucoup de rangement je suis bien satisfait,yes,0,5.0,https://www.amazon.ca/KROSER-Briefcase-Expandable-Water-Repellent-Women-Black/dp/B07M5N8X11/ref=cm_cr_srp_d_product_top?ie=UTF8,2020-09-14 03:10:21.511179,2020-09-14 03:10:30.794076,Le grand,Electronics
11,AFZB4DKIMOXC5FAKTOFW3EJBJZTA,"July 30, 2020",Ça se lit très facilement merci !,Pour de la lecture divertissante c est l idéal,yes,0,5.0,https://www.amazon.ca/aventures-Lucky-Luke-08-cow-boy/dp/2884714537/ref=cm_cr_srp_d_product_top?ie=UTF8,2020-09-14 03:10:38.896680,2020-09-14 03:10:45.161986,Le grand,Electronics
12,AFZB4DKIMOXC5FAKTOFW3EJBJZTA,"July 30, 2020",Ce sont mes bandes dessinés préféré merci !,Excellent pour garder l esprit jeune,yes,0,5.0,https://www.amazon.ca/Lucky-Luke-2016-Belle-province/dp/2884713808/ref=cm_cr_srp_d_product_top?ie=UTF8,2020-09-14 03:10:52.246394,2020-09-14 03:10:58.555642,Le grand,Electronics
13,AFZB4DKIMOXC5FAKTOFW3EJBJZTA,"July 22, 2020",Pour le prix très bon produit et rapide,Bon portable et de bonne qualité,yes,0,5.0,https://www.amazon.ca/L203MA-DS04-Celeron-Processor-Display-Windows/dp/B07N6S4SY1/ref=cm_cr_srp_d_product_top?ie=UTF8,2020-09-14 03:11:05.660099,2020-09-14 03:11:12.958640,Le grand,Electronics
14,AFZB4DKIMOXC5FAKTOFW3EJBJZTA,"July 22, 2020",Je porte ça quotidiennement alors il faut que ce soit durable,Encore la très confortable en tout temps,yes,0,5.0,https://www.amazon.ca/Wrangler-Authentics-Comfort-Waist-Relaxed/dp/B07YH1LV6L/ref=cm_cr_srp_d_product_top?ie=UTF8,2020-09-14 03:11:22.056876,2020-09-14 03:11:28.357184,Le grand,Electronics
15,AFZB4DKIMOXC5FAKTOFW3EJBJZTA,"July 22, 2020",Bon rapport qualité prix,Des aventures captivantes très intéressant,yes,0,5.0,https://www.amazon.ca/TINTIN-T-08-SCEPTRE-DOTTOKAR-HERG%C3%89/dp/2203001844/ref=cm_cr_srp_d_product_top?ie=UTF8,2020-09-14 03:11:35.471211,2020-09-14 03:11:41.743479,Le grand,Electronics
16,AFZB4DKIMOXC5FAKTOFW3EJBJZTA,"July 22, 2020",Bon rapport qualité prix,Très confortable et séchage rapide merci !,yes,0,5.0,https://www.amazon.ca/QRANSS-Bathing-Striped-Pockets-X-Large/dp/B075MZHP7C/ref=cm_cr_srp_d_product_top?ie=UTF8,2020-09-14 03:11:50.864271,2020-09-14 03:11:57.143371,Le grand,Electronics
17,AFZB4DKIMOXC5FAKTOFW3EJBJZTA,"July 10, 2020",Pour le prix elle sont imbattable,Je les porte présentement elle sont confortable !,yes,0,5.0,https://www.amazon.ca/Wrangler-Authentics-Classic-5-Pocket-Regular/dp/B074KHV2C5/ref=cm_cr_srp_d_product_top?ie=UTF8,2020-09-14 03:12:07.240438,2020-09-14 03:12:14.558753,Le grand,Electronics
18,AFZB4DKIMOXC5FAKTOFW3EJBJZTA,"July 10, 2020",Bien content de l utilisation !,Avec un jeans c est l idéal !,yes,0,5.0,https://www.amazon.ca/Tommy-Hilfiger-Reversible-Polished-Nickel/dp/B00EYATQV6/ref=cm_cr_srp_d_product_top?ie=UTF8,2020-09-14 03:12:21.656316,2020-09-14 03:12:27.938407,Le grand,Electronics
19,AFZB4DKIMOXC5FAKTOFW3EJBJZTA,"July 10, 2020",Pour le prix il est bon,Je l ai branché sur ma tablette c est bien !,yes,0,5.0,https://www.amazon.ca/Bluetooth-Portable-Microphone-Waterproof-Handsfree/dp/B07NVF8DD4/ref=cm_cr_srp_d_product_top?ie=UTF8,2020-09-14 03:12:37.045343,2020-09-14 03:12:44.405118,Le grand,Electronics
20,AFZB4DKIMOXC5FAKTOFW3EJBJZTA,"July 10, 2020",Et aussi bon pour tout les âges,Ça me garde l esprit jeune !,yes,0,5.0,https://www.amazon.ca/OB%C3%89LIX-COMPAGNIE-REN%C3%89-GOSCINNY/dp/2012101550/ref=cm_cr_srp_d_product_top?ie=UTF8,2020-09-14 03:12:52.491661,2020-09-14 03:12:58.743095,Le grand,Electronics
21,AFZB4DKIMOXC5FAKTOFW3EJBJZTA,"March 3, 2020",Bon en tout temps et très pratique,Tout mes éléments informatique y font c est super,yes,0,5.0,https://www.amazon.ca/International-Carry-Rainproof-Backpack-laptop/dp/B00SF8KY8C/ref=cm_cr_srp_d_product_top?ie=UTF8,2020-09-14 03:13:07.846588,2020-09-14 03:13:17.147422,Le grand,Electronics
22,AFZB4DKIMOXC5FAKTOFW3EJBJZTA,"March 3, 2020",Bon rapport qualité prix,Très confortable et chaud en tout temps,yes,0,5.0,https://www.amazon.ca/Hanes-Mens-Champion-Performance-White/dp/B075X6MC2H/ref=cm_cr_srp_d_product_top?ie=UTF8,2020-09-14 03:13:25.241427,2020-09-14 03:13:33.544429,Le grand,Electronics
23,AFZB4DKIMOXC5FAKTOFW3EJBJZTA,"March 1, 2020",Un groupe avec de la classe,C est un incontournable de la musique rock on se tanne pas de l écouter,yes,0,5.0,https://www.amazon.ca/Greatest-Hits-Journey/dp/B000G7PNKO/ref=cm_cr_srp_d_product_top?ie=UTF8,2020-09-14 03:13:42.658024,2020-09-14 03:13:51.960712,Le grand,Electronics
24,AFZB4DKIMOXC5FAKTOFW3EJBJZTA,"February 13, 2020",Pour le prix il est imbattable,Il est pratique et génial,yes,0,5.0,https://www.amazon.ca/Larousse-poche-2020-Collectif/dp/2035972752/ref=cm_cr_srp_d_product_top?ie=UTF8,2020-09-14 03:14:00.053616,2020-09-14 03:14:09.338313,Le grand,Electronics
25,AFZB4DKIMOXC5FAKTOFW3EJBJZTA,"January 2, 2020",Très légère a porter cool !,Tuque chaude comme les froid d hiver au Minnesota,yes,0,5.0,https://www.amazon.ca/Minnesota-Vikings-Male-OTS-Black/dp/B07CH8VPCX/ref=cm_cr_srp_d_product_top?ie=UTF8,2020-09-14 03:14:19.416388,2020-09-14 03:14:25.732956,Le grand,Electronics
26,AFZB4DKIMOXC5FAKTOFW3EJBJZTA,"December 26, 2019",On se trompe pas avec Logitech,Bien content de ma souris fonctionne bien,yes,0,5.0,https://www.amazon.ca/Logitech-Compact-Bluetooth-Mouse-910-004529/dp/B0148NPJ3W/ref=cm_cr_srp_d_product_top?ie=UTF8,2020-09-14 03:14:35.857602,2020-09-14 03:14:43.170018,Le grand,Electronics
27,AFZB4DKIMOXC5FAKTOFW3EJBJZTA,"December 18, 2019",Très bon rapport qualité prix,Bon chandail couleur vivante merci,yes,0,5.0,https://www.amazon.ca/Hanes-EcoSmart-Fleece-Sweatshirt-Kelly/dp/B072K657GP/ref=cm_cr_srp_d_product_top?ie=UTF8,2020-09-14 03:14:52.255060,2020-09-14 03:15:01.503042,Le grand,Electronics
28,AFZB4DKIMOXC5FAKTOFW3EJBJZTA,"December 18, 2019",Pour le prix c est imbattable,Très content de mon radio fonctionne bien merci,yes,0,5.0,https://www.amazon.ca/Emerson-SmartSet-Dimmer-Display-CKS1900/dp/B07FTHL5PF/ref=cm_cr_srp_d_product_top?ie=UTF8,2020-09-14 03:15:09.595248,2020-09-14 03:15:18.886107,Le grand,Electronics
29,AFZB4DKIMOXC5FAKTOFW3EJBJZTA,"December 18, 2019",Du classique de qualité,Elle fut très contente de la musique merci,yes,0,5.0,https://www.amazon.ca/Ludovico-Einaudi-Portrait-Ang%C3%A8le-Dubeau/dp/B00S2XHDHU/ref=cm_cr_srp_d_product_top?ie=UTF8,2020-09-14 03:15:26.996060,2020-09-14 03:15:34.288071,Le grand,Electronics
30,AFZB4DKIMOXC5FAKTOFW3EJBJZTA,"December 18, 2019",Bon rapport qualité prix cool !,Bien content de l achat pantoufle très confortable merci !,yes,0,5.0,https://www.amazon.ca/Isotoner-Corduroy-Infused-Moccasin-9-5-10-5/dp/B01IP7RRKU/ref=cm_cr_srp_d_product_top?ie=UTF8,2020-09-14 03:15:42.375277,2020-09-14 03:15:50.656239,Le grand,Electronics
31,AFZB4DKIMOXC5FAKTOFW3EJBJZTA,"December 5, 2019",A prix modique c est super,Très content de mes petit gilet ils sont très utiles merci,yes,0,5.0,https://www.amazon.ca/Gildan-Mens-T-Shirt-White-X-Large/dp/B077ZL5935/ref=cm_cr_srp_d_product_top?ie=UTF8,2020-09-14 03:15:58.751200,2020-09-14 03:16:06.025257,Le grand,Electronics
32,AFZB4DKIMOXC5FAKTOFW3EJBJZTA,"December 5, 2019",Encore la bon rapport qualité prix,Je suis très content de mes bas polaire très confortable et chaud pour les froid d hiver merci,yes,0,5.0,https://www.amazon.ca/YUEDGE-Wicking-Cushion-Outdoor-Athletic/dp/B07K76WPNN/ref=cm_cr_srp_d_product_top?ie=UTF8,2020-09-14 03:16:15.122091,2020-09-14 03:16:23.477289,Le grand,Electronics
33,AFZB4DKIMOXC5FAKTOFW3EJBJZTA,"December 5, 2019",Un jouet a bon rapport qualité prix,Je vous dit qu' elle est contente elle se pense propriétaire d un véhicule merci,yes,0,5.0,https://www.amazon.ca/B-toys-Battat-Funkeys-Lights/dp/B06Y5KWDMR/ref=cm_cr_srp_d_product_top?ie=UTF8,2020-09-14 03:16:33.596577,2020-09-14 03:16:42.894514,Le grand,Electronics
34,AFZB4DKIMOXC5FAKTOFW3EJBJZTA,"December 5, 2019",Léger et confortable,Idéal pour les froid d hiver garde au chaud merci,yes,0,5.0,https://www.amazon.ca/JoofEric-Thermal-Underwear-Fleece-Drying/dp/B07GZMC1DQ/ref=cm_cr_srp_d_product_top?ie=UTF8,2020-09-14 03:16:52.990693,2020-09-14 03:17:00.250377,Le grand,Electronics
35,AFZB4DKIMOXC5FAKTOFW3EJBJZTA,"November 3, 2019",Bon rapport qualité prix,Très content pour le prix super,yes,0,5.0,https://www.amazon.ca/Jerzees-Adult-Sleeve-Heather-X-Large/dp/B00T7TYC7W/ref=cm_cr_srp_d_product_top?ie=UTF8,2020-09-14 03:17:07.387895,2020-09-14 03:17:13.657735,Le grand,Electronics
36,AFZB4DKIMOXC5FAKTOFW3EJBJZTA,"November 3, 2019",Bon rapport qualité prix,Bon produit chaude tuque,yes,0,5.0,https://www.amazon.ca/Toronto-Raptors-OTS-Huset-Color/dp/B07QZJVXZW/ref=cm_cr_srp_d_product_top?ie=UTF8,2020-09-14 03:17:23.770442,2020-09-14 03:17:31.067144,Le grand,Electronics
37,AFZB4DKIMOXC5FAKTOFW3EJBJZTA,"September 14, 2019",Chaud pour l hiver aussi,idéal aussi pour nos automnes québécois,yes,0,5.0,https://www.amazon.ca/NFL-OTS-Raised-Cuff-Knit/dp/B0725B5R7C/ref=cm_cr_srp_d_product_top?ie=UTF8,2020-09-14 03:17:41.170352,2020-09-14 03:17:47.404726,Le grand,Electronics
38,AFZB4DKIMOXC5FAKTOFW3EJBJZTA,"September 14, 2019",Un tissu en coton résistant,Il est confortable je suis a l aise avec,yes,0,5.0,https://www.amazon.ca/England-Patriots-T-Shirt-Raglan-X-Large/dp/B01MRKZUML/ref=cm_cr_srp_d_product_top?ie=UTF8,2020-09-14 03:17:54.487044,2020-09-14 03:18:01.729214,Le grand,Electronics
39,AFZB4DKIMOXC5FAKTOFW3EJBJZTA,"September 14, 2019",Je la porte quotidiennement,La casquette me va très bien et facilement ajustable,yes,0,5.0,https://www.amazon.ca/Minnesota-Vikings-OTS-All-Star-Adjustable/dp/B07CJTSMG3/ref=cm_cr_srp_d_product_top?ie=UTF8,2020-09-14 03:18:10.845400,2020-09-14 03:18:17.139162,Le grand,Electronics
40,AFZB4DKIMOXC5FAKTOFW3EJBJZTA,"August 9, 2019",Un incontournable a avoir en main,Un de mes groupe rock prefere quand j était adolescent,yes,0,5.0,https://www.amazon.ca/Equinox-Crystal-Ball-Styx/dp/B000E0VL2M/ref=cm_cr_srp_d_product_top?ie=UTF8,2020-09-14 03:18:27.230372,2020-09-14 03:18:34.546165,Le grand,Electronics
41,AFZB4DKIMOXC5FAKTOFW3EJBJZTA,"August 9, 2019",Un classic de la musique rock,De bon compositeur qui me font vibrer par leur musique,yes,0,5.0,https://www.amazon.ca/Greatest-Hits-Live-Foreigner/dp/B00WVQQTBK/ref=cm_cr_srp_d_product_top?ie=UTF8,2020-09-14 03:18:42.655493,2020-09-14 03:18:48.999552,Le grand,Electronics
42,AFZB4DKIMOXC5FAKTOFW3EJBJZTA,"August 9, 2019",Un incontournable a avoir en main,Je suis très satisfait de cet album de green Day merci,yes,0,5.0,https://www.amazon.ca/Insomniac-Green-Day/dp/B000002N2P/ref=cm_cr_srp_d_product_top?ie=UTF8,2020-09-14 03:18:58.109383,2020-09-14 03:19:06.448885,Le grand,Electronics
43,AFZB4DKIMOXC5FAKTOFW3EJBJZTA,"July 18, 2019",D une utilité quotidienne,Pour le prix et un choix très variés c est idéal,yes,0,5.0,https://www.amazon.ca/Crayola-Coloured-Pre-sharpened-Colouring-Journaling/dp/B00CMM906E/ref=cm_cr_srp_d_product_top?ie=UTF8,2020-09-14 03:19:13.576354,2020-09-14 03:19:19.986475,Le grand,Electronics
44,AFZB4DKIMOXC5FAKTOFW3EJBJZTA,"July 18, 2019",Très bon prix et bonne qualité sonore rock,C est du bon rock et un bon divertissement musicale,yes,One,5.0,https://www.amazon.ca/Minutes-Midnight-Linkin-Park/dp/B000OCXMAE/ref=cm_cr_srp_d_product_top?ie=UTF8,2020-09-14 03:19:30.112949,2020-09-14 03:19:38.498850,Le grand,Electronics
45,AFZB4DKIMOXC5FAKTOFW3EJBJZTA,"July 11, 2019",Pour le prix on peut pas trouver mieux,Très pratique encore la facile de rangement,yes,0,5.0,https://www.amazon.ca/Fuller-Tool-997-8160-160-Piece-Repair/dp/B000BDDGT8/ref=cm_cr_srp_d_product_top?ie=UTF8,2020-09-14 03:19:48.595217,2020-09-14 03:19:56.879690,Le grand,Electronics
46,AFZB4DKIMOXC5FAKTOFW3EJBJZTA,"July 11, 2019",D une utilité quotidienne,Très pratique je le traîne partout avec moi bon rapport qualité prix,yes,0,5.0,https://www.amazon.ca/LAROUSSE-POCHE-2019-COLLECTIF/dp/2035950376/ref=cm_cr_srp_d_product_top?ie=UTF8,2020-09-14 03:20:03.972874,2020-09-14 03:20:13.237451,Le grand,Electronics
47,AFZB4DKIMOXC5FAKTOFW3EJBJZTA,"June 20, 2019",Aussi ils tiennent bien à l oreille,A ce prix là on ne peut se permettre de s en passer,yes,0,5.0,https://www.amazon.ca/Bose-SoundSport-Ear-Headphones-Charcoal/dp/B0117RFPCC/ref=cm_cr_srp_d_product_top?ie=UTF8,2020-09-14 03:20:23.322420,2020-09-14 03:20:30.587259,Le grand,Electronics
48,AFZB4DKIMOXC5FAKTOFW3EJBJZTA,"June 20, 2019",Bon rapport qualité prix,J aime bien la musique d aujourd'hui et Justin Timberlake en est un très bon exemple,yes,0,5.0,https://www.amazon.ca/Man-Woods-Justin-Timberlake/dp/B0788YMYFV/ref=cm_cr_srp_d_product_top?ie=UTF8,2020-09-14 03:20:40.679988,2020-09-14 03:20:48.936398,Le grand,Electronics
49,AFZB4DKIMOXC5FAKTOFW3EJBJZTA,"June 6, 2019",D une utilité quotidienne,Pour un bureau informatique portatif c est l idéal,yes,0,5.0,https://www.amazon.ca/dp/B07G34ZHWM/ref=cm_cr_srp_d_product_top?ie=UTF8,2020-09-14 03:20:59.014252,2020-09-14 03:21:07.300206,Le grand,Electronics
50,AFZB4DKIMOXC5FAKTOFW3EJBJZTA,"June 6, 2019",Un incontournable a avoir en main,Un des bon groupe d aujourd'hui l écoute est agréable,yes,0,5.0,https://www.amazon.ca/Red-Pill-Blues-Maroon-5/dp/B0722H45HF/ref=cm_cr_srp_d_product_top?ie=UTF8,2020-09-14 03:21:14.401819,2020-09-14 03:21:23.675655,Le grand,Electronics
51,AFZB4DKIMOXC5FAKTOFW3EJBJZTA,"May 15, 2019",A un prix très abordable,C est un cd agréable à écouter,yes,0,5.0,https://www.amazon.ca/24K-Magic-Bruno-Mars/dp/B01LYRM74T/ref=cm_cr_srp_d_product_top?ie=UTF8,2020-09-14 03:21:32.764164,2020-09-14 03:21:40.039500,Le grand,Electronics
52,AFZB4DKIMOXC5FAKTOFW3EJBJZTA,"May 15, 2019",A un prix très abordable,J étais serrer dans mon stockage et 64 go est la meilleure solution merci,yes,0,5.0,https://www.amazon.ca/Kingston-Digital-64GB-microSDXC-Adapter/dp/B079GVC5B8/ref=cm_cr_srp_d_product_top?ie=UTF8,2020-09-14 03:21:47.135921,2020-09-14 03:21:54.419480,Le grand,Electronics
53,AFZB4DKIMOXC5FAKTOFW3EJBJZTA,"May 9, 2019",Un incontournable a avoir en main,On se trompe pas avec les foo fighters très bon rock d aujourd'hui merci,yes,0,5.0,https://www.amazon.ca/Wasting-Light-Foo-Fighters/dp/B004LUHQ1G/ref=cm_cr_srp_d_product_top?ie=UTF8,2020-09-14 03:22:02.517742,2020-09-14 03:22:10.803551,Le grand,Electronics
54,AFZB4DKIMOXC5FAKTOFW3EJBJZTA,"May 9, 2019",Très bon rapport qualité prix,Un des bon album du rock moderne que j au entendu merci,yes,0,5.0,https://www.amazon.ca/Stage-Deluxe-2CD-Avenged-Sevenfold/dp/B076BJMG38/ref=cm_cr_srp_d_product_top?ie=UTF8,2020-09-14 03:22:20.902288,2020-09-14 03:22:28.170116,Le grand,Electronics
55,AFZB4DKIMOXC5FAKTOFW3EJBJZTA,"May 9, 2019",A un prix très abordable,Ce sac pour ma tablette m est vraiment indispensable merci,yes,0,5.0,https://www.amazon.ca/AmazonBasics-11-6-Inch-Laptop-Tablet-Bag/dp/B00DUGZFA6/ref=cm_cr_srp_d_product_top?ie=UTF8,2020-09-14 03:22:38.267060,2020-09-14 03:22:45.571624,Le grand,Electronics
56,AFZB4DKIMOXC5FAKTOFW3EJBJZTA,"May 9, 2019",Un classic de la musique rock,C est un excellent cd des années 70 très fiers de cet achat merci,yes,0,5.0,https://www.amazon.ca/Emerson-Lake-Palmer-EMERSON-PALMER/dp/B01H2ROWP2/ref=cm_cr_srp_d_product_top?ie=UTF8,2020-09-14 03:22:54.667276,2020-09-14 03:23:00.965756,Le grand,Electronics
57,AFZB4DKIMOXC5FAKTOFW3EJBJZTA,"April 17, 2019",A un prix très abordable,On retrouve tous les succès de Rush sur ces 2 cd excellent,yes,0,5.0,https://www.amazon.ca/Gold-Rm-2CD-Rush/dp/B000FCVYL2/ref=cm_cr_srp_d_product_top?ie=UTF8,2020-09-14 03:23:09.061943,2020-09-14 03:23:18.384713,Le grand,Electronics
58,AFZB4DKIMOXC5FAKTOFW3EJBJZTA,"April 17, 2019",D une utilité quotidienne,Également très léger et adorable rangement facile,yes,One,5.0,https://www.amazon.ca/Crossbody-purses-SOGOLA-holder-Smartphone/dp/B07CVXCBNG/ref=cm_cr_srp_d_product_top?ie=UTF8,2020-09-14 03:23:27.479074,2020-09-14 03:23:35.781606,Le grand,Electronics
59,AFZB4DKIMOXC5FAKTOFW3EJBJZTA,"April 17, 2019",D une utilité quotidienne,Il est pratique et léger se transporte bien,yes,0,5.0,https://www.amazon.ca/Brainwavz-Large-Hard-Headphone-Case/dp/B00HPPI0W8/ref=cm_cr_srp_d_product_top?ie=UTF8,2020-09-14 03:23:44.873326,2020-09-14 03:23:51.127812,Le grand,Electronics
