,subproduct_author_id,verified_purchase,review_title,reviews,date,reviewer_name,ratings,people_find_helpful,reviewer_profile_url,start_time,end_time,product_name,brand_name,rank,product_id,author_id
204,AGS2E5HNU67NF546OUXZ64BXUZKA,True,and goodness are they both comfortable and warm,"The price is right, the fit is right, and goodness are they both comfortable and warm! this is a great product that I have been wearing all winter long recommended for sure!","January 13, 2017",Kenny J Webber,5.0,0,https://www.amazon.ca/gp/profile/amzn1.account.AGS2E5HNU67NF546OUXZ64BXUZKA/ref=cm_cr_getr_d_gw_btm?ie=UTF8,2020-09-21 09:30:54.061975,2020-09-21 09:30:54.208375,Duofold Men's Mid Weight Wicking Thermal Pant,No,"1,117",B002G9UDYG,AEA5FEQDBSIAM5QBLPN32JBRFDQA
205,AFPVPAN3YS3DCVUTYTKY7MBO74QA,True,Two Stars,They’re not big enough. Uncomfortable.,"January 31, 2018",Amazon Customer,2.0,0,https://www.amazon.ca/gp/profile/amzn1.account.AFPVPAN3YS3DCVUTYTKY7MBO74QA/ref=cm_cr_getr_d_gw_btm?ie=UTF8,2020-09-21 09:30:54.212279,2020-09-21 09:30:54.329398,Duofold Men's Mid Weight Wicking Thermal Pant,No,"1,117",B002G9UDYG,AEA5FEQDBSIAM5QBLPN32JBRFDQA
206,AFMYDA5FKVCGZJVQCVIZY6PFY7EQ,True,Perfect,Top shelf,"October 21, 2018",Jevin A ,5.0,0,https://www.amazon.ca/gp/profile/amzn1.account.AFMYDA5FKVCGZJVQCVIZY6PFY7EQ/ref=cm_cr_getr_d_gw_btm?ie=UTF8,2020-09-21 09:30:54.333303,2020-09-21 09:30:54.480678,Duofold Men's Mid Weight Wicking Thermal Pant,No,"1,117",B002G9UDYG,AEA5FEQDBSIAM5QBLPN32JBRFDQA
207,AGN2FG2FQ2ADBOCY34PSO7M5W4FA,True,One Star,Good quality but it's toi big for even I ordered small. Disappointed.,"August 3, 2016",Joseph R.,1.0,0,https://www.amazon.ca/gp/profile/amzn1.account.AGN2FG2FQ2ADBOCY34PSO7M5W4FA/ref=cm_cr_getr_d_gw_btm?ie=UTF8,2020-09-21 09:30:54.484582,2020-09-21 09:30:54.600726,Duofold Men's Mid Weight Wicking Thermal Pant,No,"1,117",B002G9UDYG,AEA5FEQDBSIAM5QBLPN32JBRFDQA
208,AG3FEUAYEX6N3USFWKMECJ7U7IIA,True,It is nice and size is good,Since long I was looking for white thermal. It is nice and size is good.,"August 5, 2017",IRFAN SYED ALI,4.0,0,https://www.amazon.ca/gp/profile/amzn1.account.AG3FEUAYEX6N3USFWKMECJ7U7IIA/ref=cm_cr_getr_d_gw_btm?ie=UTF8,2020-09-21 09:30:54.604630,2020-09-21 09:30:54.723701,Duofold Men's Mid Weight Wicking Thermal Pant,No,"1,117",B002G9UDYG,AEA5FEQDBSIAM5QBLPN32JBRFDQA
209,AE4QVR5ZNAJV7VFK5KQE4RDI77HQ,True,Really nice!,Bought for my husband for Christmas as he is always cold. These keep him warm and he says they are comfortable!,"December 28, 2016",Mamabear3,5.0,0,https://www.amazon.ca/gp/profile/amzn1.account.AE4QVR5ZNAJV7VFK5KQE4RDI77HQ/ref=cm_cr_getr_d_gw_btm?ie=UTF8,2020-09-21 09:30:54.727605,2020-09-21 09:30:54.880838,Duofold Men's Mid Weight Wicking Thermal Pant,No,"1,117",B002G9UDYG,AEA5FEQDBSIAM5QBLPN32JBRFDQA
210,AGVI6F2M3PNJLAVFH7KTL2O73URQ,True,Five Stars,great for those cold mornings.,"January 26, 2018",Robert Jones,5.0,0,https://www.amazon.ca/gp/profile/amzn1.account.AGVI6F2M3PNJLAVFH7KTL2O73URQ/ref=cm_cr_getr_d_gw_btm?ie=UTF8,2020-09-21 09:30:57.996076,2020-09-21 09:30:58.151259,Duofold Men's Mid Weight Wicking Thermal Pant,No,"1,117",B002G9UDYG,AEA5FEQDBSIAM5QBLPN32JBRFDQA
211,AHNK5TQ5OTX5N36FQFWOMCPWJUXQ,True,Snug,"Fit a little snug, but overall they're good. Would order them again, just a size bigger.","November 4, 2017",Louise C.,3.0,0,https://www.amazon.ca/gp/profile/amzn1.account.AHNK5TQ5OTX5N36FQFWOMCPWJUXQ/ref=cm_cr_getr_d_gw_btm?ie=UTF8,2020-09-21 09:30:58.155163,2020-09-21 09:30:58.268379,Duofold Men's Mid Weight Wicking Thermal Pant,No,"1,117",B002G9UDYG,AEA5FEQDBSIAM5QBLPN32JBRFDQA
212,AHI4RIGJPX4M3IPIMMHFQGJFLPDQ,True,V comfortable,Husband thinks it's comfortable and warm. He wants to buy it in the other colors as well.,"February 2, 2017",Amazon Customer,5.0,0,https://www.amazon.ca/gp/profile/amzn1.account.AHI4RIGJPX4M3IPIMMHFQGJFLPDQ/ref=cm_cr_getr_d_gw_btm?ie=UTF8,2020-09-21 09:30:58.272283,2020-09-21 09:30:58.392331,Duofold Men's Mid Weight Wicking Thermal Pant,No,"1,117",B002G9UDYG,AEA5FEQDBSIAM5QBLPN32JBRFDQA
213,AGA5T2N4Y4ML6TDX4RLZEF3KFVMQ,True,Three Stars,Thicker than expected. Truly a mid weight pant,"February 21, 2018",Sylvie-Anne,3.0,0,https://www.amazon.ca/gp/profile/amzn1.account.AGA5T2N4Y4ML6TDX4RLZEF3KFVMQ/ref=cm_cr_getr_d_gw_btm?ie=UTF8,2020-09-21 09:30:58.396234,2020-09-21 09:30:58.540682,Duofold Men's Mid Weight Wicking Thermal Pant,No,"1,117",B002G9UDYG,AEA5FEQDBSIAM5QBLPN32JBRFDQA
214,AHVHD3Q54F524454XBSBVXK6FBOA,True,Exactly what I wanted and as described.,Exactly what I wanted. The product came as promised and exactly as described.,"February 10, 2018",Reader,5.0,0,https://www.amazon.ca/gp/profile/amzn1.account.AHVHD3Q54F524454XBSBVXK6FBOA/ref=cm_cr_getr_d_gw_btm?ie=UTF8,2020-09-21 09:30:58.544586,2020-09-21 09:30:58.663658,Duofold Men's Mid Weight Wicking Thermal Pant,No,"1,117",B002G9UDYG,AEA5FEQDBSIAM5QBLPN32JBRFDQA
215,AHYPRGHPC66FJT7U5SXYOLJWSK5Q,True,Medium is too short. Should have bought large.,Size not really fits. Should buy one size bigger.,"March 31, 2020",Shahan,4.0,0,https://www.amazon.ca/gp/profile/amzn1.account.AHYPRGHPC66FJT7U5SXYOLJWSK5Q/ref=cm_cr_getr_d_gw_btm?ie=UTF8,2020-09-21 09:30:58.667562,2020-09-21 09:30:58.816889,Duofold Men's Mid Weight Wicking Thermal Pant,No,"1,117",B002G9UDYG,AEA5FEQDBSIAM5QBLPN32JBRFDQA
216,AGD4BDQVSMTF654KJMQA3XK66HXA,True,Five Stars,Fits good,"December 19, 2017",Betsy Gerrits,5.0,0,https://www.amazon.ca/gp/profile/amzn1.account.AGD4BDQVSMTF654KJMQA3XK66HXA/ref=cm_cr_getr_d_gw_btm?ie=UTF8,2020-09-21 09:30:58.820793,2020-09-21 09:30:58.939866,Duofold Men's Mid Weight Wicking Thermal Pant,No,"1,117",B002G9UDYG,AEA5FEQDBSIAM5QBLPN32JBRFDQA
217,AH5PYEISBC4S5WTNJFFU25H2NULQ,True,Grandpa Underwear?,"Groin area is too largd, almost looks like grand pa underwear. For $15 i would expect better fit. Material was good and comfy. I am returning this product.","March 14, 2017",Sultan,1.0,0,https://www.amazon.ca/gp/profile/amzn1.account.AH5PYEISBC4S5WTNJFFU25H2NULQ/ref=cm_cr_getr_d_gw_btm?ie=UTF8,2020-09-21 09:30:58.943769,2020-09-21 09:30:59.064793,Duofold Men's Mid Weight Wicking Thermal Pant,No,"1,117",B002G9UDYG,AEA5FEQDBSIAM5QBLPN32JBRFDQA
218,AGIW5YKG5KKQPUBNHFFTZ6MFLOJQ,True,Recommended,Husband likes it.,"December 13, 2018",Amazon Customer,5.0,0,https://www.amazon.ca/gp/profile/amzn1.account.AGIW5YKG5KKQPUBNHFFTZ6MFLOJQ/ref=cm_cr_getr_d_gw_btm?ie=UTF8,2020-09-21 09:30:59.068696,2020-09-21 09:30:59.214121,Duofold Men's Mid Weight Wicking Thermal Pant,No,"1,117",B002G9UDYG,AEA5FEQDBSIAM5QBLPN32JBRFDQA
219,AHIHKLNMWK5AP4Q7XSFJABQDDRFA,True,Like wearing parachute pants,Way too much empty space for the boys.,"December 8, 2018",Cody,1.0,0,https://www.amazon.ca/gp/profile/amzn1.account.AHIHKLNMWK5AP4Q7XSFJABQDDRFA/ref=cm_cr_getr_d_gw_btm?ie=UTF8,2020-09-21 09:30:59.217048,2020-09-21 09:30:59.334168,Duofold Men's Mid Weight Wicking Thermal Pant,No,"1,117",B002G9UDYG,AEA5FEQDBSIAM5QBLPN32JBRFDQA
220,AGMWCNVMUTWZEABI7JHOAMEZGDCQ,True,Perfect fit and very warm.,These fit perfect. I'm 190 pounds and 6 feet tall. These wrapped around my lower body and kept me warm so perfect thanks.,"September 6, 2017",Amazon Customer,5.0,0,https://www.amazon.ca/gp/profile/amzn1.account.AGMWCNVMUTWZEABI7JHOAMEZGDCQ/ref=cm_cr_getr_d_gw_btm?ie=UTF8,2020-09-21 09:31:02.460626,2020-09-21 09:31:02.593362,Duofold Men's Mid Weight Wicking Thermal Pant,No,"1,117",B002G9UDYG,AEA5FEQDBSIAM5QBLPN32JBRFDQA
221,AH4YKEP66DQ5GHUGW4EVH2KCHMZQ,True,Great fit & kept me warm,Really nice fit on these pants. Used them as a thermal layer on a skiing trip and they kept me warm all day in -20 weather.,"February 16, 2017",AP,5.0,0,https://www.amazon.ca/gp/profile/amzn1.account.AH4YKEP66DQ5GHUGW4EVH2KCHMZQ/ref=cm_cr_getr_d_gw_btm?ie=UTF8,2020-09-21 09:31:02.598241,2020-09-21 09:31:02.725122,Duofold Men's Mid Weight Wicking Thermal Pant,No,"1,117",B002G9UDYG,AEA5FEQDBSIAM5QBLPN32JBRFDQA
222,AG7Z5MQ4EMSLM4MJTRP6WR7A4IHQ,True,Very good produce,"They are very smooth, easy to wear, and warm for moderately cold weather (-5C to -12C). If you are 6', you need a large size.","February 15, 2017",Kholio,5.0,0,https://www.amazon.ca/gp/profile/amzn1.account.AG7Z5MQ4EMSLM4MJTRP6WR7A4IHQ/ref=cm_cr_getr_d_gw_btm?ie=UTF8,2020-09-21 09:31:02.730002,2020-09-21 09:31:02.885184,Duofold Men's Mid Weight Wicking Thermal Pant,No,"1,117",B002G9UDYG,AEA5FEQDBSIAM5QBLPN32JBRFDQA
223,AEJJNJU4KMBT7U7WHCZEAQFCNUKQ,True,Material is very soft,Just bought it will see how it gives the result after first wash otherwise very good fit and warm as well,"January 17, 2019",rukhsana,5.0,0,https://www.amazon.ca/gp/profile/amzn1.account.AEJJNJU4KMBT7U7WHCZEAQFCNUKQ/ref=cm_cr_getr_d_gw_btm?ie=UTF8,2020-09-21 09:31:02.889089,2020-09-21 09:31:03.004256,Duofold Men's Mid Weight Wicking Thermal Pant,No,"1,117",B002G9UDYG,AEA5FEQDBSIAM5QBLPN32JBRFDQA
224,AHOCVZ4QPIEF3XWBEEGSTV2Q3WVQ,True,it has a nice feel. Recommended,"warm and cozy, it has a nice feel. Recommended!","February 23, 2018",Hassan H,5.0,0,https://www.amazon.ca/gp/profile/amzn1.account.AHOCVZ4QPIEF3XWBEEGSTV2Q3WVQ/ref=cm_cr_getr_d_gw_btm?ie=UTF8,2020-09-21 09:31:03.008161,2020-09-21 09:31:03.129184,Duofold Men's Mid Weight Wicking Thermal Pant,No,"1,117",B002G9UDYG,AEA5FEQDBSIAM5QBLPN32JBRFDQA
225,AEFEG7ZF7FXE64XZ6SXUIVHJBQSA,True,Too short,"My husband is 6' tall and these are way too short, have to return. Quality is ok.","January 17, 2020",Lada,3.0,0,https://www.amazon.ca/gp/profile/amzn1.account.AEFEG7ZF7FXE64XZ6SXUIVHJBQSA/ref=cm_cr_getr_d_gw_btm?ie=UTF8,2020-09-21 09:31:03.133088,2020-09-21 09:31:03.282416,Duofold Men's Mid Weight Wicking Thermal Pant,No,"1,117",B002G9UDYG,AEA5FEQDBSIAM5QBLPN32JBRFDQA
226,AHRNXICVQPFMVP24OTHZQQC7FP2Q,True,Great for winter!,I knew I wouldn't be disappointed! Great pant for Winter!,"November 20, 2018",Henry Xiao,5.0,0,https://www.amazon.ca/gp/profile/amzn1.account.AHRNXICVQPFMVP24OTHZQQC7FP2Q/ref=cm_cr_getr_d_gw_btm?ie=UTF8,2020-09-21 09:31:03.287297,2020-09-21 09:31:03.401488,Duofold Men's Mid Weight Wicking Thermal Pant,No,"1,117",B002G9UDYG,AEA5FEQDBSIAM5QBLPN32JBRFDQA
227,AFBIAOWZZJUU2PZAJA7IY4NDPJEQ,True,Good products meeting expectation,Good protection from cold weather in Toronto,"February 17, 2018",Neil Nath,5.0,0,https://www.amazon.ca/gp/profile/amzn1.account.AFBIAOWZZJUU2PZAJA7IY4NDPJEQ/ref=cm_cr_getr_d_gw_btm?ie=UTF8,2020-09-21 09:31:03.405392,2020-09-21 09:31:03.561551,Duofold Men's Mid Weight Wicking Thermal Pant,No,"1,117",B002G9UDYG,AEA5FEQDBSIAM5QBLPN32JBRFDQA
228,AHLMFUPJCSW2G76RCNSNNDDA5FBA,True,Five Stars,Very roomy and comfy.,"June 7, 2017",jason safdie,5.0,0,https://www.amazon.ca/gp/profile/amzn1.account.AHLMFUPJCSW2G76RCNSNNDDA5FBA/ref=cm_cr_getr_d_gw_btm?ie=UTF8,2020-09-21 09:31:03.566432,2020-09-21 09:31:03.689407,Duofold Men's Mid Weight Wicking Thermal Pant,No,"1,117",B002G9UDYG,AEA5FEQDBSIAM5QBLPN32JBRFDQA
229,AGTQDTLHHU7EQCGVGW4EUVJ25CIQ,True,Five Stars,tres bon,"January 26, 2018",Amazon Customer,5.0,0,https://www.amazon.ca/gp/profile/amzn1.account.AGTQDTLHHU7EQCGVGW4EUVJ25CIQ/ref=cm_cr_getr_d_gw_btm?ie=UTF8,2020-09-21 09:31:03.692335,2020-09-21 09:31:03.819216,Duofold Men's Mid Weight Wicking Thermal Pant,No,"1,117",B002G9UDYG,AEA5FEQDBSIAM5QBLPN32JBRFDQA
230,AHVN5YYNT4ZBOZ3AT2LSPVQBYCVQ,True,Quality,Price is too high for the quality of the product,"November 28, 2018",Imam Akhand,2.0,0,https://www.amazon.ca/gp/profile/amzn1.account.AHVN5YYNT4ZBOZ3AT2LSPVQBYCVQ/ref=cm_cr_getr_d_gw_btm?ie=UTF8,2020-09-21 09:31:05.965865,2020-09-21 09:31:06.089816,Duofold Men's Mid Weight Wicking Thermal Pant,No,"1,117",B002G9UDYG,AEA5FEQDBSIAM5QBLPN32JBRFDQA
231,AEAPDB242EIGJTJWO2RAYGEP5WRA,True,i would have love to get them in xxx large for a tall ...,i would have love to get them in xxx large for a tall guy like me at lease 48 to 50 waiste,"February 11, 2017",Emery Collette,5.0,0,https://www.amazon.ca/gp/profile/amzn1.account.AEAPDB242EIGJTJWO2RAYGEP5WRA/ref=cm_cr_getr_d_gw_btm?ie=UTF8,2020-09-21 09:31:06.094696,2020-09-21 09:31:06.247928,Duofold Men's Mid Weight Wicking Thermal Pant,No,"1,117",B002G9UDYG,AEA5FEQDBSIAM5QBLPN32JBRFDQA
232,AFTCCX6QHBU5O7YOQT5V2CLNQYNQ,True,Quick shipment and great product.,Fits just right.,"October 10, 2018",Danica,5.0,0,https://www.amazon.ca/gp/profile/amzn1.account.AFTCCX6QHBU5O7YOQT5V2CLNQYNQ/ref=cm_cr_getr_d_gw_btm?ie=UTF8,2020-09-21 09:31:06.252808,2020-09-21 09:31:06.376760,Duofold Men's Mid Weight Wicking Thermal Pant,No,"1,117",B002G9UDYG,AEA5FEQDBSIAM5QBLPN32JBRFDQA
233,AGZNAMBGMA3LEJU4KKOCJBRAKCIA,True,but good product.,"took a few weeks for delivery, but good product.","February 23, 2018",Andrew R Hartery,5.0,0,https://www.amazon.ca/gp/profile/amzn1.account.AGZNAMBGMA3LEJU4KKOCJBRAKCIA/ref=cm_cr_getr_d_gw_btm?ie=UTF8,2020-09-21 09:31:06.380664,2020-09-21 09:31:06.510472,Duofold Men's Mid Weight Wicking Thermal Pant,No,"1,117",B002G9UDYG,AEA5FEQDBSIAM5QBLPN32JBRFDQA
234,AHU7U4ZT3JCN5DIUU6JMR47BIMQA,True,ok,ok,"October 6, 2017",ray y.,4.0,0,https://www.amazon.ca/gp/profile/amzn1.account.AHU7U4ZT3JCN5DIUU6JMR47BIMQA/ref=cm_cr_getr_d_gw_btm?ie=UTF8,2020-09-21 09:31:06.518279,2020-09-21 09:31:06.661751,Duofold Men's Mid Weight Wicking Thermal Pant,No,"1,117",B002G9UDYG,AEA5FEQDBSIAM5QBLPN32JBRFDQA
235,AESTILJDCMGQNELC6L2RVTVA767Q,True,look like more a,realy to small....never wear it...have order a XL ..look like more a small,"December 30, 2016",MHo,2.0,0,https://www.amazon.ca/gp/profile/amzn1.account.AESTILJDCMGQNELC6L2RVTVA767Q/ref=cm_cr_getr_d_gw_btm?ie=UTF8,2020-09-21 09:31:06.664679,2020-09-21 09:31:06.782775,Duofold Men's Mid Weight Wicking Thermal Pant,No,"1,117",B002G9UDYG,AEA5FEQDBSIAM5QBLPN32JBRFDQA
236,AEUI4KFEHNCHMQGAXIXI54Q2S2WA,True,Four Stars,"Good, I like em, not amazing.. but good.","March 10, 2018",Ben Craig,4.0,0,https://www.amazon.ca/gp/profile/amzn1.account.AEUI4KFEHNCHMQGAXIXI54Q2S2WA/ref=cm_cr_getr_d_gw_btm?ie=UTF8,2020-09-21 09:31:06.788632,2020-09-21 09:31:06.945766,Duofold Men's Mid Weight Wicking Thermal Pant,No,"1,117",B002G9UDYG,AEA5FEQDBSIAM5QBLPN32JBRFDQA
237,AE4BI5GCA7I5KVZIL5PPK5KZGGWA,True,Nice,Very comfortable ling underwear a must for Canadian winters.,"November 18, 2016",Amazon Customer,5.0,0,https://www.amazon.ca/gp/profile/amzn1.account.AE4BI5GCA7I5KVZIL5PPK5KZGGWA/ref=cm_cr_getr_d_gw_btm?ie=UTF8,2020-09-21 09:31:06.950646,2020-09-21 09:31:07.068741,Duofold Men's Mid Weight Wicking Thermal Pant,No,"1,117",B002G9UDYG,AEA5FEQDBSIAM5QBLPN32JBRFDQA
238,AGXJTPOTVZACUEU4HEQEUAVOI22A,True,Je m’attendais à avoir un pourcentage de 10 %. ...,Je m’attendais à avoir un pourcentage de 10 %. De laine de Mérinos. Car ce produits est dans ma liste de demande de Mérinos. Donc je suis déçu 😕,"January 11, 2018",Sylvain Bélanger,1.0,0,https://www.amazon.ca/gp/profile/amzn1.account.AGXJTPOTVZACUEU4HEQEUAVOI22A/ref=cm_cr_getr_d_gw_btm?ie=UTF8,2020-09-21 09:31:07.072646,2020-09-21 09:31:07.197574,Duofold Men's Mid Weight Wicking Thermal Pant,No,"1,117",B002G9UDYG,AEA5FEQDBSIAM5QBLPN32JBRFDQA
239,AFLJQL5ML7FLIL634ODSHU44VW5Q,True,"Excellent Buy, worth for money, I recommend this product to all","Will recommend this product to all ,","February 6, 2018",vips,5.0,0,https://www.amazon.ca/gp/profile/amzn1.account.AFLJQL5ML7FLIL634ODSHU44VW5Q/ref=cm_cr_getr_d_gw_btm?ie=UTF8,2020-09-21 09:31:07.207335,2020-09-21 09:31:07.353734,Duofold Men's Mid Weight Wicking Thermal Pant,No,"1,117",B002G9UDYG,AEA5FEQDBSIAM5QBLPN32JBRFDQA
240,AFWWQQJ5KZHA43L2SA54U4C5GOTQ,True,Five Stars,They are very comfortable to wear and they keep me warm in the winter. I definitely would recommend buying!,"January 6, 2017",Amazon Customer,5.0,0,https://www.amazon.ca/gp/profile/amzn1.account.AFWWQQJ5KZHA43L2SA54U4C5GOTQ/ref=cm_cr_getr_d_gw_btm?ie=UTF8,2020-09-21 09:31:13.490019,2020-09-21 09:31:13.666675,Duofold Men's Mid Weight Wicking Thermal Pant,No,"1,117",B002G9UDYG,AEA5FEQDBSIAM5QBLPN32JBRFDQA
241,AG3MYR6U3SLIPYF4DDLJVPVC7O7A,True,good,"Med fits well for me (34W,32L jeans). very warm. good price","February 4, 2017",Tim,5.0,0,https://www.amazon.ca/gp/profile/amzn1.account.AG3MYR6U3SLIPYF4DDLJVPVC7O7A/ref=cm_cr_getr_d_gw_btm?ie=UTF8,2020-09-21 09:31:13.670579,2020-09-21 09:31:13.794530,Duofold Men's Mid Weight Wicking Thermal Pant,No,"1,117",B002G9UDYG,AEA5FEQDBSIAM5QBLPN32JBRFDQA
242,AE2SKUD6ISEKWLYSA3JPIA2OPFLQ,True,Great,Love it,"April 20, 2019",Amazon Customer,4.0,0,https://www.amazon.ca/gp/profile/amzn1.account.AE2SKUD6ISEKWLYSA3JPIA2OPFLQ/ref=cm_cr_getr_d_gw_btm?ie=UTF8,2020-09-21 09:31:13.803314,2020-09-21 09:31:13.944833,Duofold Men's Mid Weight Wicking Thermal Pant,No,"1,117",B002G9UDYG,AEA5FEQDBSIAM5QBLPN32JBRFDQA
243,AHFSARGPE53GRGXLL456BIEJ2TBA,True,Fast shipping...,These are very warm and fit well,"January 8, 2019",poppadolf,4.0,0,https://www.amazon.ca/gp/profile/amzn1.account.AHFSARGPE53GRGXLL456BIEJ2TBA/ref=cm_cr_getr_d_gw_btm?ie=UTF8,2020-09-21 09:31:13.949714,2020-09-21 09:31:14.079522,Duofold Men's Mid Weight Wicking Thermal Pant,No,"1,117",B002G9UDYG,AEA5FEQDBSIAM5QBLPN32JBRFDQA
244,AEXUG76XRKEK3E576UAB6LD2MEFQ,True,Four Stars,"it's great, fits me just fine, super comfortable only it's a little bit thinner than i expected.","December 15, 2016",TitanicMarco ,4.0,0,https://www.amazon.ca/gp/profile/amzn1.account.AEXUG76XRKEK3E576UAB6LD2MEFQ/ref=cm_cr_getr_d_gw_btm?ie=UTF8,2020-09-21 09:31:14.083425,2020-09-21 09:31:14.230839,Duofold Men's Mid Weight Wicking Thermal Pant,No,"1,117",B002G9UDYG,AEA5FEQDBSIAM5QBLPN32JBRFDQA
245,AHU7SRPPMXNLQNNAV3K7QG5SRRLA,True,Five Stars,My husband loves his new Duofold Wicking Thermal pants - this material feels very soft & warm on skin,"December 15, 2017",Amazon Customer,5.0,0,https://www.amazon.ca/gp/profile/amzn1.account.AHU7SRPPMXNLQNNAV3K7QG5SRRLA/ref=cm_cr_getr_d_gw_btm?ie=UTF8,2020-09-21 09:31:14.235743,2020-09-21 09:31:14.351889,Duofold Men's Mid Weight Wicking Thermal Pant,No,"1,117",B002G9UDYG,AEA5FEQDBSIAM5QBLPN32JBRFDQA
246,AHYWWOGBGV7X76KWTZIX6SD73L5A,True,Good,Good pants keep you warm,"April 21, 2019",Luiz Felipe Montebello,5.0,0,https://www.amazon.ca/gp/profile/amzn1.account.AHYWWOGBGV7X76KWTZIX6SD73L5A/ref=cm_cr_getr_d_gw_btm?ie=UTF8,2020-09-21 09:31:14.355766,2020-09-21 09:31:14.494358,Duofold Men's Mid Weight Wicking Thermal Pant,No,"1,117",B002G9UDYG,AEA5FEQDBSIAM5QBLPN32JBRFDQA
247,AFAIWTGSYLVI5VW5PVG65JIOPTRA,True,Good product,Good quality,"March 4, 2019",Chris C,4.0,0,https://www.amazon.ca/gp/profile/amzn1.account.AFAIWTGSYLVI5VW5PVG65JIOPTRA/ref=cm_cr_getr_d_gw_btm?ie=UTF8,2020-09-21 09:31:14.505095,2020-09-21 09:31:14.624166,Duofold Men's Mid Weight Wicking Thermal Pant,No,"1,117",B002G9UDYG,AEA5FEQDBSIAM5QBLPN32JBRFDQA
248,AESXL5QTUUWN5YWJD5O6REDIADLA,True,comfortable. Great,"Soft, warm, comfortable. Great buy","December 16, 2017",James Rogers,5.0,0,https://www.amazon.ca/gp/profile/amzn1.account.AESXL5QTUUWN5YWJD5O6REDIADLA/ref=cm_cr_getr_d_gw_btm?ie=UTF8,2020-09-21 09:31:14.628069,2020-09-21 09:31:14.746166,Duofold Men's Mid Weight Wicking Thermal Pant,No,"1,117",B002G9UDYG,AEA5FEQDBSIAM5QBLPN32JBRFDQA
249,AHFTA2ZRO6UREZDJVX3ZTRBVHIAA,True,Excellent value for money,Great for winter,"July 30, 2019",Celine,5.0,0,https://www.amazon.ca/gp/profile/amzn1.account.AHFTA2ZRO6UREZDJVX3ZTRBVHIAA/ref=cm_cr_getr_d_gw_btm?ie=UTF8,2020-09-21 09:31:14.750069,2020-09-21 09:31:14.903300,Duofold Men's Mid Weight Wicking Thermal Pant,No,"1,117",B002G9UDYG,AEA5FEQDBSIAM5QBLPN32JBRFDQA
250,AEFU6PBWSALV2XBKF7DZHYRKPTUA,True,warm,warm,"December 31, 2017",CK,4.0,0,https://www.amazon.ca/gp/profile/amzn1.account.AEFU6PBWSALV2XBKF7DZHYRKPTUA/ref=cm_cr_getr_d_gw_btm?ie=UTF8,2020-09-21 09:31:17.034025,2020-09-21 09:31:17.207751,Duofold Men's Mid Weight Wicking Thermal Pant,No,"1,117",B002G9UDYG,AEA5FEQDBSIAM5QBLPN32JBRFDQA
251,AFGEFLVSIXMZD6BDXQ2LMHQNLBJQ,True,A not-to-freeze-balls must buy,"Not itchy like my previous long johns, a tad expensive but stil worth it","December 27, 2018",Sangye,5.0,0,https://www.amazon.ca/gp/profile/amzn1.account.AFGEFLVSIXMZD6BDXQ2LMHQNLBJQ/ref=cm_cr_getr_d_gw_btm?ie=UTF8,2020-09-21 09:31:17.211654,2020-09-21 09:31:17.322918,Duofold Men's Mid Weight Wicking Thermal Pant,No,"1,117",B002G9UDYG,AEA5FEQDBSIAM5QBLPN32JBRFDQA
252,AH2FHVHN6BT4T5PFOI2NFNLYEHOA,True,Five Stars,Nice and warm. Fit perfect.,"January 14, 2018",Mr. MRE,5.0,0,https://www.amazon.ca/gp/profile/amzn1.account.AH2FHVHN6BT4T5PFOI2NFNLYEHOA/ref=cm_cr_getr_d_gw_btm?ie=UTF8,2020-09-21 09:31:17.325846,2020-09-21 09:31:17.441013,Duofold Men's Mid Weight Wicking Thermal Pant,No,"1,117",B002G9UDYG,AEA5FEQDBSIAM5QBLPN32JBRFDQA
253,AGXRFNURFNAPI2XQPLWTKAN7WAIQ,True,Five Stars,"Are good,warm too!👍","December 23, 2017",Amazon Customer ,5.0,0,https://www.amazon.ca/gp/profile/amzn1.account.AGXRFNURFNAPI2XQPLWTKAN7WAIQ/ref=cm_cr_getr_d_gw_btm?ie=UTF8,2020-09-21 09:31:17.444918,2020-09-21 09:31:17.610838,Duofold Men's Mid Weight Wicking Thermal Pant,No,"1,117",B002G9UDYG,AEA5FEQDBSIAM5QBLPN32JBRFDQA
254,AGS3RTV7YSBFGX3LJAAG2BRQN43A,True,Five Stars,OK.,"April 14, 2018",Sajib Mandal,5.0,0,https://www.amazon.ca/gp/profile/amzn1.account.AGS3RTV7YSBFGX3LJAAG2BRQN43A/ref=cm_cr_getr_d_gw_btm?ie=UTF8,2020-09-21 09:31:17.614742,2020-09-21 09:31:17.731861,Duofold Men's Mid Weight Wicking Thermal Pant,No,"1,117",B002G9UDYG,AEA5FEQDBSIAM5QBLPN32JBRFDQA
255,AEHRWF3WTGH7T5QMPVKOTVXFOFVA,True,Nice Long Johns,A great pair of long johns to keep me warm in the Winter!,"January 21, 2016",Howard Hall,5.0,One,https://www.amazon.ca/gp/profile/amzn1.account.AEHRWF3WTGH7T5QMPVKOTVXFOFVA/ref=cm_cr_getr_d_gw_btm?ie=UTF8,2020-09-21 09:31:17.735765,2020-09-21 09:31:17.881190,Duofold Men's Mid Weight Wicking Thermal Pant,No,"1,117",B002G9UDYG,AEA5FEQDBSIAM5QBLPN32JBRFDQA
256,AEYP3DQDRVZ36TIP2BED6CATYEBQ,True,Very warm,Comfy,"January 31, 2019",Amazon Customer,5.0,0,https://www.amazon.ca/gp/profile/amzn1.account.AEYP3DQDRVZ36TIP2BED6CATYEBQ/ref=cm_cr_getr_d_gw_btm?ie=UTF8,2020-09-21 09:31:17.888022,2020-09-21 09:31:18.025638,Duofold Men's Mid Weight Wicking Thermal Pant,No,"1,117",B002G9UDYG,AEA5FEQDBSIAM5QBLPN32JBRFDQA
257,AFJ755I5KES2IQNO2KWPNFXID56Q,True,Confortable,i'm wearing it right now and seriously i don't even feel i'm wearing two pants!!,"November 8, 2018",Phuong Anh-Tuan Le,5.0,0,https://www.amazon.ca/gp/profile/amzn1.account.AFJ755I5KES2IQNO2KWPNFXID56Q/ref=cm_cr_getr_d_gw_btm?ie=UTF8,2020-09-21 09:31:18.031494,2020-09-21 09:31:18.154468,Duofold Men's Mid Weight Wicking Thermal Pant,No,"1,117",B002G9UDYG,AEA5FEQDBSIAM5QBLPN32JBRFDQA
258,AHP4H24YP476ILWZHFUTESYVTYVQ,True,Very good in extreme cold,Very good quality fits well and I kept me warm in very cold temperatures.,"January 29, 2019",Sal Curcio,5.0,0,https://www.amazon.ca/gp/profile/amzn1.account.AHP4H24YP476ILWZHFUTESYVTYVQ/ref=cm_cr_getr_d_gw_btm?ie=UTF8,2020-09-21 09:31:18.158372,2020-09-21 09:31:18.320388,Duofold Men's Mid Weight Wicking Thermal Pant,No,"1,117",B002G9UDYG,AEA5FEQDBSIAM5QBLPN32JBRFDQA
259,AESF7MTXDKDI4GFRKI4G53KELHXA,True,I’d buy again.,"Fit well, not too hot when indoors.","December 18, 2019",DONALD J ROSE,5.0,0,https://www.amazon.ca/gp/profile/amzn1.account.AESF7MTXDKDI4GFRKI4G53KELHXA/ref=cm_cr_getr_d_gw_btm?ie=UTF8,2020-09-21 09:31:18.324292,2020-09-21 09:31:18.441413,Duofold Men's Mid Weight Wicking Thermal Pant,No,"1,117",B002G9UDYG,AEA5FEQDBSIAM5QBLPN32JBRFDQA
260,AGK4WDHEMJZAEZT5WX5MANF5CPEA,True,Good quality. Warm.,Love these.,"November 4, 2018",Chris,5.0,0,https://www.amazon.ca/gp/profile/amzn1.account.AGK4WDHEMJZAEZT5WX5MANF5CPEA/ref=cm_cr_getr_d_gw_btm?ie=UTF8,2020-09-21 09:31:21.565274,2020-09-21 09:31:21.707769,Duofold Men's Mid Weight Wicking Thermal Pant,No,"1,117",B002G9UDYG,AEA5FEQDBSIAM5QBLPN32JBRFDQA
261,AE6IKXLNECFZDBRMJ555CFUDY2WQ,True,Good buy,"Nice and soft, easy care! Boyfriend loved them.","April 30, 2020",RM22,4.0,0,https://www.amazon.ca/gp/profile/amzn1.account.AE6IKXLNECFZDBRMJ555CFUDY2WQ/ref=cm_cr_getr_d_gw_btm?ie=UTF8,2020-09-21 09:31:21.711674,2020-09-21 09:31:21.839566,Duofold Men's Mid Weight Wicking Thermal Pant,No,"1,117",B002G9UDYG,AEA5FEQDBSIAM5QBLPN32JBRFDQA
262,AFUU4J4PWVJ7R2Z344H3HHZKZ4TQ,True,Five Stars,Keep me warm at 20 below!,"February 12, 2018",M  Clement  Hall,5.0,0,https://www.amazon.ca/gp/profile/amzn1.account.AFUU4J4PWVJ7R2Z344H3HHZKZ4TQ/ref=cm_cr_getr_d_gw_btm?ie=UTF8,2020-09-21 09:31:21.843471,2020-09-21 09:31:22.003533,Duofold Men's Mid Weight Wicking Thermal Pant,No,"1,117",B002G9UDYG,AEA5FEQDBSIAM5QBLPN32JBRFDQA
263,AFEAJMYF3SYIEEVBZVJQCYWXMJ4A,True,good long johns i'm wearing them,"good long johns
i'm wearing them now","February 28, 2017",david norman,5.0,0,https://www.amazon.ca/gp/profile/amzn1.account.AFEAJMYF3SYIEEVBZVJQCYWXMJ4A/ref=cm_cr_getr_d_gw_btm?ie=UTF8,2020-09-21 09:31:22.007437,2020-09-21 09:31:22.127485,Duofold Men's Mid Weight Wicking Thermal Pant,No,"1,117",B002G9UDYG,AEA5FEQDBSIAM5QBLPN32JBRFDQA
264,AH54GZ6B42BLGXZGTWGUKLHBT7PQ,True,Five Stars,Warm & Comfortable!!!,"April 12, 2017",Jay Yoon,5.0,0,https://www.amazon.ca/gp/profile/amzn1.account.AH54GZ6B42BLGXZGTWGUKLHBT7PQ/ref=cm_cr_getr_d_gw_btm?ie=UTF8,2020-09-21 09:31:22.131390,2020-09-21 09:31:22.286603,Duofold Men's Mid Weight Wicking Thermal Pant,No,"1,117",B002G9UDYG,AEA5FEQDBSIAM5QBLPN32JBRFDQA
265,AH7JXQOP4ZIN6I6WR3KBWF2WDIMQ,True,Five Stars,"Just like these pictures, it does fit pretty tight around your body.","November 20, 2017",Tony,5.0,0,https://www.amazon.ca/gp/profile/amzn1.account.AH7JXQOP4ZIN6I6WR3KBWF2WDIMQ/ref=cm_cr_getr_d_gw_btm?ie=UTF8,2020-09-21 09:31:22.291484,2020-09-21 09:31:22.421292,Duofold Men's Mid Weight Wicking Thermal Pant,No,"1,117",B002G9UDYG,AEA5FEQDBSIAM5QBLPN32JBRFDQA
266,AGIF3D26R2CMYIVAAGJQLCCF6XBA,True,Pas chaud,Il n’est pas chaud. Sinon il dègage bien l’humidité du corps.,"December 17, 2018",Ali,3.0,0,https://www.amazon.ca/gp/profile/amzn1.account.AGIF3D26R2CMYIVAAGJQLCCF6XBA/ref=cm_cr_getr_d_gw_btm?ie=UTF8,2020-09-21 09:31:22.426171,2020-09-21 09:31:22.564764,Duofold Men's Mid Weight Wicking Thermal Pant,No,"1,117",B002G9UDYG,AEA5FEQDBSIAM5QBLPN32JBRFDQA
